Title,Abstract,Name1,Company1,url
Creating Immutable Infrastructures with Kairos,"In this talk, we will introduce Kairos, an open-source project that aims to create immutable Operating Systems designed for Kubernetes. This includes a toolset that simplifies operations at the edge in a cloud-native way. 

Edge computing has become increasingly popular due to its ability to save costs by processing information closer to the data before sending filtered and computed information to a centralized application or data warehouse hosted in the cloud. Kubernetes is an ideal solution for edge computing because it natively builds components that facilitate the lifecycle management of modern edge applications.

However, as we scale the number of edge locations, we face operational challenges, such as interacting with cluster configurations at scale without creating unique configurations for each location, ensuring security for remote clusters and applications, upgrading Kubernetes clusters without specific domain knowledge, and minimizing disruptions during maintenance windows for smaller form factor hardware.

Kairos acts as an engine delivering immutable Kubernetes-enabled Linux OS from OCI conformant container images. It provides unique capabilities such as VPN peer-to-peer mesh, a distributed ledger to automate Kubernetes cluster bootstrapping and coordination, and zero-touch provisioning with a QR code scan. But more importantly, it uses a declarative model backed by Kubernetes CRDs. It manages distributed Kubernetes operations at the edge, from a centralized Kubernetes cluster.

In this presentation, we will explain the foundations and concepts of Kairos and demonstrate its capabilities.",Oluebube Princess Egbuna,,https://www.linkedin.com/in/egbunaoluebubeprincess/
Azure API Management: Architecting for Performance and Security,"This informative session offers a thorough exploration of Azure API Management, specifically delving into the nuances of enhancing API performance and ensuring robust security measures. Tailored for developers, architects, and IT professionals, the session aims to empower participants in harnessing Azure's capabilities for streamlined API management. The content seamlessly integrates theoretical insights with hands-on demonstrations, providing a holistic understanding of architecting APIs for optimal performance within the Azure environment. Attendees will gain practical knowledge on implementing effective security measures, ensuring a well-rounded comprehension of leveraging Azure API Management for efficient and secure API operations
",Rebai Hamida,,https://didourebai.medium.com/
Streamlined Microservices Orchestration on GKE,"# Embark on an Exciting Microservices Design Journey!

Join me as I unveil the unmatched spectacle of CI/CD, delving into the world of cutting-edge technologies. Witness the seamless integration of GKE, Helm, Cloud SQL Proxy, GitHub Actions, Docker, and Artifact Registry as we organize containerized microservices with unparalleled ease.

This discussion goes beyond technology; it’s a symphony of innovation, automation, and security deployment practices.

**Key Highlights:**
- Explore the power of GKE, Helm, Cloud SQL Proxy, GitHub Actions, Docker, and Artifact Registry.
- Experience a holistic approach to microservices design.
- Dive into the realms of innovation, automation, and security in deployment practices.",Shivam Kumar,,https://webworld.hashnode.dev/
Writing Kubernetes Operators with Golang,"Kubernetes Operators are used to extend the Kubernetes API to use our code and satisfy complex requirements of our own applications while simultaneously enjoying the benefits of Kubernetes

In this talk, we shall see what Kubernetes Operators are, what are Custom resources and how to write one in Go.",Animesh Rastogi,,https://www.linkedin.com/in/animeshrastogi54
How Enriching datasets approach using Apache Spark solves granular tracing issue in regulated financial services industry,"Apache Spark provides lot of options of joining the data for its data sets. This talk will focus on comparing the approach of Enriching the data (left outer join) versus filtering the data(inner join).How both approaches end up with same result and highlight the merits of Enriching the data approach helped us in CapitalOne. We at CapitalOne are heavy users of Spark from its initial days.This talk will provide more details of how we evolved from filtering to Enriching the data for credit card transactions and highlight what benefits we got by following Enriching the data approach. Being the financial institution, we are bound by regulation.We need to backtrace all credit card transactions processed thro our engine.Will be providing the details on how Enriching the data approach solved us this requirement. This talk will provide more context on how financial institutions can use Enriching the data approach for their Spark workloads and backtrace all the data they processed this approach. We have used the filtering approach in Production and what were it issues and why we moved to Enriching the data approach in Production will also be covered in this talk. Attendees will be able to take away the more details on Enriching and filtering options to decide on their use cases.",Gokul Prabagaren,,
The Art of Complex Deployments in Kubernetes Using Argo Rollouts,"""The Art of Complex Deployments in Kubernetes Using Argo Rollouts"" offers a deep dive into the advanced deployment capabilities of Kubernetes, facilitated by Argo Rollouts. In this session, Karan Jagtiani, a seasoned software engineer with extensive experience in DevOps and Kubernetes, will guide you through:

- The fundamentals of Argo Rollouts and its integration into Kubernetes.
- Detailed analysis of complex deployment techniques like canary and blue-green deployments.
- Real-world case studies demonstrating the effectiveness of Argo Rollouts in various scenarios.
- Practical tips for setting up, monitoring, and optimizing Argo Rollouts.
- Insights into overcoming common challenges and pitfalls in deployment processes.

This session aims to equip attendees with the knowledge and skills to implement sophisticated deployment strategies, ensuring high availability and reliability in their Kubernetes environments.",Karan Jagtiani,,https://karanjagtiani.com/
Journey Beyond: AWS Quest for Excellence,"For organizations that didn't rely on cloud services before it may be a challenging decision to define the right strategy for their AWS workload. MediaContact-Plus is one of the APA-Comm services that delivers your press information to top journalists and bloggers. The creation of this service kicked off the cloud journey in APA-Tech making MCP the odyssey for cloud-native integrations in the critical mission first application for media appliances. 

In this session, we will pass through how AWS powers the MCP and its evolution path to achieve operational excellence at all stages. Get into the unique perspective of how you can build and optimise the complete business offering with AWS.  You will pass through the hands-on perspective on AWS Managed Services, get vital hands-on tips, and strategic decision-making with special requirements for maximising your cloud experience. We will cover the essential CloudOps points, workload optimization, automation, challenges we have resolved over time, and how a variety of AWS services can be used to mitigate them.

This session is more than a walk-through and lessons learned; it's your guide to unlocking the full potential of AWS on a real production example and how to handle different cases with unusual approaches. Be prepared to elevate your understanding of AWS key services and gain practical wisdom for real-world production deployment.",Dmytro Hlotenko,,https://www.linkedin.com/in/dmytro-hlotenko-7aa348151/ https://medium.com/@lest173
Strategies for development and product management in SaaS: from idea to market success,"Evgeny Zagumennov, who holds the position of business development manager (product owner) at Yandex Cloud, will present his unique perspective on business development and product management strategies in the SaaS field. His talk will focus on the key aspects of creating and executing a successful SaaS business strategy, including product development, market positioning, and adaptation to changing market demands.
Evgeny will share his experience in planning and implementing strategies that promote business growth and sustainability in a dynamic IT environment. He will also look at the importance of considering user needs and expectations when designing a product, and how this impacts commercial success.
This report will be useful for professionals interested in deepening their knowledge of strategic planning and management in the SaaS industry, as well as for those seeking to develop their professional skills and careers in IT. Evgeny will emphasize how important it is to combine technical knowledge with business strategy to achieve success in the IT market.",Evgeny Zagumennov,,https://www.linkedin.com/in/euzagum/
Event-Driven Architectures: Orchestrating Cloud Native Workflows,"Modern applications demand agility and scalability, and event-driven architectures (EDAs) are at the forefront of this evolution. In this talk, we will explore the fundamentals of EDAs and their role in orchestrating cloud-native workflows. From event sourcing to message-driven microservices, we'll dissect the components that make EDAs a game-changer.

Key Topics:

- Understanding the core concepts of event-driven architectures
- Implementing event-driven workflows with cloud-native tools
- Real-world use cases and success stories
- Best practices for designing resilient and scalable systems
- Overcoming common challenges in EDA adoption

Join me for a dynamic and interactive session that will empower you to harness the full potential of event-driven architectures in your cloud-native projects.",Md. Mostafa Al Mahmud,,https://www.linkedin.com/in/md-mostafa/
Why repair a burning house? A guide to incident management,"You wouldn't rebuild a house until the fire is out, so why would you try to ""fix"" the incident until service is restored?
A (hypothetical) tale, definitely not based on hundreds of software incidents",Richard Finlay Tweed,,https://tales.fromprod.com/
Navigating the Digital Landscape with Intelligent Full Stack Observability,"
By incorporating observability at an earlier stage in the software lifecycle, engineers can anticipate and address performance issues that might typically go unnoticed until the code is running in a production environment. In this presentation, we will explore the utilization of AI/ML capabilities on AWS. AIOps empowers organizations to establish an advanced, proactive full-stack observability model, facilitating automated responses to emerging issues and leveraging data for enhanced resilience and optimization.",Manik Kashikar,,https://www.linkedin.com/in/manik-kashikar-7086b715/
Scalable and Secure Deployments with Cloud-Native AWS CodePipeline,"At its core, AWS CodePipeline is Amazon Web Services' cloud-native continuous integration and continuous delivery service, allowing users to automate the build, test, and deployment phases of their release process. Tailored to the vast AWS ecosystem, CodePipeline leverages other AWS cloud services, making it a seamless choice for teams already integrated with AWS cloud infrastructure. It promises scalability, maintenance ease, and enhanced security, characteristics inherent to many managed AWS services. We primarily compare this with Jenkins – an open-source automation server with a storied history. Known for its flexibility, Jenkins has garnered immense popularity thanks to its extensive plugin system. It's a tool that has grown with the CI/CD movement, evolving from a humble continuous integration tool to a comprehensive automation platform that can handle everything from build to deployment and more. ",Prithvish Kovelamudi,,
Architecting Resilient Microservices: A Deep Dive into Building a Service Mesh with Envoy,"In this presentation, we will delve into the intricacies of architecting resilient microservices by leveraging the power of a service mesh with Envoy. As organizations increasingly adopt microservices architectures, ensuring the resilience and reliability of these distributed systems becomes paramount. This talk aims to provide a comprehensive understanding of how to build a robust service mesh using Envoy, a high-performance proxy, as the cornerstone.
  We will also discuss some of the use cases and solutions built using service mesh with envoy.",Manik Kashikar,,https://www.linkedin.com/in/manik-kashikar-7086b715/
Benefits of using serverless in your projects,"**Abstract**:

In the rapidly evolving world of cloud computing, the term 'serverless' is more than just a buzzword; it's a game-changer for software development. This talk aims to demystify the concept of serverless architecture and demonstrate the tangible benefits it brings to your projects.

Join us as we dive into the essence of serverless computing, focusing on how AWS serverless services can significantly enhance your development speed while simultaneously reducing project costs. We'll explore the pivotal AWS serverless services that are reshaping the development landscape.

**Key Highlights**:

1. **Understanding Serverless**: Grasp the core principles of serverless architecture and its impact on modern software development.
2. **AWS Serverless Services**: Get acquainted with the most crucial AWS serverless offerings, understanding their roles and how they interconnect to provide a comprehensive solution.
3. **Cost-Efficiency and Scalability**: Learn how serverless computing makes financial sense for your business by offering a pay-as-you-go model, ensuring you only pay for what you use, and effortlessly scales with your needs.
4. **Live Demonstration**: Witness a real-time demonstration where we'll build a simple website and API using AWS serverless technologies. Experience firsthand the ease and speed of serverless development.

**Who Should Attend**:

This talk is tailored for cloud architects, software developers, and IT professionals who are keen to harness the potential of serverless architecture in their projects. Whether you're new to the concept or looking to refine your serverless strategy, this session will provide valuable insights and practical knowledge.

**Takeaway**:

Embark on a journey to understand the fundamentals of serverless computing, explore AWS's pivotal serverless services, and witness the creation of a serverless website and API from scratch. Leave the session equipped with the knowledge and confidence to leverage serverless technology in your projects, ensuring cost-efficiency, scalability, and rapid development.",Igor Ivanovic,,https://www.linkedin.com/in/ivanovicigor/
Can we implement asynchronous circuit breakers with serverless architecture?,"Join the adventure as we navigate the thrilling world of serverless applications facing the notorious 'trust no one' challenge while dealing with sporadic third-party API outages. In this mind-bending journey, discover unconventional solutions for an entirely asynchronous and event-driven architecture.

Ever wondered how to safeguard your app like a rock star at a concert? Meet the Async Circuit Breaker, the unsung hero backstage that keeps your performance from turning into chaos when external APIs hit a sour note.

Learn how to adapt the legendary synchronous circuit breaker concept to the asynchronous stage, ensuring your app rocks on gracefully even in the face of unexpected outages. Explore two ingenious approaches, from self-healing Lambda functions dynamically adjusting throughput to leveraging Dead Letter Queues (DLQ) as a subtle yet effective circuit breaker.

Dive deep into the tech buzzwords and witness how to protect your serverless marvels from third-party mayhem. Ready to break the mold? Buckle up for a session filled with out-of-the-box solutions and engage in a constructive discussion that might just change the way you tackle circuit breakers in your asynchronous serverless environment",Marcos  Henrique,,https://dev.to/wakeupmh
Best practices to manage AWS streaming data pipeline at scale,"The talk will cover best practices to manage streaming pipelines at scale to handle more than 1B+ events per day using AWS services to support real time analytics.Talk will cover topic such as canary implementations, shards management, lineage tracking and reconciliation process at scale to manage steam data and bring overall accuracy in data flow.  I will be covering an example of a framework that I have designed at AWS to process infrastructure logs at scale and provide visibility into over vulnerable hardware in the AWS ecosystem.  ",Akshay Dineshkumar Jain,,https://www.linkedin.com/in/akshaydjain/
Patterns for efficient serverless development,"Serverless is a very different paradigm from how we used to build software, and many people are struggling with the shift in mindset and approach.

But serverless doesn't have to be hard. Once you figure out the ""how"", it'd be like getting a superpower, you will be able to do much more with less time and effort and build better software faster.

Yan has run serverless workloads in production since 2016 and has made all the mistakes so you don't have to. He's going to show us what works and what doesn't.

He will walk us through a day in the life of a serverless developer, showing you how to write and test serverless applications, how to leverage ephemeral environments, how to manage CI roles, and architectural patterns and best practices for building scalable, secure and cost-efficient applications in the cloud.",Yan Cui,,http://theburningmonk.com
Cloud Native Late Bloomers: Overcoming Fears and Finding Leadership,"In recent years, companies have embarked on digital transformations, embracing CNCF technologies like Kubernetes, Prometheus, and ArgoCD for their daily tech needs. It is important to recognize that CNCF projects thrive on human contributors in order to keep them going.

Many longtime software developers have spent years working with closed-source tooling and have had limited exposure to open source software (OSS). As their companies embarked on a cloud native transformation they were suddenly exposed to the vibrant community around CNCF OSS projects, including easy access to project maintainers.

While focus on recruiting open source contributors often centers on entry-level engineers and non-coders, it's important to consider experienced engineers who adopted Cloud Native technologies later in their careers. Many seasoned developers hesitate to contribute due to feeling underqualified or uncertain, limiting the potential for valuable contributions. 

This session shows that it's never too late to contribute to open source, by addressing these fears. It explores the late-blooming Cloud Native journey of one seasoned engineer's evolution from consumer to contributor to leader, and the hurdles she overcame. Key takeaways include the importance of contributing to Cloud Native open source at any career stage and the business value unlocked through community engagement.

For consumers of open source software, contributing is a way to give back, improving the software that so many rely on. Start contributing now, as it's never too late!",Adriana Villela,,https://adri-v.medium.com
Embracing Platformless: A Revolutionary Approach to Enterprise Software Engineering,"In this session, Asanka introduces ""platformless"" computing – a groundbreaking framework for enterprise software engineering with potentially greater impact than the move from app server to serverless. He will unravel how shifting from traditional platform-centric models to a platformless strategy simplifies and enhances the application development and delivery process. Focusing on key concepts like API-first, cloud native middleware, platform engineering, and developer experience (DX), the presentation will showcase how platformless integrates these elements for increased agility and innovation. Attendees will learn how this approach can fundamentally transform enterprise software engineering, emphasizing efficiency, scalability, and a focus on creating impactful applications.",Asanka Abeysinghe,,https://blog.architect2architect.com/
Cloud agnostic & multi tenant application challenges and solutions,"Building a cloud-agnostic multi-tenant Software as a Service (SaaS) application poses several challenges, given the diverse nature of cloud platforms and the need to cater to different tenants with varying requirements. In this session, I'll share lessons learned after building a few cloud-agnostic multi-tenant SaaS applications. This session focuses on building applications rather than cloud infrastructure. The high-level agenda is as below:-
- What is Cloud Agnostic?
- Why Cloud Agnostic?
- How to design cloud agnostic app?
- Challenges
- Best practices to build multi tenant SaaS application",Abhay Dutt Paroha,,
Unlock Efficiency: Cost-Effective Kubernetes Workload Optimization with KEDA and Karpenter,"Embark on a journey to revolutionize your Kubernetes workloads and streamline costs! Our pitch, ""Cost-Efficient Optimization for Workloads in Kubernetes (EKS) with KEDA and Karpenter,"" is your gateway to resource efficiency, scalability, and Kubernetes excellence.

In a world where efficiency is paramount, imagine dynamically scaling workloads based on demand, optimizing resource consumption with KEDA. Visualize automated node scaling, thanks to Karpenter, ensuring optimal resource allocation and reducing operational overhead.

Join us to discover how KEDA and Karpenter, in harmony with Kubernetes (EKS), can reshape your infrastructure, making it lean, agile, and cost-effective. The future is efficient, and we invite you to unlock this efficiency without compromising performance.

Ready to optimize costs without compromise? Let's unlock efficiency together with KEDA and Karpenter! ",Naresh Waswani,,https://www.linkedin.com/in/nwaswani/
Demystifying Storage in Kubernetes,"Demystifying Storage in Kubernetes
=============================

A founding fact of Kubernetes is rooted in running stateless, scale-out, lightweight containers, believe it or not, almost 9 years after going open source, such workloads form a good majority in any cloud native ecosystem, what about stateful ones? Nah, we will rather use VMs, Kubernetes storage, just way too complex and often fragile. That's what we hear even from seasoned pros.

Honestly, not their fault either, container and Kubernetes native storage has been on an evolution path but all signs have looked promising, running stateful applications such as databases is a now a reality for many enterprises who embraced cloud native. Kubernetes from it's really early versions have supported many constructs to bring persistent storage as a first class citizen, built-in and not bolt-on as they say. In-tree volumes, PersistentVolume, PersistentVolumeClaim, StorageClass are some of the native Kubernetes ""kinds"" which you have probably heard and used both, then came along the game changer, the Container Storage Interface specification (CSI), which unlocked the storage innovation and allowed experts in this field to independently improve the state of storage in Kubernetes.

Today, we see projects like Long Horn, Open EBS, Rook and many commercially provided & supported solutions pioneering in this space, yes storage remains a relatively harder aspect of managing Kubernetes native workloads but it's not a novelty anymore, thanks to CSI spec, which drove Kubernetes adoption for running even mission critical databases. While all of it sounds a lot to chew upon, once you get your fundamentals correct, nothing seems impossible!

In this talk, we will start at a very fundamental level of understanding container storage in general and scale our way up to how Kubernetes deals with storage needs of your workloads, what is CSI and how it works, we will finish the talk with a live demo on running stateful application (a database) in a K8 cluster which uses an open source CSI provider to meet the storage demands.
",Rohit Mishra,,https://www.linkedin.com/in/rohit-mishra-bb83b932/
Modernize without the madness: Transforming monoliths to microservices in a phased approach,"The monolithic architecture, while providing stability and familiarity, can become a bottleneck for innovation and agility. Migrating to a microservices architecture offers numerous benefits, such as improved scalability, maintainability, and deployment speed. However, undertaking such a large-scale transformation can be daunting, often leading to project complexity and disruption.

This session presents a practical and phased approach to effectively modernize applications, while minimizing risk and ensuring business continuity. We will explore the strangler fig pattern, a proven strategy that gradually replaces monolith functionality with new microservices, effectively ""strangling"" the old system while keeping it operational. By the end of this session, attendees will gain valuable insights and actionable strategies to embark on their own modernization journey.",Hareesh Iyer,,https://www.linkedin.com/in/hareeshiyer?original_referer=https%3A%2F%2Fwww.google.com%2F
