Title,Abstract,Name1,Company1,url
Scalability and Cloud Native Architecture on AWS,"This talk aims to explore systems that must grow alongside business outcomes. I will first discuss when it is optimal to scale cloud resources. Then, I will talk about leveraging architectural patterns to gain the most from AWS and build scalable, secure, and performant data systems. The audience will be equipped with tools to assess the effectiveness and cost-efficiency of their systems by interpreting vital signs. This informative presentation is suitable for individuals of all expertise levels. Practical illustrations from real-world scenarios will animate the concepts and highlight the inevitable trade-offs technologists will encounter. Rather than fixating solely on technological perfection, I will underscore the significance of evaluating various business outcomes.
",Gaurav Raje,,
From Baremetal to Kubernetes: YDB’s Journey,"This case study aims to demonstrate how large-scale bare-metal deployments of stateful applications, like YDB, an open-source distributed database, can be integrated into Kubernetes. It has long been assumed that Kubernetes is primarily suited for stateless applications. However, in this talk, we will explore the challenges of managing stateful workloads: for instance, how to solve a particular problem of attaching YDB to raw block devices to achieve optimal performance while maintaining security.

Additionally, Kubernetes itself offers significant value. With the help of a Kubernetes operator, maintenance tasks can be automated, ensuring database cluster awareness. For example, during version updates, it is crucial to bulk-update only the nodes that won't impact the overall performance of the database cluster.

Applications rarely require access to drives as raw block devices. In order to obtain maximum performance, YDB communicates with drives in block mode, without any filesystem. A number of issues arise. How to maintain POSIX locks on drives, so that each drive can be used only by one container at a time? We will share our experience and several useful practices developed along the way.",Egor Tarasov,,
Scaling Secrets in Kubernetes: A Secure Multi-Cluster Approach,"A secret is any piece of information that you want to keep confidential, such as API keys, passwords, certificates, and SSH keys.

External Secrets Operator is an open source Kubernetes operator that integrates external secret management systems like HashiCorp Vault, Google Secrets Manager and many more. The goal of External Secrets Operator is to synchronise secrets from external APIs into Kubernetes. It reads information from external APIs and automatically injects the values into a Kubernetes Secret. If the secret from the external API changes, the controller will reconcile the state in the cluster and update the secrets accordingly.

To manage secrets across multiple Kubernetes clusters, External Secret Operator can be deployed in the management cluster. Sveltos can then be used to distribute the secrets to managed clusters.

The integration of External Secrets Operator and Sveltos enables a powerful solution for managing secrets in a Kubernetes environment.

By combining these tools, platform admin can effortlessly fetch secrets from external secret management systems and securely distribute their content to a multitude of Kubernetes clusters.

The integration of External Secrets Operator and Sveltos brings several benefits:
- Centralized Management: Secrets are managed and retrieved from external systems within the management cluster, streamlining the process and reducing complexities.
- Enhanced Security: Secrets are encrypted and stored securely in the external secret management systems, ensuring data confidentiality.
- Automated Updates: When secrets change in the external secret management systems, the External Secrets Operator automatically updates the Kubernetes Secrets in the management cluster, ensuring synchronization.
- Consistency Across Clusters: Sveltos ensures that fetched secrets are consistently distributed to all managed clusters, providing a unified and secure approach to secret management.
- Scalability: The solution is designed to scale efficiently, accommodating a multitude of Kubernetes clusters while maintaining performance and security standards.",Gianluca Mardente,,https://www.linkedin.com/in/gianlucamardente/
"From edge to cloud, creating data pipelines using open-source technologies on Kubernetes.","During this presentation, we embark on an immersive journey into a tangible scenario—an exemplification of the process of capturing real-time modifications within a relational database. The focal point is a meticulously configured connector that harnesses the capabilities of Debezium and Apicurio Registry. This captured data is then seamlessly channeled into Kafka, adopting Avro's compact binary format. To fully unlock the potential of this captured data, tools like ksqldb and kafka-ui step into the spotlight. These instruments not only visualize the dynamic changes but also empower users to curate streams and craft queries that operate atop this streaming data landscape. Join us in this session to navigate the intricacies of this transformative narrative.",Carles Arnal,,
Mastering Generative AI: Harnessing AWS GenAI for Your Solutions,"AWS GenAI offers a plethora of tools for generative AI applications. In this talk, we'll journey through the suite of offerings from Amazon Bedrock's scalable solutions to the cost-effective training and inference capabilities of AWS Trainium and Inferentia. We'll discuss how Amazon CodeWhisperer can supercharge your coding efforts and delve into the power of Hugging Face on AWS. We will also explore Amazon SageMaker's capabilities for building, training, and deploying generative models. Come, join us as we unravel the complexities of AWS GenAI and pave the way for innovation and efficiency.",Samuel Baruffi,,
Ephemeral Environments 101,"## What are ephemeral environments?
Ephemeral environments are standalone deployments of your feature branches. In order to provide value to your SDLC, they must mimic production. This means they'll have production-like data and dependencies. Ephemeral environments are the modern answer to the archaic 24/7 staging environment: they can be spun up upon a PR, and spun down upon merge. 

## Why should I use ephemeral environments?
Running your E2E tests in staging is becoming an anti-pattern. You can shorten the inner dev loop by building environments based on each feature branch. This way, as soon as a dev completes a feature, they can run their E2E suite directly against the branch and fix any bugs right when the tests complete. Catching bugs on feature branches leads to fewer bugs in staging *and* production. 

Not only are ephemeral environments a solution for testing, but they also make cross-team collaboration easier. Instead of a screen-share Zoom call, you can send your peers SSO-enabled links to your environments. This way, they can interact with your feature branch's environment and provide async feedback.

## How do I build my own ephemeral environment solution?
Since ephemeral environments are elastic, you'll want to use Kubernetes to scale your services. Each of your app's services should exist within a container so they remain secure and are packaged with all required dependencies. It is best practice to use Docker Compose as your application definition.",Natalie Lunbeck,,
Unlock the Power of Serverless Computing with Cloud Functions,"As a speaker, I would also disucss:
- Presenting case studies of example serverless applications that have been built with Cloud Functions.
-Our session dives into the transformative world of serverless computing, unpacking its benefits and guiding attendees through Cloud Functions' features for seamless application development and deployment

And why I am the person for it as I have disucssed this sort of topic before in conferences like HashiTalk ,Devfest and more .",Neel Shah,,https://www.linkedin.com/in/neel-shah-07460218a/
Practical AI with Machine Learning for Observability in Netdata,"Machine Learning for observability can be challenging, given the uniqueness of each workload. However, we can leverage ML to detect individual component anomalies, even if they are sometimes noisy/imprecise. At Netdata, we use ML models to analyze the behavior of individual metrics. These models adapt to the specific characteristics of each metric, ensuring anomalies can be detected accurately, even in unique workloads.

The power of ML becomes evident when these seemingly noisy anomalies converge across various services, serving as indicators of something exceedingly unusual. ML is an advisor, training numerous independent models for each individually collected metric to achieve anomaly detection based on recent behavior.

When multiple independent metrics exhibit anomalies simultaneously, it is usually a signal that something unusual is occurring. This approach to ML can be instrumental in uncovering malicious attacks and, in many cases, predicting combined failures across seemingly unrelated components.",Costa Tsaousis,,https://www.netdata.cloud/
"Forget Developer Platforms, Think Developer Productivity!","Developer platforms are getting a lot of hype right now. But that’s just something big companies do, and it means setting up a huge Kubernetes cluster and deploying Backstage. Right? Wrong! Actually, it is all about improving developer productivity, and that is important for a single developer, or a company with tens of thousands of IT professionals. It also means that the tools, services and artefacts needed to boost productivity can be widely different, and there is no default solution. 

In this talk, we will discuss the latest research on how you can measure and improve Developer Productivity. Then, we will look at actual tools and methods that make you more productive as an individual, a team or a whole company. And you might call this a developer platform, or not. That’s OK. 
",Christian Denich,,https://www.linkedin.com/in/christian-denich/
Monolith to Microservice:  Accelerate your Modernization with Containers (App2Container) and AWS Migration Hub Refactor Spaces,"Having successfully migrated a monolithic application to AWS, you now have access to AWS Tools and Services that can accelerate your modernization journey to a micro-services architecture. We'll cover the Strangler Fig pattern - an industry standard modernization approach. We'll deep dive on common AWS Services - Containers, Serverless and Database.

We'll be hands-on as we go. We'll use AWS App2Container to jump start our application’s containerization and deploy it to Amazon Elastic Containers Service (Amazon ECS). We'll then turn to AWS Migration Hub Refactor Spaces to demonstrate how you can modernize a monolith faster by leveraging Amazon CodeWhisperer and Amazon Q to accelerate your application modernization. ",Richard Lees,,https://www.linkedin.com/in/richalees/
Designing streaming data pipelines: Best Practices and Considerations,"It's a great session for data engineers and data scientists to understand how streaming is different from batch and how it can enable real time machine learning. I will also walk through the real life production grade issues and lessons from the field on how to design and architect petabyte scale streaming systems. This talk was well received at IEEE Cloud Data Conference 2023, IDEAS Global Data and AI Summit 2023, The Data and Machine Learning Summit by Seattle Data Guy 2023.",Ankit Virmani,,https://www.linkedin.com/in/ankitvirmani/
Discover the Unseen: Tracking SES with CDK and TypeScript.,"Transformational voyage into Amazon SES by using CFDK! This will be an exciting discussion where we will open up and delve into the undetectable aspects of your email environment. Set up CloudWatch metrics and alarms for your emails using the CDK to enable live monitoring of your messages and take them a notch higher. The sessions cover strategies for translating delivery rates and maximising customer engagements, among others, to make emails more powerful and interactive. Have a fascinating journey with us that uncovers the secrets behind the Amazon SES and gives you access to all observability systems. Combine the powerful CDK magic with email observability for an elevated email strategy you can use 🌐✉️",Marcos  Henrique,,https://dev.to/wakeupmh
Advanced API Design for Scalable and Fault-Tolerant Data-Intensive Distributed Systems,"This proposal delves into RESTful principles, asynchronous operations, security considerations, techniques for optimizing data retrieval through pagination and filtering, exploration of caching and rate limiting, importance of idempotent operations and error handling in maintaining data consistency and facilitating seamless integration with evolving systems.


Learning objectives:

This topic aims to provide practical insights and guidelines for modern software engineers, architects, and developers involved in the creation and evolution of APIs for data-intensive distributed systems. By adopting the proposed advanced API design principles, organizations can achieve a balance between scalability, performance optimization and fault tolerance, ultimately contributing to the success of their distributed computing initiatives.


Advanced API Design:

1. RESTful Principles:
RESTful principles form the foundation of well-structured APIs, emphasizing stateless communication, resource-oriented design, and standard HTTP methods.
Adhering to RESTful principles ensures a standardized, scalable, and easily maintainable API architecture. It facilitates clear communication between clients and servers, promoting a consistent and predictable user experience.

2. Asynchronous Operations with Webhooks:
Asynchronous operations allow decoupling of processing tasks from the main application flow, while webhooks enable real-time communication by pushing data to subscribed servers when specific events occur.
By incorporating asynchronous operations and webhooks, APIs can handle time-consuming tasks efficiently, minimize latency, and provide real-time updates. This contributes to improved responsiveness and scalability, particularly in systems with fluctuating workloads.

3. Security:
Authentication mechanisms (e.g., OAuth, API keys), authorization strategies, data encryption (HTTPS), and protection against common security threats.
Security measures are paramount to safeguard data integrity, confidentiality, and prevent unauthorized access or malicious attacks. Robust security practices instill trust in the API and protect sensitive information from potential breaches.

4. Pagination and Filtering:
Pagination involves breaking down large result sets into manageable pages, while filtering allows clients to request specific data based on criteria.
Pagination and filtering optimize data retrieval, reduce bandwidth consumption, and enhance API performance, especially when dealing with large datasets. This ensures efficient use of resources and minimizes response times.

5. Caching:
Caching involves storing copies of frequently accessed data to reduce redundant computations or database queries.
Caching enhances API performance by minimizing the need for repeated data retrieval. It reduces latency and conserves resources, making it particularly beneficial for read-heavy operations and improving overall system responsiveness.

6. Rate Limiting:
Rate limiting restricts the number of requests a client can make within a specified time period.
Rate limiting prevents abuse, ensures fair resource usage, and protects the API from being overwhelmed by excessive requests. It promotes stability, reliability, and fair access to resources.

7. Idempotent Operations:
Idempotent operations produce the same result regardless of how many times they are executed.
Idempotence ensures consistency in the face of network issues or retries. It reduces the risk of unintended consequences, making operations more predictable and resilient.

8. Error Handling and Resilience:
Clear, standardized error responses, along with mechanisms for graceful error handling and recovery.
Effective error handling and resilience mechanisms contribute to the overall reliability of the API. Well-designed error responses enable clients to understand and respond appropriately to unexpected situations, while resilience ensures continued functionality despite failures.
",Santosh Nikhil Kumar,,https://www.linkedin.com/in/santoshadireddy/
Just don’t do it – Databases in Kubernetes,"You are not really crazy, are you? Running your beloved database in Kubernetes? This infrastructure is built to break and my database should not break! What actually is this Cloud Native nonsense? The latest and greatest marketing gig, let’s get out our buzzword-bingo cards!
Or… should we? Join me for an exploration of Cloud Native, Data on Kubernetes, why databases in containers make much sense, and why much of the fear is from a previous era. In this talk, you will see why more and more organizations look at Cloud Native infrastructures for deploying critical data workloads. You will explore options and opportunities for creating modern application architectures without having to fall into a split between your application and your back end.",Jan Karremans,,https://www.cybertec-postgresql.com/
The Future of the Cloud is WebAssembly,"Computing paradigms have come a long way from a solitary server down the hall to microservices with serverless functions. Now the time is right for a new wave of cloud compute.
WebAssembly is garnering a lot of excitement because of it's unique combination of portability, security, and performance. Because of these features, it is the perfect technology to build serverless applications.
This talk covers the virtues of WebAssembly as a cloud-side compute runtime including :
* How it works under the hood
* How it has support for numerous languages
* How it can run on many architectures and operating systems
* How it is lightweight and blazingly fast!
The session will also include a live code demo as we build a Wasm web app with Spin - an open source framework",Sohan Maheshwar,,http://sohan.co/videos.html
So You Want To Build An Event Driven System?,"Making your system 'event driven' is a common consideration when building modern systems. Especially if these applications leverage serverless technologies. But what does that actually mean in the real world? What are the benefits of adopting this architecture style, what are the challenges and some of the tradeoffs?

In this session, you'll learn all about that and more with tips taken from building event driven systems in the real world. Starting from why, understanding what and plenty of practical things you can take away and use in your own applications. From the simple, through to some advanced integration patterns that this architecture style unlocks. to improve the resilience, extensibility and scalability of your systems.",James Eastham,,https://www.youtube.com/@serverlessjames
Build cloud native apps anywhere!,,Pierre-olivier Patin,,https://www.linkedin.com/in/pierreolivierpatin/
AWS services,"Hello everyone,

I am thrilled to share my journey of diving into the world of Amazon Web Services (AWS). As a newcomer, I recently passed the AWS Cloud Practitioner exam, marking the first milestone in my cloud computing journey.

AWS, a comprehensive and broadly adopted cloud platform, offers over 200 fully-featured services from data centers globally. It's a vast universe, and stepping into it might seem daunting at first. However, the beauty of AWS lies in its ability to cater to everyone, from beginners to seasoned professionals.

Passing the AWS Cloud Practitioner exam was my first interaction with this universe. This foundational level certification provided me with a broad understanding of AWS. It covered core architectural principles, key services, security, and pricing models. It was like getting a tour of a new city, acquainting myself with its landmarks.

But the journey doesn't stop here. AWS is continually evolving, and there's always something new to learn. The next step for me is diving deeper into specific areas of interest. Whether it's computing power, database storage, content delivery, or machine learning, AWS has a path for it.

In conclusion, embarking on the AWS journey has been both challenging and rewarding. The AWS Cloud Practitioner exam was a great starting point, providing a solid foundation and sparking curiosity to explore further. I am excited about the journey ahead and look forward to unlocking new opportunities in the cloud computing landscape.

Thank you for allowing me to share my experience. I hope it encourages others to embark on their own AWS journey. Remember, every expert was once a beginner. Happy cloud computing!",Satbir Singh,,https://www.linkedin.com/in/satbir08/
Architecting Resilient Cloud Native Applications: A Practical Guide to Deployment and Runtime Patterns,"The rise of cloud-native architectures has revolutionized software development, enabling rapid deployment, scalability, and agility. However, this shift comes with inherent challenges, as cloud-native applications are more susceptible to failures due to their distributed nature and reliance on external services. To ensure the robustness and availability of these systems, architects and developers must employ effective resiliency patterns.

**Key Points:**

- **Deployment Patterns:**
    - Blue/Green Deployments: Simultaneously maintain two environments, seamlessly switching between them to minimize downtime.
    - Canary Deployments: Roll out new code gradually to a small subset of users, monitoring performance before wider rollout.
    - Dark Launches: Release new features to a subset of users without exposing them publicly, gathering feedback before full deployment.
- **Runtime Resiliency Patterns:**
    - Timeouts/Retries: Set time limits for responses and retry failed requests, mitigating intermittent failures.
    - Circuit Breakers: Temporarily disable failing services to prevent cascading failures, ensuring system stability.
    - Bulkhead: Limit the impact of failures by isolating services, preventing failures from spreading across the system.
    - Rate Limiting: Control the flow of incoming requests to prevent overload and ensure fair resource distribution.

**Why This Talk Matters:**

In a world increasingly demanding seamless and reliable digital experiences, resilient cloud-native applications are the cornerstone of success. This talk empowers developers and architects to design, implement, and manage resilient systems that can withstand disruptions, maintain uptime, and deliver exceptional user experiences. By mastering the deployment and runtime patterns discussed, you'll equip yourself with the tools to build robust, fault-tolerant applications that form the backbone of modern software ecosystems.",Ricardo Castro,,https://mccricardo.com
Unleash GenAI while remaining cost-effective with serverless,"GenerativeAI is rapidly reshaping the tech landscape. Its implementation, especially in intricate scenarios, often involves a sophisticated dance among application code, users, and multiple Large Language Models (LLMs). The complexity of coordinating these elements extends beyond the capabilities of basic API calls. While some vendors offer means to access LLMs, they fall short in guiding developers to construct an LLM framework that effectively balances responsiveness, accuracy, and cost-efficiency. Consequently, many projects grapple with unforeseen costs, pushing them beyond budget.

Addressing this challenge, our proposal centers on a serverless architecture. This approach adeptly orchestrates various language models, from Foundational to fine-tuned variants. It supports developers and organizations in building forward-thinking projects with specific Cloud Development Kit (CDK) constructs, tailored for effective model monitoring and coordination.

This talk delves into the GenAI solutions arena, highlighting diverse model approaches, whether deployed via APIs or other means. We will spotlight serverless architectures using AWS Lambda, AWS StepFunctions, and Amazon Bedrock, citing real-world applications. To streamline complexity, we transform these architectural elements into CDK constructs, offering developers a rapid and efficient launching pad for their projects.",Luca Bianchi,,https://www.linkedin.com/in/lucabianchipavia/
