Panel,Featured,Track,Name1,JobTitle1,Company1,Name2,JobTitle2,Company2,Title,Abstract,LinkedIn1,Twitter1,LinkedIn2,Twitter2,Slides,Picture,YouTube,Keywords,Duration
Yes,,,,,,,,,Bridging Science and Spirituality: The Future of Mobile Digital Knowledge Management - Panel Discussion,"Join [Srinivasa Rao Bittla](https://www.linkedin.com/in/bittla/), [Ranita Ganguly](https://www.linkedin.com/in/dr-ranita-ganguly-0a904534/) & [Priyam Ganguly](https://www.linkedin.com/in/priyam-ganguly-3743a566/) for an amazing Panel Discussion!

This Panel presents a mobile-first Android-based Content Management System (CMS) for Scientific Spiritualism, merging empirical science with spiritual wisdom. We explore its modular architecture, AI-driven personalization, and real-time content synchronization, showcasing how mobile technology can revolutionize interdisciplinary learning, enhancing accessibility, engagement, and structured knowledge dissemination in a connected digital world.",,,,,,Golang_2025_Panel_Discussion.png,https://youtu.be/S9OVs5D_ijA,"panel,discussion",
,Yes,,Smita Verma,Senior Technical Product Manager,Adobe,,,,Go Secure: Building Resilient Telemedicine Platforms with Military-Grade Protection,Discover how Go powers military-grade security for telemedicine platforms protecting millions of patient records daily. Learn battle-tested strategies to build impenetrable healthcare systems that maintain compliance without sacrificing performance or user experience.,https://www.linkedin.com/in/vermasmita/,,,,Smita Verma - Conf42 Golang 2025.pdf,Smita Verma_golang.png,https://youtu.be/Dun4JaOBM94,"telemedicine,security,resilience",
,Yes,,Aditi Mallesh,Software Engineer,MIcrosoft,,,,Go-Powered Identity Orchestration: Building High-Performance Security Microservices for Multi-Cloud Environments,Discover how we built lightning-fast security microservices with Go! Learn practical techniques for handling 1000+ requests/second across multi-cloud environments while slashing latency by 70%. Code examples included—walk away ready to supercharge your own cloud-native security architecture.,https://www.linkedin.com/in/aditimallesh/,,,,Aditi Mallesh - Conf42 Golang 2025.pdf,Aditi Mallesh_golang.png,https://youtu.be/NkVnghYhp_Q,"identity,security,microservices",
,Yes,,Ankita Kamat,Senior Software Engineer,Microsoft,,,,Engineering Golang-Powered Notification Systems: Scaling to Millions While Preserving Millisecond Latency,"Discover how to build notification systems that scale to millions of messages per second with Go's concurrency model. Learn architectural patterns that maintain millisecond latencies while handling extreme loads, and see how technical excellence translates directly to 42% higher user engagement.",https://www.linkedin.com/in/ankita-kamat/,,,,Ankita Kamat - Conf42 Golang 2025.pdf,Ankita Kamat_golang.png,https://youtu.be/uCn2dcDKvAM,"notification,latency,scaling",
,Yes,,Divya Darshana,Open Source Contributor,GoFr.dev,,,,Interservice HTTP Communication in Golang : The GoFr Approach,"Handling inter-service HTTP calls properly is crucial for performance and reliability. In this talk, **we’ll explore patterns like circuit breakers, authentication, and health monitoring—using GoFr, an open-source Golang framework**, to simplify and streamline these challenges.",https://www.linkedin.com/in/divya-darshana-258b84208/,DarshanaDivya,,,,Divya Darshana_golang.png,https://youtu.be/YAg7Wt56VxY,"http,communication,apis",
,Yes,,Sneha Kalagarla,,Cleveland State University,,,,"Revolutionizing eLicensing and ePermitting with AI: Enhancing Compliance, Efficiency, and User Experience","Unlock the future of government services with AI-powered eLicensing & ePermitting! AI automates case management, reducing processing times by 76%, improving accuracy by 89%, & boosting user satisfaction by 47%. Revolutionize compliance, cut costs, and streamline operations!",https://www.linkedin.com/in/sneha-k-840b45161/,,,,Sneha Kalagarla - Conf42 Golang 2025.pdf,Sneha Kalagarla_golang.png,https://youtu.be/90M7Zs2rDwk,"elicensing,ai,compliance",
,Yes,,Namkat Cedrick,Technical Lead,Iknite Studio,,,,How Golang Changed My Life,"""The only easy day was yesterday. ”, Revisiting your past Programming Fears/Challenges/Experiences with a Different perspective and Mindset.",https://www.linkedin.com/in/namkatcedrick/,,,,Namkat Cedrick - Conf42 Golang 2025.pdf,Namkat Cedrick_golang.png,https://youtu.be/JAOAEGMVK9k,"career,experience,journey",
,No,ai,Harsha Vardhan Reddy Yeddula,,Osmania University Hyderabad,,,,Generative Artificial Intelligence for Life Sciences,"Discover how Salesforce AI is transforming clinical trials! Explore AI-driven patient recruitment, predictive analytics, and supply chain optimization, all enhancing drug development. Learn how it improves efficiency, patient outcomes, and ensures compliance and cost savings.",https://www.linkedin.com/in/harsha-vardhan-reddy-yeddula-1245b617/,,,,Harsha Vardhan Reddy Yeddula - Conf42 Golang 2025.pdf,Harsha Vardhan Reddy Yeddula_golang.png,https://youtu.be/_2kXFTNXB3I,"life,sciences",
,No,ai,Sudhakar Kandhikonda,Senior Software Engineer,Lord Abbett,,,,"AI-Driven ETL Evolution: Harnessing Machine Learning for Scalable, Intelligent Data Pipelines","Unlock the future of data integration with AI-powered ETL! Learn how machine learning is transforming data pipelines, reducing processing time by 76%, cutting costs by 42%, and enhancing data quality. Join us for real-world case studies and insights into smarter, scalable solutions!",https://www.linkedin.com/in/sudhakar-kandhikonda/,,,,Sudhakar Kandhikonda - Conf42 Golang 2025.pdf,Sudhakar Kandhikonda_golang.png,https://youtu.be/NbZ_dfUQA-0,"etl,ai,pipelines",
,No,ai,Rajarshi Tarafdar,,JP Morgan Chase,,,,Optimizing Collaborative Workflows with AI and Golang: A Scalable Framework for Automation-Heavy Industries,"Unlock the future of work with AI and Golang! Learn how the Collaborative Workflow Intelligence Framework (CWIF) combines human expertise and AI to revolutionize industries like manufacturing, logistics, and finance. Discover real-time optimizations, scalable automation,",,,,,Rajarshi Tarafdar - Conf42 Golang 2025.pdf,Rajarshi Tarafdar_golang.png,https://youtu.be/--_J98nRWpo,"ai,automation,workflows",
,No,ai,Pradeep Kumar Vattumilli,Principal Data Engineer,,,,,Revolutionizing AI Deployment: Harnessing Edge Computing & TinyML for Autonomous IoT Solutions,"Unlock the future of AI with Edge Computing & TinyML! Ultra-low-power AI models (as small as 1mW) enable real-time decision-making, revolutionizing IoT. Discover how this game-changing combo boosts efficiency, slashes costs, and powers autonomous solutions across industries!",,,,,Pradeep Kumar Vattumilli - Conf42 Golang 2025.pdf,Pradeep Kumar Vattumilli_golang.png,https://youtu.be/uiGGq6Yz6Dw,"edge,tinyml,ai",
,No,ai,Mohit Sachdeva,,"Guru Gobind Singh Indraprastha University, New Delhi, India",,,,"Optimizing Business Operations with AI-Driven OCR: Enhancing Efficiency, Accuracy, and Compliance","Unlock AI-Driven OCR!  Explore how cutting-edge OCR achieves 99% accuracy, speeds processing, and enhances compliance. From real-time handwriting recognition to AI automation, discover the future of intelligent document processing!",,,,,Mohit Sachdeva - Conf42 Golang 2025.pdf,Mohit Sachdeva_golang.png,https://youtu.be/6gzREjHAR2o,"ocr,ai,automation",
,No,ai,Sanjeev Pellikoduku,Senior Cloud Software Engineer,SLB,,,,Enhancing Cloud Computing with AI and Golang: Overcoming Challenges and Driving Sustainable Growth,"Unlock the future of cloud computing with AI and Golang! Learn how to tackle security, performance, and ethical challenges while driving innovation. Discover how Golang’s power can streamline AI integration, optimize cloud operations, and ensure fairness, all while securing your AI-driven solutions",https://www.linkedin.com/in/sanjeev-pellikoduku-8b2b8b46/,,,,Sanjeev Pellikoduku - Conf42 Golang 2025.pdf,Sanjeev Pellikoduku_golang.png,https://youtu.be/fzx6thJjdpw,"cloud,ai,sustainability",
,No,architecture,Bhaskara Beeraka,Senior Developer,American Family Insurance,,,,"Go-Powered Telecom BSS: Scaling Enterprise Solutions with Microservices, AI, and Cloud-Native Architecture",Discover how Go powers telecom systems handling millions of transactions hourly! Learn to build high-performance microservices and AI-driven BSS solutions that slash costs 40% while boosting scalability 3x. Real-world engineering insights with zero fluff.,https://www.linkedin.com/in/bhaskara-beeraka-44531b75/,,,,Bhaskara Beeraka - Conf42 Golang 2025.pdf,Bhaskara Beeraka_golang.png,https://youtu.be/bBN4B1Vw4RA,"telecom,microservices,scaling",
,No,architecture,Sridhar Dachepelly,Senior Principal Software Engineer,Dell Technologies,,,,"Optimizing Test Orchestration in ERP Systems with Golang, AI, and Cloud-Native Architectures","Unlock the future of ERP testing with Golang, AI, and cloud-native solutions! Learn how test orchestration can slash execution times by 70%, boost test accuracy by 90%, and deliver results 74% faster. Discover how to scale testing, optimize resources, and achieve unmatched efficiency in ERP systems",https://www.linkedin.com/in/sridhar-dachepelly-4129331b/,,,,Sridhar Dachepelly - Conf42 Golang 2025.pdf,Sridhar Dachepelly_golang.png,https://youtu.be/wU1hVXTv1rI,"testing,erp,orchestration",
,No,architecture,Arun Vivek Supramanian,Senior Data Engineer,Amazon,,,,Data Mesh Unleashed: Scalable Architectures for AI-Driven Enterprise Intelligence,"Unlock the future of ERP testing with Golang, AI, and cloud-native solutions! Learn how test orchestration can slash execution times by 70%, boost test accuracy by 90%, and deliver results 74% faster. Discover how to scale testing, optimize resources, and achieve unmatched efficiency in ERP systems",,,,,Arun Vivek Supramanian - Conf42 Golang 2025.pdf,Arun Vivek Supramanian_golang.png,https://youtu.be/VYERik-FfQk,"data,mesh,ai",
,No,architecture,Srinivas Ankam,,Cloud5 Solutions,,,,Golang-Powered Retail Distribution: Transforming Supply Chains Through Cloud-Native Innovation,"Discover how Go-powered microservices are transforming retail supply chains! Learn practical patterns for building high-performance, sustainable systems using Golang, cloud-native architectures, and open source tools that deliver measurable business impact while slashing carbon emissions.",,,,,Srinivas Ankam - Conf42 Golang 2025.pdf,Srinivas Ankam_golang.png,https://youtu.be/iRUieuj-y0U,"retail,distribution,supply",
,No,architecture,Bhushan Gopala Reddy,,,,,,Go-Powered Self-Healing IoT: Building Resilient Microservices for Distributed Fault Recovery,Discover how we built resilient IoT networks using Go's concurrency model to create self-healing microservices that slash recovery time by 71% while maintaining 98% uptime. Code samples and architecture insights you can implement immediately!,,,,,Bhushan Gopala Reddy - Conf42 Golang 2025.pdf,Bhushan Gopala Reddy_golang.png,https://youtu.be/s2Tusa94gZU,"iot,microservices,resilience",
,No,architecture,Brian Loomis,Director Of Architecture,Progress,,,,Surviving the Real-World: Building Resilient Cloud-Native Platforms for Intermittent Networks,"Dive into the architectural strategies that help a distributed job runner thrive on an unreliable network. Whether you’re dealing with distributed systems, multi-cloud environments, or hybrid infra, learn practical insights to design and test in resilience and high availability for CN services.",https://www.linkedin.com/in/brianwloomis/,,,,Brian Loomis - Conf42 Golang 2025.pdf,Brian Loomis_golang.png,https://youtu.be/I2wzU9gzRI8,"cloud,platforms,resilience",
,No,architecture,Aditya Singh,MS in Computer Science,UW - Madison,,,,Evolving Architectures in Distributed Deep Learning: From Parameter Servers to ZeRO Systems,"Discover the future of AI! Dive into the evolution of distributed training, from parameter servers to ZeRO systems. Explore how innovations like Ring-AllReduce, ZeRO optimizations, and advanced algorithms are transforming scalability, efficiency, and speed for massive AI models!",https://www.linkedin.com/in/adityapratap/,,,,,Aditya Singh_golang.png,https://youtu.be/xmhfoVd3pww,"deep,learning,systems",
,No,cloud,Himaja Sabbineni,Senior Software Engineer,Expedia Group,,,,"Microservices and API Design: Best Practices for Scalable, Agile, and Resilient Systems","Microservices architecture and API design are foundational to building scalable, flexible, and maintainable software systems in today’s fast-paced technological landscape. By deconstructing complex applications into small, independent services, microservices offer enhanced agility and scalability. APIs serve as the communication bridges between these microservices, ensuring seamless interactions and data exchange. According to a 2020 report by the O'Reilly Media, 67% of organizations are adopting microservices to streamline application development, reduce deployment times, and improve overall operational efficiency.

Effective microservices design begins with clearly defining bounded contexts using Domain-Driven Design (DDD), ensuring each service focuses on a specific business function and avoids overlapping responsibilities. In addition, 76% of companies favor independent deployment for each microservice, allowing teams to update, scale, and troubleshoot services without affecting others. Data isolation, with each service having its own database, is key to maintaining loose coupling and preventing cascading failures. By following error handling patterns like circuit breakers and retries, teams can ensure resilient systems that remain operational during partial failures.

For APIs, following REST or GraphQL best practices enhances system flexibility. REST is perfect for simplicity and broad compatibility, while GraphQL excels in dynamic data queries for complex use cases. API versioning ensures backward compatibility, while adopting tools like Swagger or OpenAPI facilitates effective documentation, reducing friction for developers. With security at the forefront, enforcing HTTPS, authentication mechanisms, and input validation prevents breaches and vulnerabilities. Additionally, optimizing performance with strategies like caching, pagination, and gRPC guarantees faster, more efficient services.",https://www.linkedin.com/in/himaja-sabbineni-b71344102/,,,,Himaja Sabbineni - Conf42 Golang 2025.pdf,Himaja Sabbineni_golang.png,https://youtu.be/TsNIarMy21M,"microservices,api",
,No,cloud,Andrii Raikov,Principal Software Engineer,Delivery Hero,,,,"The ""Rabbit Hole"" of Dependencies in Golang","Dependency management culture is something commonly missed in many companies. Poorly managed deps cause broken updates, circular dependencies, and the dreaded “helpers” folder that turns into a black hole. Small decisions in package design can lead to massive tech debt. Learn together to avoid.",,andriiraikov,,,Andrii Raikov - Conf42 Golang 2025.pdf,Andrii Raikov_golang.png,https://youtu.be/jntHMm3mLVA,"dependencies,code,management",
,No,cloud,Rajkumar Chindanuru,Senior Software Engineer,Tailored Brands,,,,"Modernizing Legacy Applications: Cutting-Edge Strategies, Trends, and Practical Insights for the Future","Unlock the future of app modernization! Explore cloud migration, AI, containerization, microservices, low-code platforms, and service meshes. Cut costs, boost scalability, and enhance performance. Transform your legacy systems and drive innovation today!",https://www.linkedin.com/in/rajkumar-chindanuru/,,,,Rajkumar Chindanuru - Conf42 Golang 2025.pdf,Rajkumar Chindanuru_golang.png,https://youtu.be/8EIfi3k5Ib0,"legacy,modernization,strategies",
,No,cloud,Umamaheswarareddy Chintam,Solutions Architect,Calance,,,,Golang-Powered AI for Cloud-Native Integration: Enterprise Application Integration Reimagined,"Discover how Golang powers AI-enhanced cloud integration, reducing deployment time by 25% while improving reliability by 30%. Learn practical code patterns that create intelligent integration ecosystems delivering measurable business value in complex enterprise environments.",https://www.linkedin.com/in/chumamahesh/,,,,,Umamaheswarareddy Chintam_golang.png,https://youtu.be/rpL4thkqjss,"ai,integration,cloud",
,No,cloud,Vikas Vallakonda,Technical Program Manager,Discovery Analytics,,,,Advancing Security and Compliance in Revenue Management Systems with AI and Cloud Solutions,"Unlock the future of Revenue Management Systems! Learn how AI, cloud-native security, and dynamic pricing protection can revolutionize threat detection, compliance, and incident response. Discover game-changing strategies to safeguard sensitive data, boost revenue, and stay ahead",https://www.linkedin.com/in/vikas-vallakonda-b17688256/,,,,,Vikas Vallakonda_golang.png,https://youtu.be/OdcTY_XCyL4,"- security,compliance,revenue",
,No,data,Siddhartha Parimi,Product Manager,Dell Technologies,,,,Harnessing Data from the Cosmos: Pioneering Engineering Solutions for Space Exploration,"Explore how cutting-edge data engineering powers space exploration! From real-time processing to quantum computing, discover how we're handling massive data volumes with revolutionary systems that drive mission success and fuel the $423.8B space economy. Ready to unlock the future of space data?",https://www.linkedin.com/in/sid-parimi/,,,,Siddhartha Parimi - Conf42 Golang 2025.pdf,Siddhartha Parimi_golang.png,https://youtu.be/g3WbhUL-LyE,"space,data,exploration",
,No,data,Nasir Sayed,Senior Software Engineer,Finra,,,,Enhancing Financial Fraud Detection through AI-Driven Relationship Mapping in Global Markets,"Unlock the power of AI to detect hidden fraud networks in financial markets! Learn how AI-driven relationship data analysis uncovers insider trading, market manipulation, and collusion with 80% more accuracy. Reduce false positives, boost fraud detection, and enhance compliance in global markets.",https://www.linkedin.com/in/nasir-sayed-63b31296/,,,,Nasir Sayed - Conf42 Golang 2025.pdf,Nasir Sayed_golang.png,https://youtu.be/3WdEShdyDgA,"fraud,ai,financial",
,No,deep dive,Chidambaram Ganapathy Sundaram,Senior Technologist(,Infosys,Utsav Gupta,Senior Technologist,Infosys,Turbocharged Golang: Revolutionizing Full Stack Development with Hotwire,"Turbocharge your full-stack journey with Golang + Hotwire. Build lightweight, super-responsive apps by leveraging Golang’s raw power and Hotwire’s dynamic UI updates—without the burden of bulky frameworks. Enjoy a smoother coding experience that refreshes your passion for innovative development.",https://www.linkedin.com/in/chids-gs/,,https://www.linkedin.com/in/utsav-gupta/,,Chidambaram Ganapathy Sundaram & Utsav Gupta - Conf42 Golang 2025.pdf,Chidambaram Ganapathy Sundaram & Utsav Gupta_golang.png,https://youtu.be/RfBrwC5b0yE,"fullstack,development,hotwire",
,No,deep dive,Hemang Shah,Software Development Engineer,Amazon,,,,Scalable and Cost-Effective Machine Learning Framework for Intellectual Property Protection in the Cloud,"Explore how machine learning is transforming IP protection in the cloud! Learn scalable, cost-effective solutions to detect violations in real-time, reduce false positives by 65%, and cut manual review by 78%. Dive into AI-driven self-healing and quantum-resistant encryption technologies!",,,,,Hemang Shah - Conf42 Golang 2025.pdf,Hemang Shah_golang.png,https://youtu.be/gG1uvjB9ci0,"machine,learning,cloud",
,No,deep dive,Madhusudan S Vadigicherla,,Integra Lifesciences,,,,Strengthening Supply Chains: Harnessing Information Visibility and Standardized Collaborative Forecasting,"Discover how information visibility and collaborative forecasting can transform supply chain resilience! A global case study shows how standardizing production forecasts cut lead times by 30%, boosted efficiency by 15%, and enhanced risk management, making supply chains faster and more agile.",,,,,,Madhusudan S Vadigicherla_golang.png,https://youtu.be/rrMx-GE93b0,"supply,chain,forecasting",
,No,deep dive,Anirudh Peri,Director Go To Market Applications,Lookout,,,,"Revolutionizing Public Sector Operations with Salesforce Government Cloud: Efficiency, Transparency, and Resilience","Unlock the future of public sector innovation with Salesforce’s Government Cloud! Explore how AI, blockchain, and IoT are enhancing efficiency, citizen satisfaction, and transparency. Discover success stories transforming service delivery and crisis management. #PublicSectorInnovation #Salesforce",,,,,Anirudh Peri - Conf42 Golang 2025.pdf,Anirudh Peri_golang.png,https://youtu.be/boDO3XvDWJg,"salesforce,cloud,government",
,No,fintech,Deepu Komati,Lead Engineer,PenFed Credit Union,,,,Scaling Financial Decision Systems with Go: Building High-Performance FinTech Infrastructure in the Cloud,"Discover how Go is revolutionizing FinTech! Learn to build cloud-native financial systems that process millions of transactions with minimal latency. Real-world implementations that slash costs while enhancing security, scalability, and developer productivity—all powered by Go.",https://www.linkedin.com/in/deepu-komati-175412179/,,,,Deepu Komati - Conf42 Golang 2025.pdf,Deepu Komati_golang.png,https://youtu.be/6RhpopNOzOc,"fintech,cloud,infrastructure",
,No,fintech,Likhit Mada,Senior Software Engineer,Intuit,,,,Accelerating Fintech Innovation with AWS SageMaker: Unlocking the Power of Predictive Analytics and Machine Learning,"Unlock the future of fintech with AWS SageMaker! Accelerate fraud detection, optimize credit scoring, and enhance customer insights using machine learning. Learn strategies to deploy models faster while ensuring security and compliance in this rapidly growing industry.",https://www.linkedin.com/in/likhit-mada/,,,,Likhit Mada - Conf42 Golang 2025.pdf,Likhit Mada_golang.png,https://youtu.be/DYTYNghY4Es,"fintech,aws,sagemaker",
,No,fintech,Srinivas Allam,IBM iSeries Senior Program Analyst,Core ITS,,,,Go-Powered Banking: Modernizing iSeries Systems for the FinTech Era,"Discover how Go transformed a tier-1 bank's legacy iSeries infrastructure, enabling faster transactions through innovative concurrency patterns. Learn battle-tested strategies for zero-downtime migrations and see real microservice architectures that process millions of daily banking transactions.",https://www.linkedin.com/in/srinivas-allam-061b9a17/,,,,Srinivas Allam - Conf42 Golang 2025.pdf,Srinivas Allam_golang.png,https://youtu.be/LwOgwRwdW7E,"banking,modernization,fintech",
,No,fintech,Srinivas Reddy Mosali,Senior Consultant - Systems Engineer,Visa,,,,"Zero Downtime, Zero Excuses: Scaling Fintech Infrastructure That Never Blinks","Learn how we scaled our fintech platform through a viral growth surge while maintaining 99.99% uptime. From AI-powered incident response to regulatory-compliant SRE practices, discover battle-tested strategies for building reliable financial systems at scale.",https://www.linkedin.com/in/srinivas-reddy-mosali-b9548b141/,,,,Srinivas Reddy Mosali - Conf42 Golang 2025.pdf,Srinivas Reddy Mosali_golang.png,https://youtu.be/IfYdxScsrZY,"fintech,infrastructure,scaling",
,No,healthcare,Baba Prasad Pendyala,"Staff Technical Program Manager, Infrastructure Engineering, CI/CD DevOps",Walmart,,,,Architecting AI-Powered Cloud Platforms in Go: Delivering Enterprise Value,"Discover how Go's performance powers AI-driven cloud platforms that deliver real business results. Learn practical patterns, see a healthcare case study where Go microservices prevented medication errors, and walk away with actionable frameworks to implement in your enterprise today.",https://www.linkedin.com/in/baba-prasad-pendyala/,,,,,Baba Prasad Pendyala_golang.png,https://youtu.be/muhaAXIbPrA,"cloud,ai,platforms",
,No,healthcare,Hardik R Patel,"Manager, Software Development",PayPal,,,,Designing High-Performance Multi-Hop Data Pipelines for Real-Time Analytics with Golang,"Harness Golang to create fast, scalable multi-hop data pipelines for real-time analytics! Learn to process large datasets with low latency, optimize performance, and integrate machine learning for dynamic decision-making, boosting business success in finance, healthcare, and e-commerce!",https://www.linkedin.com/in/h4rd1k/,,,,Hardik R Patel - Conf42 Golang 2025.pdf,Hardik R Patel_golang.png,https://youtu.be/d_Ly6fXtApk,"data,pipelines,analytics",
,No,healthcare,Satish Puram,Specialist Leader,Deloitte,,,,"Leveraging Golang Expertise to Drive Transformative Social Impact in Healthcare, Education, and Sustainability","how Golang is revolutionizing healthcare, education, and sustainability! In this talk, we’ll explore how consulting expertise, powered by Golang's performance and scalability, drives transformative digital solutions that improve outcomes, increase efficiency, and create lasting social impact",https://www.linkedin.com/in/satish-puram-6071a819/,,,,Satish Puram - Conf42 Golang 2025.pdf,Satish Puram_golang.png,https://youtu.be/6-d6LoSMWwk,"healthcare,sustainability,impact",
,No,healthcare,Satya Manesh Veerapaneni,Senior Business Intelligence Consultant,Dazzlon,,,,"AI-Powered Business Intelligence in Healthcare: Leveraging Go for Scalable, Real-Time Analytics","AI is revolutionizing healthcare BI, but can it be fast, scalable, and real-time? Enter Go—powering AI-driven fraud detection, predictive modeling, and KPI automation with 30% efficiency gains. Join us to explore cutting-edge Go solutions that drive smarter, data-driven healthcare decisions!",https://www.linkedin.com/in/mvsatya/,,,,Satya Manesh Veerapaneni - Conf42 Golang 2025.pdf,Satya Manesh Veerapaneni_golang.png,https://youtu.be/3pYbdnLrLRg,"healthcare,bi,analytics",
