Panel,Featured,Track,Name1,JobTitle1,Company1,Name2,JobTitle2,Company2,Title,Abstract,LinkedIn1,Twitter1,LinkedIn2,Twitter2,Slides,Picture,YouTube,Keywords,Duration
,No,healthcare,Siddharth Pratap Singh,Product Manager,Dell Technologies,,,,"Privacy-Preserving Search: Innovations, Applications, and Performance Benchmarks","Unlock the future of search with privacy-preserving tech! Discover how federated learning, homomorphic encryption, and differential privacy revolutionize sectors like healthcare & finance. Explore success stories, performance benchmarks, and strategies to secure data without compromising relevance!",https://www.linkedin.com/in/sid-parimi/,,,,Siddharth Pratap Singh - Conf42 Golang 2025.pdf,Siddharth Pratap Singh_golang.png,https://youtu.be/NVavxUL1zXo,"search,privacy,performance",
,No,healthcare,Suman Neela,Integration Developer,AppsTek,,,,Revolutionizing Payor Operations: Leveraging Real-Time Data Integration for Enhanced Claims & Eligibility Processing,"Unlock the future of healthcare payor operations! Discover how real-time data integration, advanced middleware, AI, edge computing, and microservices can transform claims processing, improve accuracy, reduce costs, and revolutionize claims management and fraud detection!",https://www.linkedin.com/in/suman-neela/,,,,,Suman Neela_golang.png,https://youtu.be/XxKi8BNwA5w,"payor,claims,integration",
,No,healthcare,Kamal Gupta,Software Development Engineer,Amazon,,,,Building High-Performance Healthcare ML Systems with Go: A Journey from Development to Deployment,"This presentation explores how Go powers machine learning integration in healthcare mobile applications across diverse clinical settings. Our team leveraged Go's concurrency model and performance characteristics to develop ML-powered healthcare solutions that achieved remarkable diagnostic accuracy in cardiovascular disease prediction and early-stage cancer detection.

We'll dive into our technical architecture, showcasing how Go microservices efficiently orchestrate TensorFlow workflows, resulting in dramatic reductions in pneumonia diagnosis time while maintaining high diagnostic accuracy. Our healthcare IoT implementation demonstrates how Go-powered services process multiple data points per second with minimal latency, achieving exceptional accuracy in vital sign monitoring.

The presentation addresses critical implementation challenges, including how we used Go's robust security libraries to implement privacy-preserving techniques that substantially reduce data breach risks. We'll share our validation framework built in Go that incorporates multiple performance parameters, achieving high confidence intervals in system reliability metrics.

We'll discuss how our Go-based architecture delivered significant economic impact, with our AI-driven clinical decision support systems reducing annual operating costs per facility and decreasing diagnosis time. The results show improved patient outcomes, with medication compliance rates increasing dramatically and hospital readmission rates decreasing substantially for chronic condition patients.

Join us to learn how Go's simplicity, performance, and concurrency model make it an ideal language for building machine learning systems that transform healthcare delivery through quantifiable improvements in diagnostic accuracy, treatment optimization, and operational efficiency.",https://www.linkedin.com/in/guptakamal/,,,,Kamal Gupta - Conf42 Golang 2025.pdf,Kamal Gupta_golang.png,https://youtu.be/dAyWQVTmR2g,"healthcare,ml",
,No,healthcare,Amlan Ghosh,,,,,,Architecting Cloud Success: Data-Driven Strategies for the AI Age,"From software engineer to Principal Cloud Architect - discover data-backed strategies for cloud success in the AI era. Learn how combining cloud architecture with AI led to 40% cost savings and 3x faster deployments, with real examples from healthcare and retail transformations.",,,,,Amlan Ghosh - Conf42 Golang 2025.pdf,Amlan Ghosh_golang.png,https://youtu.be/Edq7xfNQWHA,"cloud,ai,data",
,No,mobility,Murali Krishna Reddy Mandalapu,"Senior Director, Hardware Engineering",Renesas Electronics,,,,Optimizing Real-Time AI Inference at the Edge: Accelerating Autonomous Vehicle Safety and Efficiency,"Autonomous vehicles generate vast data, requiring ultra-fast AI. This talk explores edge inference techniques that cut latency, enhance efficiency, and improve safety. Discover how neuromorphic computing, model optimizations, and AI accelerators revolutionize real-time AV decision-making! 🚀",https://www.linkedin.com/in/murali-kr-mandalapu/,,,,Murali Krishna Reddy Mandalapu - Conf42 Golang 2025.pdf,Murali Krishna Reddy Mandalapu_golang.png,https://youtu.be/UQW3y8rZuKw,"ai,inference,edge",
,No,mobility,Utham Kumar,,Nanyang Technological University,,,,Building Robust V2X Communication Networks in Go: Scaling Connected Vehicle Systems for Urban Mobility,"Discover how Go powers next-gen connected vehicle systems! Learn practical techniques for building high-performance V2X networks using microservices, cloud infrastructure, and open-source tools that are transforming urban mobility today.",https://www.linkedin.com/in/kumar1612/,,,,Utham Kumar - Conf42 Golang 2025.pdf,Utham Kumar_golang.png,https://youtu.be/hs2pBwUnEIc,"v2x,communication,vehicles",
,No,optimization,Jugnu Misal,Incident Management Engineer,,,,,Mastering Automation and Monitoring for Optimized IT Operations,"Learn how Prometheus, Nagios, Datadog, and AIOps can cut incident response time by 67%, reduce manual interventions by 78%, and achieve 99.999% uptime. Discover proven strategies to optimize your systems and drive operational excellence!",https://www.linkedin.com/in/jugnumisal/,,,,Jugnu Misal - Conf42 Golang 2025.pdf,Jugnu Misal_golang.png,https://youtu.be/mSuiG_ybg_8,"automation,monitoring,operations",
,No,optimization,Srikar Kompella,Software Engineer,Prime Video & Amazon Studios,,,,"Leveraging Golang for Serverless SaaS Migration: Scalability, Cost Efficiency, and Agility on AWS","Unlock the power of Golang for your serverless SaaS migration! Learn how to cut infrastructure costs by 80%, supercharge scalability, and accelerate development with AWS Lambda and cloud-native microservices. Get real-world insights to optimize performance, boost agility, and drive business growth!",https://www.linkedin.com/in/srikarkompella/,,,,Srikar Kompella - Conf42 Golang 2025.pdf,Srikar Kompella_golang.png,https://youtu.be/cUJ3sEp3-Uo,"serverless,migration,aws",
,No,optimization,Sunil Kumar Mudusu,Lead AI Engineer/Data Engineer,Church Mutual Insurance Company,,,,Optimizing Data Transformation with Golang in AI Workflows,"power of Golang to streamline data transformation in AI workflows. With its high-performance concurrency and speed, Golang accelerates the preprocessing of large datasets, enabling faster, more efficient AI model training and real-time data processing boosting productivity.",https://www.linkedin.com/in/sunil-kumar-m-870b03168/,,,,Sunil Kumar Mudusu - Conf42 Golang 2025.pdf,Sunil Kumar Mudusu_golang.png,https://youtu.be/6epPhwd1PH8,"ai,transformation,workflows",
,No,optimization,Puneet Gupta,Principal ASIC Physical Design Engineer,Block,,,,Enhancing Timing Closure with Slack-Aware Post-Routing Cell Legalization in ECO,"Unlock the secret to faster, more efficient timing closure! Our slack-aware post-routing cell legalization method minimizes timing violations and optimizes resource use, achieving better QoR with fewer iterations. Say goodbye to delays and hello to faster, more reliable chip design workflows!",,,,,Puneet Gupta - Conf42 Golang 2025.pdf,Puneet Gupta_golang.png,https://youtu.be/Z-PseqqAi64,"timing,optimization,design",
,No,optimization,Venkatachala Nivas Chainuru,,California State University Northridge,,,,"Optimizing Hybrid Object Storage for Scalability, Performance, and Cost Across Environments","Unlock the power of hybrid object storage! Learn how to optimize performance, reduce costs by 40%, and ensure compliance across on-premises and cloud environments. Discover real-world strategies to scale your data, improve throughput by 22.3%, and save thousands annually in operational costs!",,,,,Venkatachala Nivas Chainuru - Conf42 Golang 2025.pdf,Venkatachala Nivas Chainuru_golang.png,https://youtu.be/MEO_I8VGW-I,"storage,scalability,performance",
,No,optimization,Sai Sravan Gudipati,,,,,,"Optimizing Cloud Data Engineering with Golang: Scaling, Cost Efficiency, and Real-Time Insights","Discover how leveraging Golang's performance boosts scalability, reduces costs, and powers real-time analytics. Learn how cloud technologies, from IaC to MLOps and edge computing, are revolutionizing data management for unmatched efficiency and innovation.",,,,,Sai Sravan Gudipati - Conf42 Golang 2025.pdf,Sai Sravan Gudipati_golang.png,https://youtu.be/BF31rUJozl0,"data,engineering,insights",
,No,security,Alex Casalboni,Developer Advocate,Edgee,,,,From Cloud to Edge computing - Unleashing the power of WebAssembly at the edge,"Discover how WASM at the edge pushes beyond cloud limits, enabling low-latency, secure, and distributed computing. In this talk, we’ll explore Golang+Wasm patterns for edge deployments, covering performance, security, and real-world use cases that blend cloud and edge seamlessly.",https://www.linkedin.com/in/alexcasalboni/,alex_casalboni,,,Alex Casalboni - Conf42 Golang 2025.pdf,Alex Casalboni_golang.png,https://youtu.be/tp61nlI8DDw,"cloud,edge,webassembly",
,No,security,Krishna Anumula,Specialist- System Management,LTIMindtree,,,,Enhancing Data Protection with HSM Encryption: A Case Study of Securing 50 Oracle Databases,"Learn how implementing HSM encryption across 50 Oracle databases enhanced security and compliance. Explore the challenges, automation strategies, and seamless integration that ensured robust data protection and zero downtime. A must-see case study for scaling encryption in complex environments!",https://www.linkedin.com/in/krishna-anumula-167806268/,,,,Krishna Anumula - Conf42 Golang 2025.pdf,Krishna Anumula_golang.png,https://youtu.be/Lae-19tGKfk,"encryption,data,security",
,No,security,Santosh Bompally,Cloud Security Engineering Team Lead,Humana,,,,Enhancing Cloud Security with IaC and AI-Driven Threat Detection: A Golang Perspective,"Learn how to automate IaC security, leverage AI-driven threat detection, and enforce cloud-native policies for continuous compliance. Discover how to build a proactive, resilient security posture that minimizes risks and ensures real-time response to emerging threats",https://www.linkedin.com/in/santosh-bompally-048758b4/,,,,,Santosh Bompally_golang.png,https://youtu.be/zMkj97tq2Hk,"security,iac,threat",
,No,security,Sudeep Shanubhog,Technical Lead / Senior Full-stack Developer,Tential Solutions,,,,AI-Powered Real-Time Security in Golang: Enhancing Microsoft Cloud Services Protection with Adaptive Learning and Quantum Integration,"Unlock the future of cloud security with AI-powered solutions in Golang! Learn how AI-driven threat detection and quantum-enhanced systems are revolutionizing Microsoft Azure protection, reducing response times by 57%, and boosting security accuracy by 64%.",https://www.linkedin.com/in/sudeep-shanubhog/,,,,,Sudeep Shanubhog_golang.png,https://youtu.be/ZqPrTuV9WCs,"security,cloud,adaptive",
,No,security,Vishnuvardhana Reddy Veeraballi,Cloud Advisor,,,,,Revolutionizing Cloud Security: Leveraging Cloud Security Posture Management (CSPM) for Proactive Defense and Regulatory Compliance,"Unlock the power of Cloud Security Posture Management (CSPM) to transform your cloud security strategy! Discover how CSPM ensures real-time threat detection, automates compliance, and maximizes efficiency, helping you stay ahead of evolving threats while safeguarding your cloud investments.",https://www.linkedin.com/in/vishnuvardhana-reddy-veeraballi/,,,,Vishnuvardhana Reddy Veeraballi - Conf42 Golang 2025.pdf,Vishnuvardhana Reddy Veeraballi_golang.png,https://youtu.be/_iBZ8JjVriY,"cloud,security,cspm",
,No,security,Srinivas Vallabhaneni,Software Engineer,Walmart,,,,Scaling Secure Enclaves: Confidential Computing in Go-Powered Distributed Systems,Discover how Go powers next-gen confidential computing! Learn to shield sensitive data with secure enclaves while maintaining performance in distributed systems. See real implementations and master cutting-edge techniques leading cloud providers are adopting today.,https://www.linkedin.com/in/srinivas-vallabhaneni/,,,,Srinivas Vallabhaneni - Conf42 Golang 2025.pdf,Srinivas Vallabhaneni_golang.png,https://youtu.be/YPoT5t6Gr5g,"enclaves,security,confidential",
,No,security,Sharath Chandra Adupa,Principal Architect,Fidelity Investments,,,,Advanced Security Strategies for Protecting PII in Cloud Environments: Best Practices and Implementation Guidelines,"Learn advanced security strategies to protect PII in the cloud, reduce compliance burdens, and ensure data privacy. Discover encryption, tokenization, and anonymization techniques that reduce security incidents by 60% and increase efficiency by 40%. Join us for actionable insights!",https://www.linkedin.com/in/sharath-chandra-adupa-01339116/,,,,Sharath Chandra Adupa - Conf42 Golang 2025.pdf,Sharath Chandra Adupa_golang.png,https://youtu.be/yfGqFxUxxPs,"security,pii,cloud",
,No,testing,Krishna Baride,Senior IT Leader PLM / Product Owner,Cummins,,,,Scaling PLM Systems with Go: Building High-Performance AI Pipelines for 40% Faster Product Launches,Discover how we turbocharged PLM systems using Go's concurrency magic! We'll dive into building lightning-fast AI pipelines that slashed product launch times by 40%. Learn battle-tested patterns for scaling microservices with real code and solutions.,https://www.linkedin.com/in/krishna-baride/,,,,Krishna Baride - Conf42 Golang 2025.pdf,Krishna Baride_golang.png,https://youtu.be/OYMxKxU0bHU,"plm,ai,scaling",
,No,testing,Sanath Chilakala,"Director, AI & Digital Solution Architecture",NTT DATA,,,,Go-Powered Data Architecture: Solving Enterprise Growth Challenges at Scale,"Discover how Go is revolutionizing enterprise data architecture to tame the 42.2% annual data growth beast! Learn battle-tested patterns and tools to transform data chaos into competitive advantage—where others see overwhelming complexity, you'll see opportunity",https://www.linkedin.com/in/sanath-chilakala-ba7b7b36/,,,,Sanath Chilakala - Conf42 Golang 2025.pdf,Sanath Chilakala_golang.png,https://youtu.be/bKLl-Z2BF9M,"data,architecture,scaling",
,No,tools,Manuel de la Pena,Staff Software Engineer,Docker,,,,Delightful integration tests in Go applications,"Streamline your integration tests with Dockerized services using Testcontainers. This session covers how to programmatically manage databases, queues and more directly from your test code. Ensure consistent environments in both local development and CI pipelines, all without manual config hassles.",https://www.linkedin.com/in/mdelapenya/,mdelapenya,,,,Manuel de la Pena_golang.png,https://youtu.be/VsiaUdMes3k,"testing,go,integration",
,No,tools,Nikolay Kuznetsov,Senior Golang Software Engineer,Zalando,,,,Practical guide to testing Go services,"Learn how to test each layer effectively—from databases with Testcontainers to service logic with mocks, and HTTP handlers with httptest. Discover essential tools like testify, mockery, go-cmp, and Localstack for AWS emulation.",https://www.linkedin.com/in/nkuznetsov/,,,,Nikolay Kuznetsov - Conf42 Golang 2025.pdf,Nikolay Kuznetsov_golang.png,https://youtu.be/AhfCgPbwjG4,"testing,go,services",
,No,tools,Pranshu Srivastava,Software Engineer,Cloudera,,,,The Power of Cilium For eBPF,"This talk is for people who are getting started with eBPF and they don’t want to use Rust for their user space code . I will go upon my personal experience of using Cilium, why exactly did I choose it, what challenges I faced, and what mistakes people should not make.",https://www.linkedin.com/in/pranshusrivastava24/,pranshus24,,,,Pranshu Srivastava_golang.png,https://youtu.be/kLR6hdQqmPg,"cilium,ebpf,networking",
,No,transformation,Ramalinga Reddy Kotapati,Technical Lead Physical Design Engineer,Intel Corporation,,,,Unlocking the Future of Power Efficiency in Semiconductor Design with Backside Power Delivery,"Backside Power Delivery Networks (BSPDN) are transforming semiconductor design! Discover how advanced nano-Through Silicon Vias (nTSVs) enhance performance, reduce power use, and unlock the future of high-performance computing, offering improved power efficiency and design flexibility.",https://www.linkedin.com/in/ramalinga-reddy-kotapati-13564a25/,,,,Ramalinga Reddy Kotapati - Conf42 Golang 2025.pdf,Ramalinga Reddy Kotapati_golang.png,https://youtu.be/_rmxRErGpN4,"semiconductor,power,efficiency",
,No,transformation,Venkata Anil Kumar Nilisetty,Java Full Stack Lead Developer,Cognizant,,,,Transforming Multi-Enterprise Supply Chains with Blockchain-Powered Order Reconciliation,"Eliminate delays, cut costs by 40%, and boost trust in your supply chain! Discover how Golang-powered blockchain reconciliation automates order validation at 2,800 TPS, slashing disputes and maximizing efficiency. Future-proof your operations and stay ahead of disruptions today!",https://www.linkedin.com/in/nvanilkumar/,,,,Venkata Anil Kumar Nilisetty - Conf42 Golang 2025.pdf,Venkata Anil Kumar Nilisetty_golang.png,https://youtu.be/8B6ErNZX7_M,"blockchain,supply,order",