Featured,Track,Name1,JobTitle1,Company1,Name2,JobTitle2,Company2,Title,Abstract,LinkedIn1,Twitter1,LinkedIn2,Twitter2,Slides,Picture,YouTube,Keywords,Duration
Yes,,Priyanshi Deshwal,Senior Software Engineer,Mode,,,,Reimagining Incident Response with AI-Powered Visual Interfaces: From Static Dashboards to Real-Time Intelligence,"Discover how AI is revolutionizing incident response dashboards, cutting MTTR by 35%, automating visual insights, and enabling real-time decision-making. Learn from a $650B case study where smart visualization led to $42M in annual impact.",https://www.linkedin.com/in/priyanshi-deshwal-b87a3a10/,,,,,Priyanshi Deshwal_incident.png,https://youtu.be/Ai6fODH9UFw,"visual,interfaces,intelligence",
Yes,,Rehana Sultana Khan,Software Engineer,Versa Networks,,,,AI-Driven Rate Limiting for Resilient and Cost-Efficient Cloud API Protection,"Discover how AI-powered rate limiting transforms API security! Learn to dynamically detect malicious traffic, cut false positives by 68%, and reduce infrastructure costs by 27%. Gain a proven, cloud-ready roadmap for resilient, scalable, and cost-efficient API protection.",https://www.linkedin.com/in/rehana-sultana-khan/,,,,,Rehana Sultana Khan_incident.png,https://youtu.be/7tRgh5Yyvec,"ratelimiting,api,protection",
Yes,,Sruthi Erra Hareram,Data Engineer,,,,,Resilient Cross-Cloud Analytics Pipelines with Azure Databricks: A 10TB+ Scale Reliability Engineering Case Study,"Discover how we engineered a resilient 10TB+/day analytics pipeline across Azure and AWS with 99.95% uptime, robust failure handling, and incident-aware orchestration ideal for reliability engineers managing critical data platforms at scale.",https://www.linkedin.com/in/sruthi-hareram/,,,,,Sruthi Erra Hareram_incident.png,https://youtu.be/abO2XM3KzlM,"databricks,analytics,reliability",
No,ai,Mallikarjun Ramasani,Software Engineer,Barclays,,,,"Intelligent Incident Management: AI, ML, and the Future of Resilient Cloud Operations","AI is revolutionizing incident response. Learn how ML-driven detection, root cause analysis, and auto-remediation are cutting downtime and boosting resilience in cloud ops. A must-see for SREs and platform teams building fault-tolerant systems.",https://www.linkedin.com/in/mallikarjun-ramasani/,,,,,Mallikarjun Ramasani_incident.png,https://youtu.be/10wvHoa_32s,"intelligence,cloud,future",
No,ai,Vasanth Mudavatu,"Senior Principal Software Engineer - Gen AI, ML & Application Security Products",Dell Technologies,,,,Algorithmic Transparency in Action: Strengthening AI-Driven Incident Management,"Can you trust your AI during a breach? Learn how algorithmic transparency boosts incident resolution, reduces false positives, and streamlines forensics. Discover practical tools and frameworks that make your AI-driven response both powerful and explainable.",https://www.linkedin.com/in/vasanth-mudavatu-4580776/,,,,,Vasanth Mudavatu_incident.png,https://youtu.be/yZW-FjoXOqQ,"transparency,algorithms,ai",
No,ai,Gandhi Mathi Nathan Kumar,Principal Incident Commander - Platform Engineering,Twilio,,,,AI for Incident Management,"A deep dive on how using AI correctly can impact Incident Management, showcasing via a demo how effective AI in incident management can be in solving one of the hardest challenges of getting updates during an incident and bringing teams upto speed as they join an incident",https://www.linkedin.com/in/gmnk,,,,,Gandhi Mathi Nathan Kumar_incident.png,https://youtu.be/nzJHeYA24DM,"ai,automation,resilience",
No,cloud,Mahesh Yadlapati,Senior DevOps Engineer,Haliburton,,,,Cloud-Powered Retail Resilience: How AWS Drives Customer-Centric Incident Response,"Learn how AWS helps retailers stay resilient, responsive, and customer-focused when incidents strike. This session reveals how cloud-native tools from AI-driven personalization to serverless ops enable faster recovery, better CX, and scalable incident management.",https://www.linkedin.com/in/mahesh-y-982186152/,,,,,Mahesh Yadlapati_incident.png,https://youtu.be/Kq57GRRKGM0,"retail,aws,resilience",
No,cloud,Mahmood Nawaz,Senior Specialist - Data Engineering,LTIMindtree,,,,AI-Powered Knowledge Systems for Resilient Cloud Incident Response,"Discover how AI-powered knowledge ecosystems revolutionize cloud incident response slashing resolution times, reducing cognitive load, and accelerating innovation. Learn how to turn every incident into a catalyst for continuous learning and resilience at scale.",https://www.linkedin.com/in/nawazk2055/,,,,,Mahmood Nawaz_incident.png,https://youtu.be/5IkZFSr4J88,"knowledge,cloud,resilience",
No,cloud,Maruti Pradeep Pakalapati,Software Engineer Technical Lead,Capital One,,,,"Cloud-Native Retail at Scale: Agility, Resilience, and Cost Efficiency","Discover how top retailers achieve 99.99% uptime, 50% lower infra costs, and real-time personalization at scale. This session dives into cloud-native strategies, incident resilience, and DevOps practices that drive agility, reliability, and customer loyalty.",https://www.linkedin.com/in/maruti-pakalapati-a50612141/,,,,,Maruti Pradeep Pakalapati_incident.png,https://youtu.be/ZPVNHoJ3c-A,"retail,cloudnative,scalability",
No,cloud,Sai Krishna Gurram,Site Reliability Engineer Sr. Consultant Level,Visa,,,,Blockchain-Cloud Integration: Revolutionizing Incident Response in Payment Networks,Discover how blockchain transforms incident management in payment systems. Learn proven strategies that reduced our MTTR by 80% and automated response workflows. Real-world insights from processing millions of daily transactions at enterprise scale.,https://www.linkedin.com/in/saikrishna-gurram/,,,,,Sai Krishna Gurram_incident.png,https://youtu.be/e-6DoPUGhfg,"blockchain,payments,cloud",
No,data,Pushap Goyal,Software Engineer,Google,,,,Accelerating Incident Response with Distributed Graph Technology: Leveraging Google Spanner Graph for Complex Security Incident Investigation,"Transform incident response with Google Spanner Graph! Trace complex attacks across distributed systems in real-time, eliminate data silos, and slash investigation times. See revolutionary graph technology turn chaotic incidents into clear attack stories.",https://www.linkedin.com/in/goyalpushap/,,,,,Pushap Goyal_incident.png,https://youtu.be/A43DG52tAvQ,"graph,spanner,security",
No,data,Vijaykumar Pasunoori,Technical Lead,Valet Living,,,,Modern API Gateways: Data-Driven Reliability for Microservices & Serverless,"Discover how modern API gateways power incident detection, resilience, and rapid recovery in microservices and serverless systems. Backed by real-world data, this talk reveals performance gains, AI-powered routing, and edge strategies that keep systems stable at scale.",https://www.linkedin.com/in/vijaykumar-pasunoori-38747435/,,,,,Vijaykumar Pasunoori_incident.png,https://youtu.be/q3htL6WHKdo,"apigateways,microservices,serverless",
No,healthcare,Nisheedh Raveendran,Senior Staff Engineer,LinkedIn,,,,"When Compliance Meets Crisis: Managing Regulatory Incidents in HIPAA, GDPR, and DMA Environments","System down. Regulators calling. Patients waiting. When compliance meets crisis, normal incident response fails spectacularly. Learn the battle-tested playbooks that prevented regulatory disasters at healthcare, fintech, and big tech companies.",https://www.linkedin.com/in/nisheedhraveendran/,,,,,Nisheedh Raveendran_incident.png,https://youtu.be/2qtmwfZKdVI,"compliance,hipaa,gdpr",
No,healthcare,Sreenivasul Reddy Meegada,System Analyst Technical Lead,,,,,Voice Biometrics in Healthcare: Securing Systems and Streamlining Workflows,"Discover how voice biometrics are revolutionizing healthcare security and efficiency. Learn from real-world deployments using NICE and Omilia to cut breaches, speed up workflows, and boost compliance without sacrificing patient care. Future-proof your incident response strategy today!",https://www.linkedin.com/in/sreenivasul-reddy-meegada-262a7b39/overlay/photo/,,,,,Sreenivasul Reddy Meegada_incident.png,https://youtu.be/uxGHNubWqFE,"healthcare,biometrics,security",
No,monitoring,Adithya Sirimalla,Software Developer and DBA,Enliven Technologies,,,,Mastering Multi-Cloud Database Resilience: Oracle & SQL Server in a Cloud-Native World,"Learn how to manage Oracle & SQL Server across AWS, Azure, and OCI with confidence! Discover best practices for automation, monitoring, and disaster recovery to build secure, resilient, and cost-optimized multi-cloud database environments.",https://www.linkedin.com/in/adithya-sirimalla-07a22a369/,,,,,Adithya Sirimalla_incident.png,https://youtu.be/NiJ3KtbZjG8,"multicloud,databases,resilience",
No,monitoring,Krishna Chaitanya Yarlagadda,Senior Manager - Data Science & Analytics,Mercury Financial,,,,AI-Powered Incident Prevention: Supply Chain Monitoring & Automated Response,"Supply chain disruptions cascade into critical incidents within hours. I'll show how AI transforms reactive firefighting into proactive prevention using ML to detect anomalies, predict failures, and automate responses before incidents escalate.",https://www.linkedin.com/in/chaitanya2/,,,,,Krishna Chaitanya Yarlagadda_incident.png,https://youtu.be/e8t_hME_mlc,"supplychain,automation,prevention",
No,resilience,Nirup Baer,Program Manager,Wells Fargo,,,,Cloud Modernization Meets Compliance: Resilience and Speed in Financial Services,"Discover how top financial firms turn regulatory complexity into a competitive edge. Learn how embedded compliance in cloud architectures boosts resilience, slashes latency, and accelerates innovation turning incidents into opportunities for growth and differentiation.",https://www.linkedin.com/in/nirup-baer/,,,,,Nirup Baer_incident.png,https://youtu.be/oMwkZBbiL7E,"finance,modernization,resilience",
No,resilience,Sujit Kumar,Vice President of Technology,Copart,,,,"Incident-Ready Contact Centers: AI, Automation, and Resilience at Scale","Incidents are inevitable—but chaos isn’t. Learn how AI-driven contact centers reduce toil, speed up resolution, and stay resilient under pressure. This talk delivers real-world insights and proven patterns to turn your support systems into calm, coordinated incident-response engines.",https://www.linkedin.com/in/kumar-sujit/,,,,,Sujit Kumar_incident.png,https://youtu.be/69XSds6sN0s,"contactcenters,automation,scale",
No,resilience,Venkata Majeti,Sr Salesforce Consultant,HashiCorp,,,,AI-Driven Incident Resilience: Scaling Subscription Systems in a $400B Economy Without Losing Uptime,"Discover how AI-enabled platforms in the $400B subscription economy are achieving 99.95% uptime, reducing churn by 32%, and boosting revenue through predictive incident mitigation and hyper-personalization. Real-world case studies. Real-time insights.",https://www.linkedin.com/in/venkata-majeti/,,,,,Venkata Majeti_incident.png,https://youtu.be/R09-LHUsXRw,"subscriptions,scale,uptime",
No,sap,Gobinath Kasimayan,Specialist Master,Deloitte Consulting,,,,AI-Driven Master Data Governance for Agile Incident Management in SAP,"Discover how AI-powered Master Data Governance in SAP can revolutionize incident detection and resolution. Learn proven strategies to cut response times, boost data accuracy, and drive operational resilience turning data governance into a proactive enabler of agility and business success.",https://www.linkedin.com/in/gobinath-kasimayan-b7809916/,,,,,Gobinath Kasimayan_incident.png,https://youtu.be/_1QTklKZZuk,"sap,governance,agility",
No,sap,Vijay Kumar Kola,Senior Analyst - IT,Intuitive,,,,AI-Powered Testing: Preventing SAP & Salesforce Incidents Before They Happen,"Transform incident management from reactive to proactive using AI-powered testing. Learn how predictive analytics and intelligent automation prevent SAP/Salesforce failures before they impact production, reducing incidents by 68%.",https://www.linkedin.com/in/vijaykumarkola/,,,,,Vijay Kumar Kola_incident.png,https://youtu.be/OZzch6Gm8LQ,"sap,salesforce,testing",