Featured,Track,Name1,JobTitle1,Company1,Name2,JobTitle2,Company2,Title,Abstract,LinkedIn1,Twitter1,LinkedIn2,Twitter2,Slides,Picture,YouTube,Keywords,Duration
Yes,,Paige Cruz,Principal Developer Advocate,Chronosphere,,,,What Real Housewives Taught Me About Postmortem Meetings,"What if I told you that watching The Real Housewives made me better at postmortems? 

From bringing ""receipts"" to ""the meeting before the meeting"", reality TV drama offers unexpectedly useful lessons for running more structured, blame-aware, and productive incident reviews.",https://www.linkedin.com/in/paigerduty/,,,,Paige Cruz - Conf42 Site Reliablity Engineering (SRE) 2025.pdf,Paige Cruz_sre.png,https://youtu.be/XKOSBUmY12s,"what,real,housewives",
Yes,,Payal Godhani,Principal Engineer,Oracle Cloud Infrastructure,,,,Zero Downtime ML Deployments: SRE Techniques for Seamless Reliability,"Ensuring zero-downtime ML deployments is a challenge for SREs. Traditional observability falls short for ML at scale. This talk explores the ML-SRE gap, breaking down systems and introducing key techniques to enhance observability, monitor performance, and ensure seamless, reliable deployments.",https://www.linkedin.com/in/payal-godhani/,,,,Payal Godhani - Conf42 Site Reliablity Engineering (SRE) 2025.pdf,Payal Godhani_sre.png,https://youtu.be/7L28dDQgvBU,"zero,downtime,ml",
Yes,,Aditi Mallesh,,Syracuse University,,,,Zero to Fifty: Engineering Sub-50ms IAM Architecture for High-Stakes Gaming Platforms,Discover how we slashed authentication times to under 50ms globally while cutting infrastructure costs. Our edge-deployed identity proxies and stateless JWT system handle thousands of gaming transactions per second with zero database lookups. Milliseconds matter—learn how we made them count.,https://www.linkedin.com/in/aditimallesh/,,,,Aditi Mallesh - Conf42 Site Reliablity Engineering (SRE) 2025.pdf,Aditi Mallesh_sre.png,https://youtu.be/TJzUenrmk6c,"zero,fifty,engineering",
Yes,,Veliswa Boya,Senior Developer Advocate,AWS,,,,Application Resilience - Whose Job Is It Anyway?,"Is it possible for application resilience and innovation to co-exist? In this talk, we discuss team cultural changes and technical considerations during software development that ensure the co-existence of application resilience and innovation?",https://www.linkedin.com/in/veliswa-boya/,vel12171,,,Veliswa Boya - Conf42 Site Reliablity Engineering (SRE) 2025.pdf,Veliswa Boya_sre.png,https://youtu.be/LhjRCaQAVJc,"application,resilience,whose",
Yes,,Jena Abraham,Senior Design Verification Engineer / Technical Program Manager,Intel Corporation,,,,Reliability at Scale: SRE Principles for High-Speed Infrastructure Monitoring and Incident Prevention,"Discover how to transform high-speed infrastructure monitoring from reactive to predictive! Learn battle-tested SRE techniques that slash MTTR by 60%, eliminate alert fatigue, and prevent outages before they happen. See real-world cases and ML strategies you can deploy today.",https://www.linkedin.com/in/jenajo/,,,,Jena Abraham - Conf42 Site Reliablity Engineering (SRE) 2025.pdf,Jena Abraham_sre.png,https://youtu.be/pSmWD9NQ3qw,"reliability,scale,sre",
Yes,,Roja Perumandla,Director- Professional Services & Client Success,ZeOmega,,,,"Applying SRE Principles to SDOH: Building Resilient, Equitable Healthcare Systems","Supercharge healthcare with SRE principles for Social Determinants of Health! Harness data, automate workflows, and drive impactful outcomes. Discover proven tactics to cut ER visits, boost care coordination, and bridge health equity gaps—revolutionize your approach now! ​​",https://www.linkedin.com/in/roja-perumandla-636171a9/,,,,Roja Perumandla - Conf42 Site Reliablity Engineering (SRE) 2025.pdf,Roja Perumandla_sre.png,https://youtu.be/ppb9QdfbvJ0,"applying,sre,principles",
Yes,,Shaalmali Raychaudhury,SRE,PayPal,,,,Navigating SRE/Incident Management,"Navigating job search in tech SRE/Incident management as a fresh graduate
Handling critical incident bridges
Managing difficult clients in stressed situations
Understanding how SRE roles vary across organizations,how to adapt
Bringing awareness to what SRE encompasses in various environments",https://www.linkedin.com/in/shaalmali-r-6b6560111/,,,,Shaalmali Raychaudhury - Conf42 Site Reliablity Engineering (SRE) 2025.pdf,Shaalmali Raychaudhury_sre.png,https://youtu.be/RcHb1TkmPBk,"navigating,sre,incident",
Yes,,Vijaybhasker Pagidoju,Lead Site Reliability Engineer,,,,,AI-Driven Self-Healing Infrastructure: The Next Evolution of SRE,"Site Reliability Engineering (SRE) has evolved from manual incident response to automated workflows, but AI is unlocking the next major shift—self-healing infrastructure. What if failures could be predicted, prevented, and resolved autonomously, without human intervention?

## Keynote Overview

In this keynote, I will explore:

- **AI-Driven Failure Prediction**  
  How AI is enabling the prediction, prevention, and resolution of failures in infrastructure.

- **Automated Remediation and Self-Adaptive Environments**  
  The shift from reactive alert-based monitoring to predictive, self-healing reliability engineering.

- **Real-World Insights**  
  Case studies and practical examples of how AI is being applied to reduce Mean Time to Recovery (MTTR) and automate resilience.

- **The Implications of AI-Native SRE**  
  Long-term impacts on engineers and organizations, and how to prepare for this evolution.

As AI continues to transform infrastructure reliability, this talk will outline practical strategies for embracing these advancements and preparing for the next wave of SRE innovation.
",https://www.linkedin.com/in/vijaypagi/,,,,Vijaybhasker Pagidoju - Conf42 Site Reliablity Engineering (SRE) 2025.pdf,Vijaybhasker Pagidoju_sre.png,https://youtu.be/C2eR1SedXDw,"self-healing,infrastructure",
No,accessibility,Rinku Mohan,Senior Software Engineer,Bettercoach,,,,Ensuring Sustainable Digital Inclusion for Elderly Users,"Learn actionable strategies to bridge the digital divide, using tools like SSO and user-focused systems to ensure sustainable inclusion for elderly users.",https://www.linkedin.com/in/rinku-mohan-06419310a/,,,,Rinku Mohan - Conf42 Site Reliablity Engineering (SRE) 2025.pdf,Rinku Mohan_sre.png,https://youtu.be/cRtnJMuCYy8,"ensuring,sustainable,digital",
No,accessibility,Utham Kumar,,Nanyang Technological University,,,,Scaling Financial Inclusion: SRE Practices for High-Performance Payment Systems in Emerging Markets,"Discover how SRE transforms payment systems in emerging markets, delivering 99.95% reliability despite unstable networks. Learn practical techniques for scaling financial services to millions of unbanked users while maintaining security and resilience in challenging environments.",,,,,Utham Kumar - Conf42 Site Reliablity Engineering (SRE) 2025.pdf,Utham Kumar_sre.png,https://youtu.be/H-MbxXhcQzg,"scaling,financial,inclusion",
No,ai,Rahul Amte,Senior Cloud Engineer,Nivid Technologies,,,,AI and Chaos Engineering: Smarter Failure Testing for Resilient Systems,"Modern cloud systems are becoming increasingly complex, making traditional failure testing methods inefficient and reactive. AI-driven Chaos Engineering introduces automation, intelligence, and adaptability to fault injection, enabling predictive failure detection and self-healing capabilities. By leveraging machine learning, SREs can identify failure patterns, optimize chaos experiments dynamically, and accelerate incident response. This talk explores how AI enhances Chaos Engineering, reducing downtime, improving resilience, and enabling proactive reliability strategies. Attendees will gain insights into real-world implementations of AI-powered failure testing and how to integrate it into their SRE practices.",https://www.linkedin.com/in/rahul-a-a5923b139/,,,,Rahul Amte - Conf42 Site Reliablity Engineering (SRE) 2025.pdf,Rahul Amte_sre.png,https://youtu.be/jqHLR-eLrkQ,"smarter,failure,testing",
No,ai,Pushpalatha KR,Senior Software Engineer,HP,,,,Contextual understanding and response generation with high-dimensional embeddings using Generative Artificial Intelligence,Solution approach that enhances contextual understanding and response generation by first encoding user inputs into high-dimensional embeddings using Gen AI. Embeddings are then used for efficient semantic search and retrieval of relevant context integrated into prompts for the chat completion model,https://www.linkedin.com/in/pushpalatha-kr-6a9b4121/,,,,Pushpalatha KR - Conf42 Site Reliablity Engineering (SRE) 2025.pdf,Pushpalatha KR_sre.png,https://youtu.be/IwsHE-L93D4,"contextual,understanding,response",
No,ai,Tajudeen Oyindamola Tajudeen,Software Engineer,JP Morgan Chase & Co.,,,,SRE vs DevOps: What’s the Difference and Why It Matters,"I’ll break down the key differences between SRE and DevOps, how they overlap, and why it matters for building reliable systems. Whether you're in DevOps or SRE, you'll leave with a clear understanding of both roles and how to bridge the gap for better collaboration.",https://linkedin.com/in/tajudeen-oyindamola/,Pterjudin_Oyin,,,Tajudeen Oyindamola Tajudeen - Conf42 Site Reliablity Engineering (SRE) 2025.pdf,Tajudeen Oyindamola Tajudeen_sre.png,https://youtu.be/zjg9BdK20qE,"sre,vs,devops",
No,ai,Raghu Chukkala,Lead AI Chatbot Engineer/Architect,Verizon,,,,Scaling Conversational AI: SRE Challenges and Solutions for High-Availability CCAI Systems,Discover how to build bulletproof Conversational AI that never fails under pressure. Learn battle-tested SRE strategies that cut MTTR by 73% while maintaining sub-300ms response times across billions of interactions. Scale CCAI with confidence.,https://www.linkedin.com/in/raghu-chukkala-50a54472/,,,,Raghu Chukkala - Conf42 Site Reliablity Engineering (SRE) 2025.pdf,Raghu Chukkala_sre.png,https://youtu.be/qPUBmtFfFTk,"scaling,conversational,ai",
No,ai,Sanath Chilakala,"Director, Digital Solution Architecture",NTT DATA,,,,AI-Powered Mainframe Modernization: Enhancing Reliability in Legacy System Transformation,"Discover how AI revolutionizes mainframe modernization while ensuring reliability. Learn practical strategies for using machine learning to transform legacy systems, reduce incidents, and overcome technical challenges—all while maintaining operational stability throughout your modernization journey.",https://www.linkedin.com/in/sanath-chilakala-ba7b7b36/,,,,Sanath Chilakala - Conf42 Site Reliablity Engineering (SRE) 2025.pdf,Sanath Chilakala_sre.png,https://youtu.be/KGkjJWkjH18,"ai,powered,mainframe",
No,ai,Sanjeev Pellikoduku,Senior Cloud Software Engineer,SLB,,,,AI-Driven Cloud Solutions: Overcoming Challenges and Ensuring Ethical Deployment in Site Reliability Engineering,"Unlock the future of cloud computing with AI-driven solutions! Learn how to tackle security, integration, and operational challenges while ensuring ethical AI deployment. Discover proven strategies, cutting-edge technologies, and real-world solutions to boost efficiency",https://www.linkedin.com/in/sanjeev-pellikoduku-8b2b8b46/,,,,Sanjeev Pellikoduku - Conf42 Site Reliablity Engineering (SRE) 2025.pdf,Sanjeev Pellikoduku_sre.png,https://youtu.be/EPPlnrgrfnY,"ai,driven,cloud",
No,ai,Bhashwanth Kadapagunta,Specialist Leader (Senior Manager),Deloitte,,,,Integrating AI into Cloud Platforms: A Roadmap for Enterprises,"The fusion of artificial intelligence (AI) and cloud computing is reshaping the enterprise landscape, offering unprecedented opportunities for innovation, efficiency, and competitive advantage. For businesses, this integration is no longer optional—it’s a strategic imperative. However, the journey to seamlessly embedding AI into cloud platforms is complex, requiring careful planning, robust architectures, and a clear understanding of operational challenges. This session provides a detailed roadmap for enterprises aiming to integrate AI into their cloud ecosystems. Tailored for experts in the field, it delves into architectural considerations, strategic alignment, and actionable steps to overcome hurdles. ",https://www.linkedin.com/in/bhashwanth/,,,,Bhashwanth Kadapagunta - Conf42 Site Reliablity Engineering (SRE) 2025.pdf,Bhashwanth Kadapagunta_sre.png,https://youtu.be/v-NLAaU0ZNE,"platforms,enterprise,ai",
No,ai,Rajarshi Tarafdar,,JP Morgan Chase,,,,Human-AI Symbiotic Robotics: Revolutionizing Precision in Collaborative Systems with Data-Driven Advancements,"Discover how Human-AI symbiotic robotics is transforming precision industries like surgery, boosting efficiency, reducing errors, and enhancing human capabilities. Explore groundbreaking advancements in AI prediction, multimodal communication",,,,,Rajarshi Tarafdar - Conf42 Site Reliablity Engineering (SRE) 2025.pdf,Rajarshi Tarafdar_sre.png,https://youtu.be/L1kRpdRSlMw,"human,ai,symbiotic",
No,ai,Pradeep Kumar Vattumilli,,"JNTU, Kakinada, Andhra Pradesh, India.",,,,"Synthetic Data in AI: Enhancing Privacy, Efficiency, and Accuracy for Future-Ready Solutions","Unlock the future of AI with synthetic data! Revolutionizing privacy, efficiency, and accuracy in industries like healthcare and autonomous vehicles. This game-changing tech cuts costs, speeds up development, and enhances AI models for tomorrow’s innovations.",https://www.linkedin.com/in/narendra-kumar-vattumilli-11aa722b9/,,,,Pradeep Kumar Vattumilli - Conf42 Site Reliablity Engineering (SRE) 2025.pdf,Pradeep Kumar Vattumilli_sre.png,https://youtu.be/7iXmBQ8E110,"synthetic,data,ai",
No,architecture,Vlad Onetiu,Software Automation Engineer & DevSecOps,DataIceberg,,,,Real-time earthquake alert system: Leveraging Serverless architecture with Confluent Kafka,"In our upcoming presentation, we'll explore a cutting-edge architectural solution for real-time SMS and email notifications, particularly geared towards responding to earthquake events. This system is designed to handle rapid data transmission, listening for event changes every second, making it ideal for real time critical alert scenarios. Central to our discussion will be the integration of Lambda functions and Confluent Kafka, coupled with advanced multithreading techniques and DynamoDB lock strategies. A focal point of our presentation will be addressing the challenges and innovative solutions involved in integrating Confluent Kafka with Lambda functions to enable serverless operation of both producers and consumers. This is a key element in ensuring the quick and efficient distribution of notifications through parallel methods. Additionally, we will delve into the implementation of an automated scaling mechanism, which is vital for optimising the performance of the Serverless Notification ecosystem. Our aim is to provide a comprehensive insight into how these technologies can be effectively combined to develop a robust and efficient system, capable of delivering critical real-time alerts for situations like earthquake occurrences, ultimately playing a crucial role in saving human lives.",https://www.google.com/url?q=https://www.linkedin.com/in/vlad-onetiu/&sa=D&source=editors&ust=1743357399778559&usg=AOvVaw3PwMygbYgGtl2o92Pkyy71,,,,Vlad Onetiu - Conf42 Site Reliablity Engineering (SRE) 2025.pdf,Vlad Onetiu_sre.png,https://youtu.be/VFEM4u4OpJ8,"serverless,confluent,kafka",
No,architecture,Sai Prasad Mukala,Enterprise Architect,Info Keys Inc,,,,Site Reliability at Scale: Architecting Resilient Multi-Cloud Infrastructure,"Discover how elite SRE teams master multi-cloud complexity! Learn actionable strategies for AI-powered automation, securing distributed systems, and maintaining reliability at the edge—slash outage durations and operational costs while building resilience in today's evolving infrastructure landscape",https://www.linkedin.com/in/saiprasadmukala/,,,,Sai Prasad Mukala - Conf42 Site Reliablity Engineering (SRE) 2025.pdf,Sai Prasad Mukala_sre.png,https://youtu.be/KMy-Bs7_0ko,"site,reliability,scale",
No,architecture,Srikar Kompella,Software Engineer,Prime Video & Amazon Studio,,,,Transforming SaaS with Serverless Architectures: A Data-Driven Approach to Migrating from Monoliths to AWS Cloud Microservices,"Unlock the future of SaaS by migrating from monolithic apps to scalable, cost-efficient serverless architectures on AWS! Discover how serverless microservices, AWS Lambda, and event-driven models can boost agility, cut costs by up to 60%, and accelerate your development cycles.",https://www.linkedin.com/in/srikarkompella/,,,,Srikar Kompella - Conf42 Site Reliablity Engineering (SRE) 2025.pdf,Srikar Kompella_sre.png,https://youtu.be/PlEt2TaUJUU,"transforming,saas,serverless",
No,architecture,Nasir Sayed,Senior Software Engineer,Finra,,,,Transforming Enterprise Frontends with Micro-Frontend Architectures: ADP’s Client Engagement Hub Journey,"Discover how ADP transformed their enterprise apps with micro-frontend architectures, achieving 40% faster time-to-market, tripling deployment frequency, and enhancing performance. Join us for actionable insights on scaling, integrating, and optimizing micro-frontends for modern enterprise apps!",,,,,Nasir Sayed - Conf42 Site Reliablity Engineering (SRE) 2025.pdf,Nasir Sayed_sre.png,https://youtu.be/dYXkP-nmHCQ,"transforming,enterprise,frontends",
No,automation,Siddhartha Parimi,,Product Manager at Dell Technologies,,,,Unlocking the Cosmos: Revolutionizing Data Engineering for Space Exploration,"Cutting-edge data engineering is transforming space exploration! By managing vast data streams and using quantum computing & real-time processing, it's powering missions like the James Webb Space Telescope and driving the $423.8B space economy forward. Explore these groundbreaking innovations!",,,,,Siddhartha Parimi - Conf42 Site Reliablity Engineering (SRE) 2025.pdf,Siddhartha Parimi_sre.png,https://youtu.be/Xnr0ut5v9Sk,"unlocking,cosmos,revolutionizing",
No,automation,Mohit Sachdeva,,"Guru Gobind Singh Indraprastha University, New Delhi, India",,,,"Accelerating Operational Excellence: Integrating Automation, BPM, and SRE for Digital Enterprise","Unlock the power of Intelligent Automation and BPM to revolutionize your operations Learn how integrating  AI, ML, and SRE principles can drive efficiency, boost customer satisfaction, and future-proof your business. Don’t miss out on the future of digital transformation and competitive advantage",,,,,Mohit Sachdeva - Conf42 Site Reliablity Engineering (SRE) 2025.pdf,Mohit Sachdeva_sre.png,https://youtu.be/CaX7XlddV1I,"accelerating,operational,excellence",
No,automation,Vasipally Nagireddy,Principal Consultant,Creoal + SMX,,,,Driving Digital Transformation: Using Oracle Tech for E-Governance & Digital Inclusion in Rural Areas,"Explore how Oracle technologies bridge the digital divide through e-governance, transforming rural communities. From enhancing healthcare and agriculture to improving administration, innovative strategies drive digital inclusion and empower underserved populations for a brighter future!",https://www.linkedin.com/in/nagireddy-vasipally-44120814/,,,,Vasipally Nagireddy - Conf42 Site Reliablity Engineering (SRE) 2025.pdf,Vasipally Nagireddy_sre.png,https://youtu.be/33V4brj0bQo,"driving,digital,transformation",
No,cloud,Arun Pandiyan Perumal,Site Reliability Engineer,Adobe,,,,Managing Multi-Cloud Complexity: How Effective SRE Can Reduce Operational Overhead and Improve Performance,"Discover the keys to demystify multi-cloud complexity! Learn to explore how cutting-edge Site Reliability Engineering practices enhance system reliability, drastically reduce operational overhead, and achieve peak performance in multi-cloud infrastructures.",https://www.linkedin.com/in/arunpandiyanperumal,,,,Arun Pandiyan Perumal - Conf42 Site Reliablity Engineering (SRE) 2025.pdf,Arun Pandiyan Perumal_sre.png,https://youtu.be/EZsB8OvgUNs,"managing,multi,cloud",
No,cloud,Peter De Tender,Business Program Manager - Azure Technical Trainer,Microsoft,,,,Azure Load Testing in action,"What if you could hammer your websites running anywhere, through a slick SRE tool in Azure? And integrating it in your CI/CD Application Lifecycle Management? Welcome to Azure Load Testing",https://www.linkedin.com/in/pdtit/,pdtit,,,,Peter De Tender_sre.png,https://youtu.be/R4diTt1i2go,"azure,load,testing",
No,cloud,Nikhil Kassetty,Software Engineer,Intuit,,,,Ensuring High Availability and Low Latency in Distributed Systems Using Kubernetes,"Supercharge your distributed systems with Kubernetes for lightning-fast, low-latency data processing! Learn how Kubernetes' auto-scaling, fault tolerance, and seamless resource management boost performance and reliability, powering real-time applications in financial, IoT, and other critical sectors",https://www.linkedin.com/in/nikhil-kassetty-905928137/,,,,Nikhil Kassetty - Conf42 Site Reliablity Engineering (SRE) 2025.pdf,Nikhil Kassetty_sre.png,https://youtu.be/bWedF6CLCaQ,"ensuring,high,availability",
No,cloud,Asif Mehboob,"Sr. Manager, Software and Business Intelligence Engineering",Freeport LNG,,,,Revolutionizing Legacy Systems with .NET and Microservices: Enhancing Scalability and Agility,"Unlock the power of .NET & microservices to transform legacy systems! Migrate from monolithic to modular architectures for enhanced scalability, performance & agility. Learn modern techniques to upgrade your infrastructure & stay ahead in today’s fast-paced digital world!",https://www.linkedin.com/in/asifmehboob/,,,,Asif Mehboob - Conf42 Site Reliablity Engineering (SRE) 2025.pdf,Asif Mehboob_sre.png,https://youtu.be/xJ7vgX4R8yI,"revolutionizing,legacy,systems",
No,cloud,Sanjiv Bhagat,,Visvesvaraya Technological University,,,,SRE at Scale: Building Resilient Cloud Infrastructure for Higher Education ERPs,Learn how we transformed brittle university ERPs into resilient cloud systems with 99.99% uptime and 78% fewer security incidents. Get battle-tested SRE strategies for handling extreme traffic spikes and building infrastructure that never fails—even during finals week.,,,,,,Sanjiv Bhagat_sre.png,https://youtu.be/BLotdwyHUAk,"sre,scale,building",
No,cloud,Ricardo Castro,"Principal Engineer, SRE",FanDuel / Blip.pt,,,,What Can We Learn from Formula 1 Incident Management,"How can software and SRE teams learn about incident management from Formula 1? This talk will discuss the key takeaways from a real-life incident where Red Bull Racing performed a miraculous repair on Max Verstappen’s car in Hungary,  turning a potential disaster into a podium finish.",https://www.linkedin.com/in/mccricardo/,mccricardo,,,,Ricardo Castro_sre.png,https://youtu.be/s2O-zbLan9w,"what,can,we",
No,databases,Sharanya Prasad,Senior Product Manager,,,,,"Building Resilient Digital Infrastructures: Integrating Networking and Security for Agile, Secure Operations","Unlock the power of converging networking & security to build resilient infrastructures. Discover how SDN, SASE, & Zero Trust streamline operations, reduce risks, and accelerate incident response, empowering your organization to stay secure & innovative in a digital-first world!",https://www.linkedin.com/in/sharanyavprasad/,,,,Sharanya Prasad - Conf42 Site Reliablity Engineering (SRE) 2025.pdf,Sharanya Prasad_sre.png,https://youtu.be/ng47D7y57PQ,"building,resilient,digital",
No,databases,Andrei Manakov,Senior Staff Software Engineer,ShareChat,,,,Modern Database Architectures: From SQL to NoSQL and Distributed SQL,"Explore the real-world trade-offs in distributed NoSQL database design and how to apply the CAP Theorem to build highly available, scalable, and fault-tolerant systems. Learn key strategies for balancing consistency and partition tolerance in distributed environments with practical insights.",https://www.linkedin.com/in/andrei-manakov-69228a81/,,,,Andrei Manakov - Conf42 Site Reliablity Engineering (SRE) 2025.pdf,Andrei Manakov_sre.png,https://youtu.be/rFjNVK4wvmM,"tradeoffs,distributed,nosql",
No,databases,Renato Losio,Principal Cloud Architect,Funambol,,,,Things Fall Apart: Navigating Managed Databases for Over a Decade as a Non-DBA,"Learn to navigate database benchmarks wisely! From crashing managed instances to skyrocketing storage costs, I'll share hard-earned lessons from a decade of managing production databases on the cloud without DBA expertise.",https://www.linkedin.com/in/rlosio/,,,,Renato Losio - Conf42 Site Reliablity Engineering (SRE) 2025.pdf,Renato Losio_sre.png,https://youtu.be/FYaK3g5uj8g,"things,fall,apart",
No,databases,Samuel Baruffi,Principal Global Solutions Architect,AWS,,,,"Amazon Aurora DSQL: The Future of Scalable, Distributed Relational Databases","Amazon Aurora DSQL is a serverless, distributed SQL database that delivers active-active high availability, automatic scaling, and zero infrastructure management. It ensures 99.999% uptime, making it ideal for high-performance, mission-critical applications",https://www.linkedin.com/in/samuelbaruffi/,SamuelBaruffi,,,Samuel Baruffi - Conf42 Site Reliablity Engineering (SRE) 2025.pdf,Samuel Baruffi_sre.png,https://youtu.be/E0RpuwHBifU,"amazon,aurora,dsql",
No,databases,Sivasubramanian Bagavathiappan,SRE Leader,GuhaTek,,,,Unified Observability-A Single Pane of Glass and Single Source of truth,"Managing multiple monitoring tools in an organization can lead to fragmented insights and delayed decision-making. Unified observability provides a solution by integrating diverse data sources into one, enabling teams to quickly identify issues, perform RCA, and take proactive actions.",https://www.linkedin.com/in/kbsivacse/,,,,Sivasubramanian Bagavathiappan - Conf42 Site Reliablity Engineering (SRE) 2025.pdf,Sivasubramanian Bagavathiappan_sre.png,https://youtu.be/Ua9TWPnVsGE,"unified,observability,single",
