Featured,Track,Name1,JobTitle1,Company1,Name2,JobTitle2,Company2,Title,Abstract,LinkedIn1,Twitter1,LinkedIn2,Twitter2,Slides,Picture,YouTube,Keywords,Duration
No,engineering,Ashis Chowdhury,Lead Software Engineer,Mastercard,,,,"Designing Robust and Scalable Distributed Applications – Architectural Patterns, Challenges, and Best Practices","Organizations are under increasing pressure to build highly available, fault-tolerant, and scalable distributed applications. This presentation explores key architectural patterns such as microservices, event-driven systems, and serverless computing, alongside their respective trade-offs. Ashis will address challenges related to data consistency, fault tolerance, and network latency, providing practical solutions to enhance reliability and performance.

Attendees will gain actionable insights on building resilient distributed systems that can manage large-scale data while maintaining operational efficiency.

I truly hope there is still room for Ashis to contribute his expertise to the conference. I would be happy to provide further details or adjust the proposal if necessary. Thank you for your time and consideration, and I look forward to hearing from you.",https://www.linkedin.com/in/ashis-chowdhury/,,,,Ashis Chowdhury - Conf42 Site Reliablity Engineering (SRE) 2025.pdf,Ashis Chowdhury_sre.png,https://youtu.be/2R7PV49Hlmo,"robust,distributed,apps",
No,engineering,Balaji Bodicherla,Salesforce Solution Architect,T-Mobile,,,,"Optimizing Salesforce Integration for Scalable, Real-Time Performance: APIs, Middleware, & Event-Driven Architectures","Unlock the power of Salesforce integration with a deep dive into APIs, middleware (MuleSoft), and real-time data synchronization. Learn how to optimize performance, scalability, and security while leveraging event-driven architectures for seamless, high-performance enterprise solutions",https://www.linkedin.com/in/balaji-bodicherla-61441517/,,,,Balaji Bodicherla - Conf42 Site Reliablity Engineering (SRE) 2025.pdf,Balaji Bodicherla_sre.png,https://youtu.be/oHLAdOatdp0,"optimizing,salesforce,integration",
No,engineering,Sarathe Krisshnan Jutoo Vijayaraghavan,Senior Consultant,CGI Technologies,,,,Enhancing Security and Compliance with Policy as Code (PaC) in Jenkins for DevOps Pipelines,"Automate security & compliance with Policy as Code (PaC) in Jenkins! Integrate PaC into your DevOps pipeline to enforce policies at every stage, reduce misconfigurations, and ensure continuous compliance. Achieve automated governance & robust security in modern development.",https://www.linkedin.com/in/sarathe-krisshnan-j-895b0631/,,,,Sarathe Krisshnan Jutoo Vijayaraghavan - Conf42 Site Reliablity Engineering (SRE) 2025.pdf,Sarathe Krisshnan Jutoo Vijayaraghavan_sre.png,https://youtu.be/20VMpHWCpbk,"enhancing,security,compliance",
No,engineering,Gokul Babu Kuttuva Ganesan,,ComTec information systems,,,,Beyond REST: Exploring Modern API Paradigms for Enhanced Enterprise Integration,"Discover how top organizations are revolutionizing integration by moving beyond REST APIs. Explore six cutting-edge approaches that slash development time, reduce costs, and boost scalability. Get a practical framework to select the right API technology for your specific challenges.",https://www.linkedin.com/in/gokul-babu-kuttuva-ganesan-18469a13/,,,,Gokul Babu Kuttuva Ganesan - Conf42 Site Reliablity Engineering (SRE) 2025.pdf,Gokul Babu Kuttuva Ganesan_sre.png,https://youtu.be/j-ox6wDP0kk,"beyond,rest,exploring",
No,engineering,Kowshik Sakinala,,California State University Fullerton,,,,Revolutionizing Infrastructure Management: The Future of GitOps in Modern DevOps,"Unlock the future of DevOps with GitOps! Automate infrastructure management, streamline deployment, and boost system reliability. See how top companies use GitOps to transform workflows and deliver software faster & more efficiently. Don’t miss out on this game-changing approach!",,,,,Kowshik Sakinala - Conf42 Site Reliablity Engineering (SRE) 2025.pdf,Kowshik Sakinala_sre.png,https://youtu.be/dfIBtaoXG5M,"revolutionizing,infrastructure,management",
No,engineering,Ravinder Katla,Advanced infotainment systems integration engineer,General Motors,,,,The Evolution of AI-Enhanced Automotive Infotainment Systems: Technical Innovations and Future Prospects,"Discover how AI is revolutionizing automotive infotainment systems, enhancing safety, usability, and user experience. Explore groundbreaking advancements in voice recognition, predictive AI, and driver monitoring that reduce distractions, increase engagement, and pave the way for connected",https://www.linkedin.com/in/ravinder-katla-693365124/,,,,,Ravinder Katla_sre.png,https://youtu.be/orUSTrDn1lc,"evolution,ai,enhanced",
No,fintech,Sidhartha Velishala,Technical SME,Humana,,,,SRE and Healthcare Data Compliance: Balancing Security and Reliability,"Site Reliability Engineering (SRE) is transforming how healthcare organizations maintain uptime, security, and performance in critical systems. In this talk,",https://www.linkedin.com/in/sid-velishala,,,,Sidhartha Velishala - Conf42 Site Reliablity Engineering (SRE) 2025.pdf,Sidhartha Velishala_sre.png,https://youtu.be/1j_byywYEGo,"sre,healthcare,data",
No,fintech,Jaya Krishna Vemuri,Vice President,State Street Bank and Trust Company,,,,Optimizing Financial Accuracy: Cloud-Driven Reconciliation for Scalable and Resilient Investment Banking,"Optimize financial data accuracy in investment banking! Cloud-powered reconciliation cuts errors, automates compliance, and scales effortlessly. Top firms reduced manual effort by 75% & costs by 40% while boosting accuracy. Join us to transform financial data integrity!",https://www.linkedin.com/in/jaya-krishna-vemuri-7b2ab860/,,,,Jaya Krishna Vemuri - Conf42 Site Reliablity Engineering (SRE) 2025.pdf,Jaya Krishna Vemuri_sre.png,https://youtu.be/eID6oWAWJNQ,"optimizing,financial,accuracy",
No,fintech,Siddharth Joshi,Senior Staff Engineer/Senior DevOps Tech Lead,Nagarro,,,,Reliability Excellence with SLO Management Products,"Reliability Excellence with SLO Management Products which focuses on ensuring system reliability by setting, measuring, and optimizing Service Level Objectives (SLOs). These products help teams proactively monitor performance, reduce downtime, and align reliability with business goals.",https://www.linkedin.com/in/siddharth-joshi-96641623,,,,Siddharth Joshi - Conf42 Site Reliablity Engineering (SRE) 2025.pdf,Siddharth Joshi_sre.png,https://youtu.be/0ctN3zcZN5w,"reliability,excellence,slo",
No,fintech,Sudhakar Reddy Narra,Senior Staff Performance Engineer,ServiceNow,,,,Beyond Optimization: Engineering Resilient Cloud Microservices with SRE Principles at Scale,"Discover how SRE principles transform cloud microservices performance at scale. I'll share battle-tested strategies that slashed response times, optimized resources, and strengthened resilience. Learn practical techniques that deliver both technical excellence and measurable business value.",https://www.linkedin.com/in/sudhakar-reddy-narra-05751655/,,,,Sudhakar Reddy Narra - Conf42 Site Reliablity Engineering (SRE) 2025.pdf,Sudhakar Reddy Narra_sre.png,https://youtu.be/8AonvzPWEng,"beyond,optimization,engineering",
No,fintech,Sumanth Kadulla,Senior Technical Lead - Cloud Engineer,,,,,From Devops to NoOps : can AI automate everything?,"AI is revolutionizing CloudOps pushing us towards NoOps where infrastructure, deployments, security are self-managed with minimal human intervention. Discover how AI-driven automation boosts efficiency, reduces downtime, reshapes the role of DevOps engineers, while raising key security challenges.",https://www.linkedin.com/in/sumanth-kadulla-23230b121,,,,Sumanth Kadulla - Conf42 Site Reliablity Engineering (SRE) 2025.pdf,Sumanth Kadulla_sre.png,https://youtu.be/AqS_E4NS5OQ,"devops,noops,can",
No,fintech,Venkata Anil Kumar Nilisetty,Java Full Stack Lead Developer,Cognizant,,,,AI-Powered Anomaly Detection and Self-Healing Systems for Resilient and Efficient Supply Chains,"Unlock the future of supply chains with AI-driven anomaly detection and self-healing systems! Discover how advanced technologies like AI, blockchain, and real-time data processing can drastically reduce disruption, enhance fraud prevention, and boost operational efficiency in just minutes.",https://www.linkedin.com/in/nvanilkumar/,,,,Venkata Anil Kumar Nilisetty - Conf42 Site Reliablity Engineering (SRE) 2025.pdf,Venkata Anil Kumar Nilisetty_sre.png,https://youtu.be/yRu07ppC230,"ai,powered,anomaly",
No,fintech,Likhit Mada,Software Engineer Co-op,Intuit,,,,AI-Powered Anomaly Detection and Self-Healing Systems for Resilient and Efficient Supply Chains,"Unlock the future of mobile payments! Explore the breakthroughs in security, scalability, and reliability driving global adoption. Learn how platforms like Apple Pay and UPI are reshaping commerce, and discover the challenges and innovations shaping the future of FinTech on a global scale.",https://www.linkedin.com/in/likhit-mada/,,,,Likhit Mada - Conf42 Site Reliablity Engineering (SRE) 2025.pdf,Likhit Mada_sre.png,https://youtu.be/SvF9KxT0C4c,"evolution,mobile,payment",
No,fintech,Sasidhar Reddy Somula,,Sri Revana Siddeshwara Institute of Technology,,,,Real-Time Fraud Prevention at Scale: SRE + Advanced ML for MCCA Reimbursement Protection ​​,"Revolutionize your fraud defenses with lightning-fast, real-time detection powered by Advanced Machine Learning and SRE principles. Learn how to slash losses by over 50%, cut investigation times by 70%, and ensure bulletproof reliability—transforming MCCA reimbursements from risk to reward! ​​",,,,,Sasidhar Reddy Somula - Conf42 Site Reliablity Engineering (SRE) 2025.pdf,Sasidhar Reddy Somula_sre.png,https://youtu.be/IxNdPmSBDYc,"real,time,fraud",
No,fintech,Pavan Kumar Bollineni,Manager,Deloitte,,,,Ensuring Financial System Reliability: SRE Principles in SAP S/4HANA Implementation,Discover how SRE principles transformed a global manufacturer's financial backbone from fragile legacy systems to a resilient SAP platform. Learn actionable strategies that revolutionized availability and turned finance teams from skeptics to passionate SRE evangelists.,,,,,Pavan Kumar Bollineni - Conf42 Site Reliablity Engineering (SRE) 2025.pdf,Pavan Kumar Bollineni_sre.png,https://youtu.be/msSp8i4PLFo,"ensuring,financial,system",
No,fintech,Lokeshkumar Madabathula,,,,,,AI-Powered Risk Management: Leveraging Predictive Models for Financial Stability Amid Market Uncertainty,"Unlock the future of finance with AI-driven risk management! See how predictive models are transforming market volatility, enabling smarter decisions, and saving millions. Explore cutting-edge techniques and real-world case studies reshaping financial stability for tomorrow's markets.",,,,,Lokeshkumar Madabathula - Conf42 Site Reliablity Engineering (SRE) 2025.pdf,Lokeshkumar Madabathula_sre.png,https://youtu.be/q1PZfJU4u3I,"ai,powered,risk",
No,fintech,Prakash Vanga,,Sriven technologies LLC,,,,Building Financial Fortresses: Scaling Cloud-Native AI for Real-Time Fraud Detection,"Discover how SRE principles power AI fraud detection that processes millions of transactions in milliseconds. Learn battle-tested strategies for scaling ML pipelines, preventing failures, and achieving 99.99% availability while stopping fraudsters in real-time. Real metrics, real solutions.",,,,,Prakash Vanga - Conf42 Site Reliablity Engineering (SRE) 2025.pdf,Prakash Vanga_sre.png,https://youtu.be/5uZi0W938KQ,"building,financial,fortresses",
No,hardware,Murali Krishna Reddy Mandalapu,"Senior Director, Hardware Engineering",Renesas Electronics,,,,Overcoming Interconnect Bottlenecks in GPU-Accelerated HPC Clusters for Scalable Exascale Performance,"Unlock GPU-accelerated HPC systems' full potential! Tackle interconnect bottlenecks with RDMA & advanced topologies. Explore how hardware & software innovations drive exascale performance and the future of ultra-low-latency, high-bandwidth interconnects.",https://www.linkedin.com/in/murali-kr-mandalapu/,,,,Murali Krishna Reddy Mandalapu - Conf42 Site Reliablity Engineering (SRE) 2025.pdf,Murali Krishna Reddy Mandalapu_sre.png,https://youtu.be/32JsOcwb-mY,"overcoming,interconnect,bottlenecks",
No,hardware,Venkatachala Nivas Chainuru,,California State University Northridge,,,,"Streamlining AI Infrastructure for Enterprises: Virtualized GPUs for Scalable, Cost-Efficient AI Solutions","Unlock AI's full potential with virtualized GPU tech! Dell, VMware, and NVIDIA are transforming enterprise AI, delivering 3.9x better performance, cutting costs by 40%, and speeding up deployment, empowering organizations to scale AI solutions efficiently.",,,,,Venkatachala Nivas Chainuru - Conf42 Site Reliablity Engineering (SRE) 2025.pdf,Venkatachala Nivas Chainuru_sre.png,https://youtu.be/OA0VyIVwCDg,"streamlining,ai,infrastructure",
No,healthcare,Bhushan Gopala Reddy,Embedded Software Engineer,Aruba Networks,,,,Resilient Health Monitoring: Engineering BLE Systems for Disaster Zone Reliability,Discover how SRE principles transformed our BLE health monitoring system to achieve 99.99% uptime in disaster zones. Learn practical techniques for extreme reliability when traditional infrastructure fails and lives hang in the balance.,https://www.linkedin.com/in/bhushangopalareddy/,,,,Bhushan Gopala Reddy - Conf42 Site Reliablity Engineering (SRE) 2025.pdf,Bhushan Gopala Reddy_sre.png,https://youtu.be/9liSpntNqNc,"resilient,health,monitoring",
No,healthcare,Santhosh Kumar Rai,SAP Lead Consultant,"Xpress Global IT Solutions, Hayward, CA .",,,,Ensuring Reliability in Healthcare Data Engineering: Building Scalable and Resilient Systems for Precision Medicine,"Transform Healthcare with SRE! With 10,000 exabytes of medical data by 2025, reliability is life-saving. Learn how SRE principles power AI-driven diagnostics, real-time monitoring & precision medicine while tackling compliance, scalability & security. Build the future of resilient healthcare!",https://www.linkedin.com/in/santhosh-r-4944467/,,,,Santhosh Kumar Rai - Conf42 Site Reliablity Engineering (SRE) 2025.pdf,Santhosh Kumar Rai_sre.png,https://youtu.be/0HCD94VWu5k,"ensuring,reliability,healthcare",
No,healthcare,Arun Vivek Supramanian,Senior Data Engineer,Amazon,,,,Revolutionizing Healthcare with Big Data and Machine Learning: Transforming Patient Care,"Discover how big data and machine learning are revolutionizing healthcare!Learn how these technologies are transforming patient care, improving clinical outcomes, and optimizing operations. Explore the challenges and opportunities of implementing AI-driven solutions in real-world healthcare settings",,,,,Arun Vivek Supramanian - Conf42 Site Reliablity Engineering (SRE) 2025.pdf,Arun Vivek Supramanian_sre.png,https://youtu.be/R_nV0otZXWw,"revolutionizing,healthcare,big",
No,healthcare,Peeyush Khandelwal,,University of Rajasthan,,,,Implementing AI-Driven Observability: SRE Practices for Reliable Healthcare Systems,"Discover how SRE practices revolutionize healthcare AI! Learn practical strategies for implementing observability, chaos engineering, and error budgeting that maintain reliability while enabling innovation. Get actionable blueprints for resilient healthcare systems",https://www.linkedin.com/in/peeyush-khandelwal-8275b211/,,,,Peeyush Khandelwal - Conf42 Site Reliablity Engineering (SRE) 2025.pdf,Peeyush Khandelwal_sre.png,https://youtu.be/_SQGoTAUCoo,"implementing,ai,driven",
No,healthcare,Tarun Kumar Chatterjee,.NET Senior Lead Developer,Presidio,,,,From Complexity to Clarity: Our Serverless Journey That Slashed Costs While Boosting Developer Velocity,"Discover how we transformed our infrastructure with serverless, slashing costs while boosting developer productivity. I'll share our journey—challenges, solutions, and wins—giving you a practical roadmap to similar results. No theory, just battle-tested strategies you can implement today.",https://www.linkedin.com/in/tarun-kumar-chatterjee-605963176/,,,,Tarun Kumar Chatterjee - Conf42 Site Reliablity Engineering (SRE) 2025.pdf,Tarun Kumar Chatterjee_sre.png,https://youtu.be/Lgki-2gTlqk,"complexity,clarity,our",
No,healthcare,Venkata Krishna Ramesh Kumar Koppireddy,,,,,,Enhancing Enterprise Security with AI: A Strategic Framework for Automation and Threat Management,"Unlock the future of cybersecurity with AI! Leverage automation, real-time threat detection, and proactive defense strategies to transform your security. Build resilient, efficient infrastructures that stay ahead of evolving threats. Secure your future today!",,,,,Venkata Krishna Ramesh Kumar Koppireddy - Conf42 Site Reliablity Engineering (SRE) 2025.pdf,Venkata Krishna Ramesh Kumar Koppireddy_sre.png,https://youtu.be/U2RdHKTx8z4,"enhancing,enterprise,security",
No,healthcare,Srinivas Vallabhaneni,,Arizona State University,,,,Edge Intelligence: Optimizing Distributed Systems with Real-Time Analytics at the Source,"Discover how to apply SRE principles at the edge to boost reliability! Learn techniques for implementing observable, self-healing systems that reduce latency, optimize bandwidth, and scale efficiently. Transform your distributed infrastructure into a resilient, automated powerhouse.",,,,,Srinivas Vallabhaneni - Conf42 Site Reliablity Engineering (SRE) 2025.pdf,Srinivas Vallabhaneni_sre.png,https://youtu.be/UPzw7_HPt2E,"edge,intelligence,optimizing",
No,insurance,Balakrishna Sudabathula,Expert Software Engineer - Technology,Delta Dental Ins.,,,,Harnessing AI and Human Expertise to Drive Operational Excellence in Insurance,"AI and human expertise are transforming the insurance industry! This dynamic duo is revolutionizing risk assessment, accelerating claims processing, and enhancing customer experiences. Explore how AI is boosting efficiency and reshaping the future of insurance! #InsuranceInnovation",https://www.linkedin.com/in/balakrishna-sudabathula-1993962b/,,,,Balakrishna Sudabathula - Conf42 Site Reliablity Engineering (SRE) 2025.pdf,Balakrishna Sudabathula_sre.png,https://youtu.be/xCmqQ0vLvU4,"harnessing,ai,human",
No,insurance,Harsha Vardhan Reddy Yeddula,,Osmania University Hyderabad.,,,,"Harnessing AI for Next-Gen Underwriting in Insurance: Boosting Efficiency, Precision, and Innovation","Unlock the future of insurance underwriting with AI! Machine learning, NLP, and computer vision are driving faster, more accurate risk assessments, reducing costs, and improving customer satisfaction. AI is reshaping the industry, enhancing fraud detection, and creating personalized products!",https://www.linkedin.com/in/harsha-vardhan-reddy-yeddula-1245b617/,,,,Harsha Vardhan Reddy Yeddula - Conf42 Site Reliablity Engineering (SRE) 2025.pdf,Harsha Vardhan Reddy Yeddula_sre.png,https://youtu.be/Cx3nH_oc5hE,"harnessing,ai,next",
No,monitoring,Smita Verma,,Adobe,,,,From Alerts to Action: Building SRE-Focused AI-Powered Autonomous Incident Response Systems at Scale,Discover how AI is revolutionizing SRE incident response! Learn how autonomous systems slash resolution times by 60% while cutting false positives to under 5%. I'll share real-world implementation strategies and results from enterprise deployments that delivered exceptional ROI within one year.,,,,,Smita Verma - Conf42 Site Reliablity Engineering (SRE) 2025.pdf,Smita Verma_sre.png,https://youtu.be/PFfch2EHEjc,"alerts,action,building",
No,monitoring,Rishabh Srivastava,"Manager, Technical Delivery & Integrations",MRI Software,,,,Mastering Monitoring and Alerting: The Key to Seamless System Performance,"Never let your application fail! Harness the power of real-time alerts and nonstop monitoring to catch issues, block threats, and turbocharge performance before users even notice. Stay one step ahead, eliminate downtime, and keep your app running flawlessly, 24/7!",https://www.linkedin.com/in/rishabhs13,,,,Rishabh Srivastava - Conf42 Site Reliablity Engineering (SRE) 2025.pdf,Rishabh Srivastava_sre.png,https://youtu.be/EjA3HujI3dI,"mastering,monitoring,alerting",
No,monitoring,Sanjeev Kumar,DevOps Specialist,Delta Dental Insurance,,,,Ensuring IT Infrastructure Reliability Through Robust Monitoring and Actionable Alerting,"Learn how robust monitoring and actionable alerting drive system reliability. Discover best practices, essential metrics, and real-world tools that reduce downtime, prevent alert fatigue, and keep systems running smoothly. Master the art of detecting issues before they impact users!",https://www.linkedin.com/in/sanjeevkumar-sk/,,,,Sanjeev Kumar - Conf42 Site Reliablity Engineering (SRE) 2025.pdf,Sanjeev Kumar_sre.png,https://youtu.be/B5hBWUTyGYo,"monitoring,alerting",
No,monitoring,Vishal Jaiswal,Senior Manager Technology,Optum,,,,"Building Scalable, Resilient Predictive Analytics Data Warehouses in Healthcare: SRE Focus","Unlock predictive analytics in healthcare with scalable, resilient data warehouses! Discover how SRE principles boost operational efficiency, enhance patient care, and ensure high availability. Learn to optimize performance, security, and integration for the future of healthcare data.",https://www.linkedin.com/in/ervishaljaiswal/,,,,Vishal Jaiswal - Conf42 Site Reliablity Engineering (SRE) 2025.pdf,Vishal Jaiswal_sre.png,https://youtu.be/Xe2Yc-CH2Js,"building,scalable,resilient",
No,o11y,Alok Ranjan,Engineering Manager,Dropbox,,,,From Fragmented Logs to Unified Insights: A Personal Journey in Scaling Observability,"At Dropbox, fragmented logs hindered clarity. I transformed observability with open-source tools, unifying container data. Join me for real-world lessons and personal insights on elevating DevOps culture and operational excellence.",https://www.linkedin.com/in/alok-g-ranjan/,,,,Alok Ranjan - Conf42 Site Reliablity Engineering (SRE) 2025.pdf,Alok Ranjan_sre.png,https://youtu.be/IOgCtHvRwko,"fragmented,logs,unified",
No,o11y,Hardik Patel,"Manager, Software Development",PayPal,,,,Optimizing System Performance: The Power of Observability in Distributed Environments,"Unlock the power of observability to boost your distributed systems! Learn how metrics, logs, and traces improve performance, reduce downtime, and enhance reliability. Discover strategies, best practices, and tools that drive efficiency and transform user experiences.",https://www.linkedin.com/in/h4rd1k/,,,,Hardik Patel - Conf42 Site Reliablity Engineering (SRE) 2025.pdf,Hardik Patel_sre.png,https://youtu.be/JDNbTUYLt0M,"optimizing,system,performance",
No,o11y,Sridhar Dachepelly,Senior Principal Software Engineer,Dell Technologies,,,,"Leveraging Blockchain for Test Data Integrity and Regulatory Compliance in Healthcare, Finance, and Pharmaceuticals","Unlock the power of blockchain to revolutionize test data integrity and regulatory compliance in healthcare, finance, and pharmaceuticals. Learn how this game-changing technology is slashing compliance costs, preventing data breaches, and ensuring regulatory success across industries. Don’t miss out",https://www.linkedin.com/in/sridhar-dachepelly-4129331b/,,,,Sridhar Dachepelly - Conf42 Site Reliablity Engineering (SRE) 2025.pdf,Sridhar Dachepelly_sre.png,https://youtu.be/nYlsC0DpEwY,"leveraging,blockchain,test",
No,o11y,Srinivas Reddy Mosali,Senior Consultant - Systems Engineer,Visa,,,,Beyond Uptime: Revolutionizing Fintech Reliability Through SRE Innovation,"Discover how a high-growth fintech startup mastered system reliability during a viral surge, slashed incident recovery times, and maintained perfect uptime through SRE innovation. Learn battle-tested strategies for balancing aggressive growth with regulatory compliance in the financial sector.",https://www.linkedin.com/in/srinivas-reddy-mosali-b9548b141/,,,,Srinivas Reddy Mosali - Conf42 Site Reliablity Engineering (SRE) 2025.pdf,Srinivas Reddy Mosali_sre.png,https://youtu.be/wAWyJMwWuO4,"beyond,uptime,revolutionizing",
No,o11y,Sujeeth Manchikanti,Test Architect,Capgemini,,,,Building Resilient Test Automation: A Universal Framework for SRE Success,"Unlock the future of test automation with the Universal Automation Framework (UAF)! A tool-agnostic, scalable solution that tackles software testing challenges, reduces costs, and boosts productivity. Discover how UAF empowers SRE teams to speed up delivery and ensure reliability!",https://www.linkedin.com/in/sujeeth-manchikanti-0b49523a/,,,,,Sujeeth Manchikanti_sre.png,https://youtu.be/Xe2Yc-CH2Js,"building,resilient,test",
No,o11y,Suman Neela,Integration Developer,AppsTek,,,,"Bridging Legacy and Cloud-Native Systems: Middleware Strategies for Scalable, Secure, and Resilient Enterprise Integration","Struggling to integrate legacy systems with cloud-native architectures? Middleware is the key! Discover how top enterprises boost reliability by 75%, cut manual processing by 48%, and secure hybrid environments. Join us to unlock seamless, scalable, and future-proof integration strategies!",https://www.linkedin.com/in/suman-neela/,,,,,Suman Neela_sre.png,https://youtu.be/dS64XZX3Rck,"bridging,legacy,cloud",
No,o11y,Mohit Menghnani,Staff Software Engineer,Twilio,,,,Unlocking Observability with React & Node.js,"This talk shares the secrets of observability with React and Node.js! We will discuss practical strategies for debugging, monitoring performance, and delivering seamless user experiences. The session will end with tips for reforming your dev workflow and ensuring your apps run flawlessly.",https://www.linkedin.com/in/mmenghnani/,,,,Mohit Menghnani - Conf42 Site Reliablity Engineering (SRE) 2025.pdf,Mohit Menghnani_sre.png,https://youtu.be/vvnI3mtHQVc,"unlocking,observability,react",
