Featured,Track,Name1,JobTitle1,Company1,Name2,JobTitle2,Company2,Title,Abstract,LinkedIn1,Twitter1,LinkedIn2,Twitter2,Slides,Picture,YouTube,Keywords,Duration
No,o11y,Sai KR Pentaparthi,,,,,,Network X-Ray Vision: Harnessing eBPF for Cloud-Native Observability Superpowers,"As Kubernetes clusters proliferate across enterprises, the invisible mesh of network communications has become a critical blind spot for operations teams. This presentation unveils how extended Berkeley Packet Filter (eBPF) technology fundamentally transforms network observability in cloud-native environments. Unlike conventional monitoring approaches that sample or aggregate data, eBPF delivers surgical precision by safely embedding observability directly into the Linux kernel, providing unprecedented visibility without performance penalties.

Through real-world implementation stories, you'll discover how organizations have slashed their mean time to resolution (MTTR) by over 70% for complex networking issues. We'll explore how eBPF enables teams to visualize previously invisible service-to-service dependencies, detect anomalous network behavior in real-time without costly packet captures, implement automated remediation workflows triggered by microsecond-level events, and optimize networking costs by identifying inefficient communication patterns.

This session bridges theory and practice, translating low-level kernel technology into actionable patterns that SREs and platform engineers can implement immediately. You'll leave with practical strategies for deploying eBPF-based observability in your environment, regardless of your kernel expertise level.",https://www.linkedin.com/in/saikalyanrp/,,,,Sai KR Pentaparthi - Conf42 Site Reliablity Engineering (SRE) 2025.pdf,Sai KR Pentaparthi_sre.png,https://youtu.be/tgOH4nK44x0,"xray,ebpf,o11y",
No,o11y,Krishna Rao Vemula,,Ikon Tech Services LLC,,,,Spring Boot Observability: Building Self-Healing Microservices for Modern SRE Practices,"Discover how Spring Boot transforms SRE practices by enabling self-healing microservices with built-in observability. Learn to slash MTTR, implement chaos engineering, and create resilient systems that prevent cascading failures—all while reducing on-call burdens.",,,,,Krishna Rao Vemula - Conf42 Site Reliablity Engineering (SRE) 2025.pdf,Krishna Rao Vemula_sre.png,https://youtu.be/mDxi4JQC2hg,"spring,boot,observability",
No,o11y,Prabhu Govindasamy Varadaraj,,Anna University,,,,Beyond Reactive Monitoring: Implementing AI-Powered Observability with Splunk for Sub-Minute Incident Resolution,"Discover how we slashed incident resolution time by 87% using Splunk's AI capabilities. Learn practical strategies that transformed our e-commerce platform from reactive firefighting to automated remediation, even during 3x traffic spikes. Real solutions, real results.",,,,,Prabhu Govindasamy Varadaraj - Conf42 Site Reliablity Engineering (SRE) 2025.pdf,Prabhu Govindasamy Varadaraj_sre.png,https://youtu.be/06Q3PANzLpA,"beyond,reactive,monitoring",
No,o11y,Srinivas Ankam,,"Cloud5 Solutions, USA",,,,Scaling Reliability: SRE Principles in AI-Driven Retail Logistics Platforms,"Discover how we applied SRE principles to build resilient retail logistics platforms handling 10x traffic spikes while powering AI innovation. Learn practical strategies for observability, chaos engineering, and incident management that keep systems reliable even when delivery robots go rogue.",,,,,Srinivas Ankam - Conf42 Site Reliablity Engineering (SRE) 2025.pdf,Srinivas Ankam_sre.png,https://youtu.be/lKJEj_E_348,"scaling,reliability,sre",
No,optimization,Vignesh Kuppa Amarnath,Software Engineer,MSRCOSMOS LLC,,,,Zero Data Loss at Scale: Building Resilient Asynchronous Messaging Systems for Modern Distributed Architectures,"Discover how to achieve the holy grail of messaging systems: zero data loss with high performance at scale. Learn battle-tested patterns that prevent catastrophic failures, slash recovery times, and maintain data integrity even when everything goes wrong.",https://www.linkedin.com/in/vignesh-kuppa-amarnath-596848296/,,,,Vignesh Kuppa Amarnath - Conf42 Site Reliablity Engineering (SRE) 2025.pdf,Vignesh Kuppa Amarnath_sre.png,https://youtu.be/p-S1aIJIW4w,"zero,data,loss",
No,optimization,Puneet Gupta,Principal ASIC Physical Design Engineer,Block,,,,Adaptive Power Optimization: Enhancing Efficiency and Reliability in Battery-Operated Chip Design,"Power inefficiencies can hinder battery-operated chip designs. What if power calculations adapted in real time for precision and reliability? This talk reveals a data-driven approach to optimize power distribution, cut failures, and enhance efficiency—automating smarter, scalable chip design!",,,,,Puneet Gupta - Conf42 Site Reliablity Engineering (SRE) 2025.pdf,Puneet Gupta_sre.png,https://youtu.be/orlZ0ZybIXE,"adaptive,power,optimization",
No,resilience,Sneha Kalagarla,,Cleveland State University,,,,Leveraging Digital Innovation for Environmental Compliance: A Path to Sustainability & Excellence,"Discover how digital platforms are transforming environmental protection! From AI-driven tools to real-time monitoring, this talk unveils strategies that enhance efficiency, cut costs, and drive sustainability. Join us to explore the future of smarter, greener regulatory systems!",,,,,Sneha Kalagarla - Conf42 Site Reliablity Engineering (SRE) 2025.pdf,Sneha Kalagarla_sre.png,https://youtu.be/nvCB5Y1bkZc,"leveraging,digital,innovation",
No,resilience,Sai Sahiti Nemalikanti,Senior Software Engineer,AWS,,,,Designing for Failure using AWS: Resilient System Architectures,"Failures are inevitable-how your AWS architecture handles them defines its success. Learn to design resilient, fault-tolerant systems using AWS best practices, from automated failover to chaos engineering. Discover how services like Auto Scaling and DynamoDB keep your applications running",https://www.linkedin.com/in/sai-sahiti-nemalikanti/,,,,Sai Sahiti Nemalikanti - Conf42 Site Reliablity Engineering (SRE) 2025.pdf,Sai Sahiti Nemalikanti_sre.png,https://youtu.be/kjpqRKTi0dg,"designing,failure,using",
No,resilience,Onyebuchi Mark Irozuru,DevOps Lead,Botanixlabs,,,,Engineering Failure-Resilient Systems: Proactive Strategies for Distributed Network Reliability,"When systems fail, millions lose access, companies lose millions, and engineers lose sleep. Strategies to build self-healing systems that survive failures. Learn practical chaos engineering techniques, recovery automation, and architecture that keep systems running when—not if—components fail.",https://www.linkedin.com/in/onyebuchi-mark-irozuru-b4a483136/,,,,Onyebuchi Mark Irozuru - Conf42 Site Reliablity Engineering (SRE) 2025.pdf,Onyebuchi Mark Irozuru_sre.png,https://youtu.be/y0ZcloLq-4U,"engineering,failure,resilient",
No,resilience,Pradeep Gaddamidi,DevOps Engineer,RADAR,,,,"Deployments, Downtime, and Unexpected Fires: An SRE Survival Story","Unlock real-world SRE lessons from enterprise banking to startups! Learn to tackle deployment challenges, avoid cloud misconfigurations, and cut costs. This talk blends engaging stories with technical insights, offering practical takeaways for engineers managing infrastructure efficiently.",https://www.linkedin.com/in/pradeep-gaddamidi-27009625/,,,,Pradeep Gaddamidi - Conf42 Site Reliablity Engineering (SRE) 2025.pdf,Pradeep Gaddamidi_sre.png,https://youtu.be/VHlNNDyGC7k,"deployments,downtime,unexpected",
No,resilience,Saurabh Phaltane,Senior Site Reliability Engineer,Google,,,,The Curious SRE: Cultivating a Mindset for System Resilience,"This talk explores the foundational mindset for building reliable systems. We'll share practical experiences, examine the balance between breadth and depth in SRE, and emphasize holistic system thinking.",https://www.linkedin.com/in/saurabhphaltane/,,,,Saurabh Phaltane - Conf42 Site Reliablity Engineering (SRE) 2025.pdf,Saurabh Phaltane_sre.png,https://youtu.be/T5Kpdb7iEJs,"curious,sre,cultivating",
No,resilience,Srihari Pakalapati,Principle Cloud & Security Architect,Trader Interactive,,,,Ransomware Readiness: Backup and Recovery in the Cloud,"Don't let ransomware hold your data hostage! 
Learn battle-tested techniques to build an unbreakable defense using immutable backups, automated recovery, and zero-trust architecture. Transform your backup infrastructure from a liability into your strongest security asset.",https://www.linkedin.com/in/sriharipakalapati/,,,,Srihari Pakalapati - Conf42 Site Reliablity Engineering (SRE) 2025.pdf,Srihari Pakalapati_sre.png,https://youtu.be/fVcUzO8ZPvk,"ransomware,readiness,backup",
No,resilience,Sudeep Shanubhog,Technical Lead/Senior full stack developer,Tential Solutions,,,,Revolutionizing Recruitment: Leveraging AI and Microsoft Ecosystem for Enhanced Talent Acquisition,"Unlock the future of recruitment with AI-powered systems integrated into the Microsoft ecosystem! Discover how machine learning, NLP, and automation cut hiring time by 45%, boost candidate quality by 37%, and enhance candidate satisfaction by 41%. Join us to revolutionize your hiring process!",https://www.linkedin.com/in/sudeep-shanubhog/,,,,Sudeep Shanubhog - Conf42 Site Reliablity Engineering (SRE) 2025.pdf,Sudeep Shanubhog_sre.png,https://youtu.be/msle7gi_E8s,"revolutionizing,recruitment,leveraging",
No,resilience,Swapnil Kulkarni,Founding Member - Customer Success and Solutions Architect,Kloudfuse,,,,"To observe or Not, is not the question","Observability, is the top of mind from developers to executives for different contexts ranging from application to business metrics. So Whether to observe or not is not the question but whether I am getting the right use cases solved with the observability.",https://www.linkedin.com/in/meswapnilk/,MeSwapnilK,,,Swapnil Kulkarni - Conf42 Site Reliablity Engineering (SRE) 2025.pdf,Swapnil Kulkarni_sre.png,https://youtu.be/07azTRE4Pos,"observe,or,not",
No,resilience,Uday Bag,Lead Product Consultant-Technical,Cognizant,,,,AI-Driven Claims Adjudication: Revolutionizing Healthcare Efficiency and Fraud Prevention,"Discover how AI, Machine Learning, and NLP are transforming healthcare claims by automating processes, preventing fraud, and boosting efficiency. Explore the latest AI tools and future technologies reshaping healthcare IT and the claims adjudication landscape. Unlock the future now!",https://www.linkedin.com/in/uday-bag-43a75418/,,,,,Uday Bag_sre.png,https://youtu.be/OchXyNEeSCE,"ai,driven,claims",
No,resilience,Vijayakumar Jayaseelan,Senior Manager - Principal Architect,Cognizant,,,,Harnessing Generative AI to Optimize Hybrid Cloud Workloads and Infrastructure Management,"Unlock the future of hybrid cloud with Generative AI! Explore how AI-driven solutions optimize workloads, boost security, and reduce costs by 35%. Discover how enterprises save up to 30%, cut latency by 40%, and transform infrastructure for a more scalable, secure future.",https://www.linkedin.com/in/vijayakumar-jayaseelan-9ab94a15/,,,,Vijayakumar Jayaseelan - Conf42 Site Reliablity Engineering (SRE) 2025.pdf,Vijayakumar Jayaseelan_sre.png,https://youtu.be/ZJ21vlXvfS8,"harnessing,generative,ai",
No,resilience,Viralkumar Ahire,Senior Cloud Platform Developer,Adobe,,,,Cloud-Native Reliability Strategies: Best Practices for Ensuring Uptime and Performance in Cloud-Based Environments,"Downtime is costly, and cloud failures are worse! In this talk, you will discover battle-tested strategies to ensure uptime and resilience in cloud-native environments. Learn how top companies stay online 24/7 with multi-region failover, self-healing automation, and AI-driven reliability.",https://www.linkedin.com/in/viralkumar-ahire-83a81a15/,,,,Viralkumar Ahire - Conf42 Site Reliablity Engineering (SRE) 2025.pdf,Viralkumar Ahire_sre.png,https://youtu.be/wzNfR0eR660,"cloud,native,reliability",
No,resilience,David Asamu,"Tech Lead Manager, SRE Team",Nomba,,,,AI in SRE: Unlocking Prometheus Insights with Natural Language,"While handling an incident, have you ever wished you could simply ask questions about the state of your systems and get immediate, actionable answers? I know I have.

As SREs, we know every second counts during an incident. So, what if we could skip over the complex queries and multiple dashboards to quick insights?  I set out to answer the simple question: “What if you could chat with your monitoring metrics?” In this presentation, I will be sharing what I learnt working building an open source project that allows you to do just that!",https://www.linkedin.com/in/david-asamu/,,,,David Asamu - Conf42 Site Reliablity Engineering (SRE) 2025.pdf,David Asamu_sre.png,https://youtu.be/DuWBp5KbfYM,"ai,sre,prometheus,nl",
No,resilience,Suresh Kumar Gundala,,Karnataka State Open University,,,,Enhancing System Resilience and Efficiency with Microservices: Practical Applications and Real-World Impact,"Unlock microservices to boost system resilience and efficiency! Learn how companies achieve faster development, reduced costs, and scalability. Discover strategies to optimize distributed systems and elevate your SRE practices—transform your business today!",,,,,Suresh Kumar Gundala - Conf42 Site Reliablity Engineering (SRE) 2025.pdf,Suresh Kumar Gundala_sre.png,https://youtu.be/nIf8wXzezNE,"enhancing,system,resilience",
No,resilience,Tejaswi Katta,Lead Software Engineer,Logicgate Technologies Inc,,,,Resilient Cloud-Native Integration: An SRE Approach to Enterprise Digital Transformation,Discover how SRE principles transform cloud-native integration from a reliability risk to a competitive advantage. Learn battle-tested strategies for 99.99% uptime and effective observability across distributed systems. Make your integration platform both resilient and agile.,,,,,Tejaswi Katta - Conf42 Site Reliablity Engineering (SRE) 2025.pdf,Tejaswi Katta_sre.png,https://youtu.be/No2-DKHt45A,"resilient,cloud,native",
No,resilience,Sharath Chandra Adupa,,Osmania University,,,,Harnessing Blockchain for Data Integrity and Security in Modern Enterprises,"Unlock the power of blockchain to revolutionize data security and integrity! Discover how decentralized systems, smart contracts, and advanced cryptography can transform industries like finance, healthcare, and IoT, driving cost reduction, boosting efficiency, and future-proofing enterprise security",,,,,Sharath Chandra Adupa - Conf42 Site Reliablity Engineering (SRE) 2025.pdf,Sharath Chandra Adupa_sre.png,https://youtu.be/0t6yWagOwyA,"harnessing,blockchain,data",
No,resilience,Kumar Nayan,,"University of Illinois, Urbana Champaign",,,,Ensuring Manufacturing Reliability: Strategic SRE Roadmaps for Digital Transformation,"Discover how manufacturing leaders revolutionize reliability through SRE principles. Learn proven strategies that slash downtime, accelerate incident response, and create resilient production systems. Get the roadmap that transformed operations from reactive firefighting to proactive excellence.",,,,,Kumar Nayan - Conf42 Site Reliablity Engineering (SRE) 2025.pdf,Kumar Nayan_sre.png,https://youtu.be/d_pl7xtIzSQ,"ensuring,manufacturing,reliability",
No,resilience,Amlan Ghosh,,Biju Patnaik University of Technology,,,,Resilient by Design: Data-Driven Migration from Monoliths to Event-Driven Microservices,"Discover how to transform monolithic systems into resilient event-driven microservices without sacrificing stability. Learn battle-tested patterns from Fortune 500 case studies that reduce complexity, speed deployments, and enhance recovery times.",,,,,Amlan Ghosh - Conf42 Site Reliablity Engineering (SRE) 2025.pdf,Amlan Ghosh_sre.png,https://youtu.be/3lE2cpiBeDM,"resilient,design,data",
No,resilience,Umegbewe Nwebedu,,Botanix Labs,,,,Reliability Patterns in Permissioned Blockchain Systems,"Unlock the secrets to rock-solid, high-performance permissioned blockchains! Learn how to bolster fault tolerance and secure dependable transactions in Hyperledger Fabric networks. From consensus resilience to disaster recovery, discover hands-on patterns that guarantee reliability at scale.",https://greatone.tech,0xgreat,,,Umegbewe Nwebedu - Conf42 Site Reliablity Engineering (SRE) 2025.pdf,Umegbewe Nwebedu_sre.png,https://youtu.be/e7QDI44ahsE,"reliability,patterns,permissioned",
No,resilience,Vikas Vallakonda,,Discovery Analytics,,,,Leveraging AI and Predictive Analytics for Revenue Optimization in Enterprise Architecture,"Unlock the future of business with AI-driven revenue optimization! From dynamic pricing to predictive demand forecasting, AI boosts efficiency, improves customer experiences, and increases revenue by up to 16%. Learn how to leverage cutting-edge tools for long-term growth and a competitive edge.",https://www.linkedin.com/in/vikas-vallakonda-b17688256/,,,,Vikas Vallakonda - Conf42 Site Reliablity Engineering (SRE) 2025.pdf,Vikas Vallakonda_sre.png,https://youtu.be/oWhWX84dUxU,"leveraging,ai,predictive",
No,security,Sandeep Jarugula,Senior Lead Java Full Stack Developer,U.S. Bank,,,,Enhancing Cybersecurity with Multi-Factor Authentication and Zero-Trust Security Models: A Data-Driven Approach to Modern Defense Strategies,"Unlock the future of cybersecurity with Multi-Factor Authentication and Zero-Trust Security! Discover how these transformative frameworks reduce breaches by 99.9%, save millions, and protect critical data across industries. Learn actionable strategies to build a resilient",https://www.linkedin.com/in/sandeep-jarugula-59922113b/,,,,Sandeep Jarugula - Conf42 Site Reliablity Engineering (SRE) 2025.pdf,Sandeep Jarugula_sre.png,https://youtu.be/8Y8foEPovEU,"enhancing,cybersecurity,multi",
No,security,Santosh Bompally,Cloud Security Engineering Team Lead,Humana,,,,"A Comprehensive Approach to Cloud Security Posture Management: Integrating Infrastructure as Code, AI-Driven Monitoring, and Reactive Security","Unlock the secrets to a resilient cloud security posture! Learn how to leverage Infrastructure as Code, AI-driven monitoring, and reactive security to prevent vulnerabilities and automate compliance. Gain practical insights and actionable strategies to protect your cloud environment",https://www.linkedin.com/in/santosh-bompally-048758b4/,,,,,Santosh Bompally_sre.png,https://youtu.be/EjX9yS2sxgM,"comprehensive,approach,cloud",
No,slos,Mandi Walls,DevOps Advocate,PagerDuty,,,,Tackling Alert Fatigue with SLOs,SLOs allow teams to prioritize the more impactful or important aspects of their services. Metrics that center the user experience gives teams focus and goals. Highlighting the metrics that matter most gives teams space to disable alerts that contribute nothing to over all customer happiness.,https://www.linkedin.com/in/mandiwalls/,lnxchk,,,Mandi Walls - Conf42 Site Reliablity Engineering (SRE) 2025.pdf,Mandi Walls_sre.png,https://youtu.be/zhtMiZUKDQ8,"tackling,alert,fatigue",
No,slos,Gaurav Mittal,Software Development Engineer,Nordstrom,,,,Beyond SLOs: Proactive Failure Prediction Through Anomaly Detection,Learn how to shift from reactive monitoring to proactive prediction. Dive into the world of anomaly detection and find signals hidden in your data before they become outages.,https://www.linkedin.com/in/gauravnmittal/,,,,Gaurav Mittal - Conf42 Site Reliablity Engineering (SRE) 2025.pdf,Gaurav Mittal_sre.png,https://youtu.be/sQgy-bZQOWE,"slos,failute,prediction",
No,transformation,Swapna Anugu,"Cloud Architect, Lead Data Engineer, Data Scientist",Manasi Information Technologies,,,,Reliability at Scale: How AutoML is Transforming Enterprise SRE Practices,"Discover how AutoML transforms SRE by converting system data into predictive reliability insights—no data science expertise needed. Learn how enterprises slash MTTR, eliminate false positives, and prevent outages with practical AutoML strategies you can implement immediately.",https://www.linkedin.com/in/swapna-anugu-r/,,,,Swapna Anugu - Conf42 Site Reliablity Engineering (SRE) 2025.pdf,Swapna Anugu_sre.png,https://youtu.be/LTMRLjQ_q_A,"reliability,scale,how",
No,transformation,Karthikeyan Rajamani,Lead SRE,Thomson Reuters,,,,Site Reliability at the Quantum Frontier: Ensuring Robustness in Hybrid Quantum-Classical Neural Networks,"Experience the quantum edge! Learn how Hybrid Quantum-Classical Neural Networks fuse superposition with proven AI to conquer complex tasks. Unlock unstoppable, scalable performance while bridging science and production reliability—your chance to redefine the future of computing awaits! ​​",https://www.linkedin.com/in/karthikeyan-rajamani/,,,,Karthikeyan Rajamani - Conf42 Site Reliablity Engineering (SRE) 2025.pdf,Karthikeyan Rajamani_sre.png,https://youtu.be/GsR69tPgC20,"site,reliability,quantum",
No,transformation,Balaprabunath Coimbatore Ramalingam,Lead Analyst,Pfizer,,,,From Reactive to Resilient: How Agentic AI is Transforming Enterprise Integration Systems,"Discover how Agentic AI transforms brittle enterprise integrations into self-healing systems. Learn how AI-orchestrated networks detect failures before they cascade, slashing recovery times while maintaining near-perfect uptime. The future of resilient integration is here—and it's autonomous.",https://www.linkedin.com/in/balaprabunath-coimbatore-ramalingam-88986615/,,,,Balaprabunath Coimbatore Ramalingam - Conf42 Site Reliablity Engineering (SRE) 2025.pdf,Balaprabunath Coimbatore Ramalingam_sre.png,https://youtu.be/Nnkh0UuVmWs,"reactive,resilient,how",
No,transformation,Umamaheswarareddy Chintam,Solutions Architect,Calance,,,,Enhancing SRE Practices with AI: Building More Resilient Cloud-Native Platforms,"Discover how AI is revolutionizing SRE practices, delivering 30% better availability and 25% faster incident resolution. Learn actionable strategies for implementing AI-driven observability, predictive maintenance, and automated response that will transform your cloud-native operations today.",https://www.linkedin.com/in/chumamahesh/,,,,,Umamaheswarareddy Chintam_sre.png,https://youtu.be/xdZhD50fCyw,"enhancing,sre,practices",