Content,Video title,Video publish time,Views,Watch time (hours),Subscribers,Impressions,Impressions click-through rate (%)
s0Cs1PkJ-UA,Don't Panic! Effective Incident Response | Quintessence Anx | Conf42 SRE 2021,"Oct 30, 2021",122,6.5272,2,903,1.77
YofLXDGn2KI,Cloud-Native Observability at Scale | Shahar Azulay | Conf42 Kube Native 2022,"Nov 20, 2022",121,3.7175,1,2392,1.76
dZrberU3FEQ,CI/CD with Github Actions | Chris Ayers | Conf42 DevSecOps 2022,"Jan 6, 2023",121,9.825,1,2234,2.33
lbT9aA0aLBo,Observability: one of the strongest muscles for SRE | Jhonnatan Gil Chaves | Conf42 SRE 2023,"Jun 4, 2023",120,12.1434,0,2921,2.05
tSnQoN6J9R0,Dia de los Muertos - Postmortems that save lives | Fabricio Buzeto | Conf42 Chaos Engineering 2021,"Mar 28, 2021",120,3.6867,0,991,2.72
N_q8JZgVIIs,Fighting the Imposter Syndrome | Mihailo Joksimovic | Conf42 Python 2022,"Mar 1, 2022",119,8.4386,0,1286,4.2
PPoQSa_6Dko,How to avoid breaking other people's things | Lisa Karlin Curtis | Conf42 Chaos Engineering 2021,"Mar 28, 2021",119,13.7272,0,2017,2.33
QtNAl56HXdI,Building a Serverless FinTech Startup on Azure | Daniel Bass | Conf42 Cloud Native 2021,"Jun 2, 2021",119,9.0282,4,1142,4.64
cYx5gVYj97Q,Defining Steady States and Developing Hypotheses | Sakshyam Shah | Conf42 Chaos Engineering 2022,"Mar 10, 2022",119,10.0169,1,2362,2.29
 -HbNuEAT6BA,Making Logs Work for you with Fluentd | Phil Wilkins | Conf42 Cloud Native 2021,"Jun 2, 2021",118,9.1621,2,2191,2.6
fMAINcpXlIQ,Azure cloud for the web frontend developers | Maxim Salnikov | Conf42 JavaScript 2021,"Nov 26, 2021",118,7.2725,3,1379,4.64
A5raon-jtTU,Lyra: Disrupting the full-text search industry with JS | Michele Riva | Conf42 JavaScript 2022,"Dec 19, 2022",117,6.9366,1,1610,3.79
csFAVyw14V4,Inside the Cortex | Ganesh Datta & Miko Pawlikowski | Conf42Cast,"Oct 7, 2021",117,8.7397,1,2444,1.47
0Ts7Sa_z69Y,Algorithmically Generated Visual Designs | Michael Wehar | Conf42 JavaScript 2022,"Dec 19, 2022",116,2.9863,0,1282,2.89
H17k5GEBD8U,"Beyond Kubernetes | John Dietz, Jared Edwards & Miko Pawlikowski | Conf42Cast","Aug 17, 2023",116,5.8159,2,2284,1.31
QJb4s6GjvZs,React is Killing your Performance and it's Your Fault | Assaf Krintza | Conf42 JavaScript 2021,"Nov 26, 2021",116,7.9819,0,850,2.82
IgVj74_bNKQ,Measuring Reliability in Production | Ramon Medrano Llamas | Conf42 SRE 2023,"Jun 4, 2023",115,7.8903,0,3201,1.94
QbcrJKjWQGE,Psychology of Chaos Engineering | Matty Stratton | Conf42 Chaos Engineering 2020,"Mar 30, 2020",114,8.0284,2,926,2.92
RFdafFaLvBw,Cloud Native Apache Pulsar Development 101 with Python | Tim Spann | Conf42 Cloud Native 2022,"May 31, 2022",114,7.5233,2,1805,2.99
PVCsOPzpJgY,Observability in Serverless Application | Ozioma Uzoegwu | Conf42 SRE 2021,"Oct 30, 2021",113,9.0333,1,1145,2.79
1ujATkvkdSA,"What on Earth is padaiyal? | Ranjan Mohan, Silvia Siu Luo & Miko Pawlikowski | Conf42Cast","Jul 24, 2021",112,3.935,1,1176,2.3
RyxqYe8TGJU,Using OpenTelemetry in a polyglot environment | Michael Sickles | Conf42 Cloud Native 2021,"Jun 2, 2021",112,8.6006,1,1483,3.17
htiICUhTmH8,Why you’re getting understandability wrong | Liran Haimovitch | Conf42 Enterprise Software 2021,"May 5, 2021",112,4.185,0,1451,1.79
lgUv1CYVT6M,Communication challenges in scaling quantum computers | Sam Samuel | Conf42 Quantum Computing 2022,"Jun 30, 2022",112,12.0628,2,2650,2.19
nXyqxE2UJ1g,Sharing secret keys in Docker containers and K8s | Jose Manuel Ortega | Conf42 Kube Native 2022,"Nov 20, 2022",112,2.8893,0,2224,1.12
svo8rcU-Q5Q,Whose Method Is It Anyway? | Jason C. McDonald | Conf42 Python 2021,"Jun 26, 2021",112,7.7442,2,1460,2.67
u3Hwu8mw_E8,Sustainable Incident Management for happy SRE teams | Ajuna Kyaruzi | Conf42 SRE 2021,"Oct 30, 2021",112,6.5943,0,1154,4.51
ydG6j83DTnU,Micro Frontends - foundations | Tomasz Krajewski | Conf42 JavaScript 2021,"Nov 26, 2021",112,4.8195,0,2311,2.73
DWg5iKLywZA,How Devs can save the future generations | Manuel Carrasco Molina | Conf42 Mobile 2022,"Feb 17, 2022",111,7.3712,1,1885,1.59
NBA8hDkoBfM,5-Technology Trends and Opportunities | Derris Boomer | Conf42 Chaos Engineering 2021,"Mar 28, 2021",111,7.5714,0,1871,2.24
ah0DJT5DYJM,Reading 100+ Kubernetes Post-Mortems - lessons learned | Noaa Barki & Shimon Tolts | Conf42 SRE 2021,"Oct 30, 2021",111,5.5223,0,1132,4.33
n9Q-LONGcec,Observability of Microservices using Open Source Solutions | Shubham Srivastava | Conf42 DevOps 2023,"Feb 28, 2023",111,3.3102,1,1884,2.55
sNOP42Jb6XY,Building the Stonehenge using Gall’s law | Fabricio Buzeto | Conf42 Cloud Native 2021,"Jun 2, 2021",111,5.5898,3,1206,2.99
5WuA0C4UxkI,Top new CNCF projects to look out for | Annie Talvasto | Conf42 SRE 2021,"Oct 30, 2021",110,7.6956,1,1852,2.7
QTETuso5wxA,One Woman Show of Migrating an Entire R&D SCM From Bitbucket to GitLab | Hila Fish | Conf42 SRE 2022,"Jul 12, 2022",110,4.0463,0,1945,2.11
wApKJJVnSIk,Open Source Observability with OpenTelemetry | Nocnica Mellifera | Conf42 DevOps 2023,"Feb 28, 2023",110,6.8699,1,1567,2.94
TDI_TiqBgRc,System State Clustering using eBPF data | Sujith Samuel | Conf42 SRE 2021,"Oct 30, 2021",109,4.3269,0,1458,1.99
aKgOt3rG8lo,Hacking OpenTelemetry | Alberto Gastaldello & Andrea Caretta | Conf42 Observability 2023,"Jul 9, 2023",109,7.3489,0,2784,2.41
3FE1wMMfw2w,Architectural Caching Patterns for Kubernetes | Rafal Leszko | Conf42 Cloud Native 2021,"Jun 2, 2021",108,7.7167,0,1427,4.06
3aoLMVVcE38,The Charm of Incidents | Emily Ruppe & Miko Pawlikowski | Conf42Cast,"Oct 6, 2022",108,10.1107,1,2331,1.33
9UX7oPPqc8E,Serverless Security Top 10 | Tal Melamed | Conf42 Cloud Native 2022,"May 31, 2022",108,9.6711,1,836,3.11
EyHejt7WUTI,Optimize connectivity for multi-region archs | Christian Elsen & Lerna Ekmekcioglu | Conf42 SRE 2022,"Jul 12, 2022",108,3.1017,0,1191,2.35
WnCKQeODTIg,Microsoft DevOps Solutions AZ-400 | Swapneelkumar Deshpande & Miko Pawlikowski | Conf42Cast,"Dec 13, 2022",108,3.6304,0,1971,0.76
86xI0DzmZWk,Building Universal CI/CD Pipelines | Lionel Lonkap Tsamba | Conf42 DevSecOps 2022,"Jan 6, 2023",107,6.1547,0,2337,1.8
NmpjMg62wuw,At the age of AI and ML | Soumen Chatterjee &  Nathalie Rauschmayr | Conf42 Chaos Engineering 2022,"Apr 11, 2022",107,6.2884,0,1850,1.57
xGcQK0VCngI,Enjoy Typesafe Web Development with Eta | Mappuji Abdurrachman | Conf42 Enterprise Software 2021,"May 5, 2021",107,4.6443,0,1999,2.75
MJFy3gucdIs,Uranium - a visual quantum computing platform | Radu Marginean | Conf42 Quantum Computing 2022,"Jun 30, 2022",106,4.3941,1,2062,2.52
OXIgCFaCD2c,Build ML environment for regulatory customers | Suraj Muraleedharan | Conf42 Machine Learning 2021,"Aug 31, 2021",106,5.3487,0,1188,2.36
Sp2FZ5s6Qhc,In Ignotis: Quantum Computing & Astrophysics | Archit Srivastava | Conf42 Quantum Computing 2023,"Jul 31, 2023",106,4.4941,2,1874,1.33
WU2RencI2vI,Event Streaming and Processing with Apache Pulsar | Mary Grygleski | Conf42 Cloud Native 2022,"May 31, 2022",106,5.2531,1,1234,2.19
cQs6JZbSClA,The Role of IoT and 5G Devices in DDoS Attacks | Andrey Slastenov | Conf42 DevSecOps 2023,"Nov 30, 2023",106,5.6048,1,3540,1.47
dICC8Vv5YoM,Building and Leading Remote Teams | Amber Vanderburg | Conf42 SRE 2020,"Aug 9, 2020",106,8.2909,0,1363,2.57
jXR47dubRW8,One Platform Product for All: A Revolution | Hila Israeli | Conf42 Python 2023,"Apr 11, 2023",106,5.3615,1,1293,2.55
nELuSb_MsYY,Migrating to Multi Cluster Managed Kafka - 0 Downtime | Natan Silnitsky | Conf42 Cloud Native 2022,"May 31, 2022",106,5.802,0,948,4.22
nn-4BzMd0Eg,Put down JS - how building fundamentals will help you LvlUp! | Colby Fayock | Conf42 JavaScript 2020,"Oct 21, 2020",106,6.6813,3,2366,1.44
p4PyzDzppiY,Make Your Electron App Feel at Home Everywhere | Kilian Valkhof | Conf42 JavaScript 2021,"Nov 26, 2021",106,7.8266,1,1901,3
ueeS2C9d93k,Create distributed database on K8s leveraging a monolithic one | Trista Pan | Conf42 Golang 2023,"May 21, 2023",106,3.9891,0,3445,1.6
FDHQJrtShM4,We can’t all be Shaq: it’s time for SRE hero to pass the ball | Malcolm Preston | Conf42 SRE 2022,"Jun 9, 2022",105,7.6921,0,1910,1.73
K_YGDX5VhUo,Python Memory Understanding | Nisarg Shah | Conf42 Python 2021,"Jun 26, 2021",105,3.3211,2,1534,3.46
Ytvb-vili9I,Building Kubernetes apps? Remove YAML & write Go instead! | Abhishek Gupta | Conf42 Kube Native 2022,"Nov 20, 2022",105,4.584,0,2916,1.47
jJjdKJHqKkI,"Your Lambdas, In Rust! | Luciano Mammino | Conf42 Cloud Native 2023","Apr 30, 2023",105,10.2697,1,2676,1.72
lpkjrdSqgSQ,Kubernetes audit log best practices | Kenneth DuMez | Conf42 Cloud Native 2023,"Mar 30, 2023",105,6.4608,1,2446,1.96
WGAogib0NZw,Getting out of the Starting Blocks | Adrian Hornsby | Conf42 Chaos Engineering 2020,"Apr 4, 2020",104,7.1552,1,1605,2.68
enIPf6_MFn4,Effective Java with Groovy & Kotlin | Naresha K | Conf42 Enterprise Software 2021,"May 5, 2021",104,5.353,0,2232,2.46
mFxVAI-NOew,Say Goodbye to Manual Kubernetes User Access Onboarding | Kenneth DuMez | Conf42 DevSecOps 2022,"Dec 1, 2022",104,6.4319,2,2337,1.33
soHRQVeZTDI,Build 0-cost invite-only website with Next.js & Airtable! | Luciano Mammino | Conf42 JavaScript 2022,"Dec 19, 2022",104,5.652,1,1291,3.64
yAIb6GM3b5k,Demystifying Garbage Collection in Java | Igor Braga  | Conf42 Enterprise Software 2021,"May 5, 2021",104,5.1231,1,2261,2.03
6-MOtJPpves,Embracing the Fear of Failure | Humaira Ahmed | Conf42 Chaos Engineering 2021,"Mar 28, 2021",103,4.6587,0,1800,3.33
AnX7sC01ut4,Introduction to Ansible for Network Engineers | Jason Belk | Conf42 Cloud Native 2022,"May 31, 2022",103,4.3677,3,1002,2.89
BZ7rZa9feKA,Premiere - Conf42 Internet of Things (IoT) 2023,"Dec 14, 2023",103,3.3642,6,1757,1.48
FsUQor3PbKI,Building Platform using ChatOps & Github Bots | Spiros Economakis | Conf42 Platform Engineering 2023,"Oct 12, 2023",103,3.0278,-1,1652,2.66
IhV04iRGbks,The Art of Event Driven Observability with OpenTelemetry | Henrik Rexed | Conf42 Observability 2023,"Jul 9, 2023",103,8.024,3,1938,2.79
YX6xFsRLfo8,Why Put Sec in DevOps – and How | Greta Jocyte | Conf42 DevOps 2023,"Feb 28, 2023",103,5.7546,0,2272,2.16
2Wr3n7lnre8,SBB - Secure Building Blocks | Yashwanth Singh M | Conf42 Rustlang 2023,"Sep 24, 2023",102,5.6427,1,2550,1.41
EGxcQB92Zo0,Exploring ChatGPT for Improved Observability | Gareth Emslie | Conf42 Observability 2023,"Jul 9, 2023",102,7.8087,1,3028,1.59
G6zlcandHM8,Quantum Computing: Implications for Security | Robert Slade | Conf42 Quantum Computing 2022,"Jun 30, 2022",102,11.4536,1,2895,2.28
GMMlSgerzwA,Developer Observability - the Forth Pillar | Shai Almog | Conf42 Observability 2023,"Jul 9, 2023",102,7.2281,1,4126,1.43
UfGy6jgjaTI,Building a K8s Operator for a Distributed Database | Natalie Pistunovich | Conf42 Cloud Native 2021,"Jun 2, 2021",102,3.0823,1,1217,3.37
cBcmk1sn0vw,Building Automated Quality Gates into your CI pipelines | Craig Risi | Conf42 SRE 2023,"Jun 4, 2023",102,14.689,1,1981,2.47
huKvsVp9xIs,Rust for Java Programmers - a Personal Perspective | Ovidiu Ionescu | Conf42 Rustlang 2023,"Sep 24, 2023",102,9.2008,3,3219,1.77
k0zWsIYQUAA,Implementing a performant URL parser from scratch | Yagiz Nizipli | Conf42 JavaScript 2022,"Dec 19, 2022",102,2.3683,0,1124,3.2
04dSp07n8iM,Scalable and sustainable Cybersecurity | Gordon Rudd | Conf42 Python 2021,"Jun 26, 2021",101,9.7682,1,2268,2.78
f4qxdG79QrI,Scaling Multi-cluster Kubernetes at Teleport Cloud | Stephen Levine | Conf42 Kube Native 2023,"Sep 28, 2023",101,4.5574,0,2338,1.28
fBI8nWRuPkg,Locking Down the Security of IAM | Josh Stella | Conf42 Cloud Native 2021,"Jun 2, 2021",101,9.6377,2,1405,2.21
q4sLggLcytc,Protecting Sensitive Data and Machine Learning Models | Justin Patriquin | Conf42 Python 2023,"Mar 9, 2023",101,5.9719,3,2873,1.6
CI2224SyEZ4,Pragmatic State Management | Joshua Arvin Lat | Conf42 JavaScript 2021,"Nov 26, 2021",100,5.204,4,1146,2.09
Hb8rRfi7_b0,Sleeping with one eye open: production support | Quintin Balsdon | Conf42 Chaos Engineering 2021,"Mar 28, 2021",100,14.747,1,3338,1.14
MUOrumcZvKo,Convolutional Neural Networks in Action | Milecia McGregor | Conf42 Machine Learning 2021,"Aug 31, 2021",100,3.8697,3,1560,2.24
XIU9Y-expKg,Not All ML Heroes Wear Capes | Joshua Arvin Lat & Miko Pawlikowski | Conf42Cast,"Nov 18, 2021",100,4.1745,2,1510,1.13
hbfBvjzPyus,Getting back to sleep asap for the on-call developer | Tom Granot | Conf42 Enterprise Software 2021,"May 5, 2021",100,5.296,0,1740,2.3
GohmewqmwqM,Incident Ready: Chaos Engineer Your Incident Response | Robert Ross | Conf42 Chaos Engineering 2021,"Mar 28, 2021",99,6.0435,1,1541,2.27
TbVJD1qUtQk,"Save, Grow and Innovate using AWS Databases | Akanksha Sheoran | Conf42 Cloud Native 2021","Jun 2, 2021",99,4.8173,0,829,2.17
A-GwPQJ2wyQ,The Remix Philosophy is not Just for Remix | Ken Snyder | Conf42 JavaScript 2023,"Dec 10, 2023",98,9.2693,1,899,2.56
efsa0DsZKLM,Pushing Code: Don't Forget to Flag Your Canaries? | Hammad Mushtaq | Conf42 Cloud Native 2022,"Apr 28, 2022",97,7.1301,2,1959,1.84
jb5iInhGO6o,Level Up Your Technical Career by Writing | Lauren Schaefer | Conf42 Python 2023,"Apr 11, 2023",97,5.843,0,1771,1.98
MjGRhsBfrUo,One year of SRE Failures | Bart Enkelaar | Conf42 Chaos Engineering 2021,"Mar 28, 2021",96,8.827,0,1577,2.85
mjaHYXwubY4,Using Reproducible Experiments To Create Better ML Models | Milecia McGregor | Conf42 Python 2022,"Mar 1, 2022",95,4.9039,1,1820,1.59
uXieRNrVqdg,Handling floating point challenges with rust | Prabhat | Conf42 Rustlang 2023,"Sep 24, 2023",95,3.3037,2,2268,2.34
yuoTwL117aY,How to Empower Developers to Troubleshoot K8s Independently | Itiel Shwartz | Conf42 SRE 2021,"Sep 30, 2021",95,7.0951,0,1896,1.53
0yAZIVLLrcA,SOS: Sustainable Open Source | Floor Drees | Conf42 DevSecOps 2022,"Jan 6, 2023",94,2.7266,1,1597,1
FGfsf2pyF5Y,Kubernetes Security Jumpstart | Mofi Rachman | Conf42 Cloud Native 2021,"Jun 2, 2021",94,4.35,0,1280,1.25
it0Zo5QhlQk,Back to the CompletableFuture: Concurrency | Dmitry Vinnik | Conf42 Enterprise Software 2021,"May 5, 2021",94,5.3307,1,1761,2.73
sWby8vdc7gk,Varieties of Incident Response | Kurt Andersen | Conf42 Incident Management 2022,"Oct 24, 2022",94,2.7564,0,1207,1.82
Showing top 500 results
