Content,Video title,Video publish time,Views,Watch time (hours),Subscribers,Impressions,Impressions click-through rate (%)
Total,,,261952,16020.6663,3913,3198592,2.97
syf6ZSiRSbw,Intro to FastAPI | Sebastian Ramirez | Conf42 Open Source Showcase 2020,"Jul 6, 2020",15916,1311.7938,210,200182,4.66
tlQsviAbBxk,Building Python Flask API in google colab | Shweta Mishra | Conf42 Python 2022,"Mar 1, 2022",6254,236.5863,27,21191,6.63
4kdU9_a-gII,WebRTC: The secret power you didn't know Go has | Sean DuBois | Conf42 Golang 2021,"Aug 3, 2021",5919,448.4672,63,43233,4.97
JrCMCdvoMAw,chezmoi - Dotfiles Manager across multiple machines | Tom Payne | Conf42 Open Source Showcase 2020,"Jul 6, 2020",4671,303.0548,19,22846,6.64
PHhOTEYDvHQ,Idiomatic Pandas | Matt Harrison | Conf42 Python 2021,"Jun 26, 2021",4290,321.6373,84,21659,4.57
55TzYYKhEjM,Vue.js form validation with vee-validate v4 | Abdelrahman Awad | Conf42 JavaScript 2021,"Nov 26, 2021",4157,170.567,20,17083,5.99
KaIbgrYIPQk,DevOps automation with Go | Oliver Fuerst | Conf42 Golang 2021,"Aug 3, 2021",4013,135.1743,33,25588,8.95
yqHxcm0soTU,Distributed tracing for Node.js using OpenTelemetry | Michael Haberman | Conf42 JavaScript 2021,"Nov 26, 2021",3553,275.9899,17,28388,6.65
Vz9rkr_p3Ts,Data-Oriented programming | Yehonathan Sharvit  | Conf42 Enterprise Software 2021,"May 5, 2021",3352,237.3643,14,20974,7.62
miMm7qGMqLw,Generate pages on demand: ISG With Layer0 and Nuxt.js | Rishi Raj Jain | Conf42 JavaScript 2021,"Nov 26, 2021",3134,31.7074,2,1942,4.33
1aKjHVjQEfc,The Transformation of DevOps and InfoSec in AIoT | Susie Su | Conf42 DevSecOps 2023,"Dec 31, 2023",2945,24.8826,1,6136,1.08
Lx2hd_lbhxY,Deploy N applications to N clusters using Argo CD ApplicationSet | Dewan Ahmed | Conf42 SRE 2021,"Oct 30, 2021",2790,207.5533,14,7879,4.78
eXg9m2TM0dE,"Real-time analytics dashboard with Streamlit, Pinot & Kafka | Mark Needham | Conf42 Python 2022","Mar 1, 2022",2589,138.2536,19,17762,5.24
dOE_UEwzgMw,Ent: Making Data Easy in Go | Dmitry Vinnyk | Conf42 Golang 2021,"Aug 3, 2021",2517,117.8392,11,14925,10.63
jKKJ_yXhXVg,Go - Best practices | Ranjan Mohan | Conf42 Golang 2022,"May 3, 2022",2381,170.8944,16,12982,11.7
XBkBpFYAHiw,Gopher in an Event-Driven playground | Tamimi | Conf42 Golang 2022,"Mar 31, 2022",2348,166.3736,35,15161,4.76
Y8EbPFNdwxU,Building applications in the Cloud using Go and the AWS CDK | Vincent Lesierse | Conf42 Golang 2021,"Aug 3, 2021",2246,169.6044,19,14949,7.08
aRsea6FFAyA,Transaction Management and Repository Pattern | Ilia Sergunin | Conf42 Golang 2023,"May 21, 2023",2230,162.1661,16,9530,5.97
6KXGJKx4WcM,BDD with JUnit 5 and Cucumber | Catalin Tudose  | Conf42 Enterprise Software 2021,"May 23, 2021",2164,135.5237,10,9302,9.88
ng8i5KPf6d0,ML time series forecasting methods | Pawel Skrzypek & Anna Warno | Conf42 Machine Learning 2021,"Aug 31, 2021",2161,130.2499,19,20287,5.97
5EJNx1ON1tI,Conf42 OBS Recording Tutorial,,2110,170.4791,7,28,0
pKMhlmddYXY,Mastering Efficient Code Reviews: A Path to Superior Codebase | Israel Heringer | Conf42 DevOps 2024,"Jan 25, 2024",1977,16.6665,3,2447,0.65
IDIzO55Mz5g,"Flux or ArgoCD, which one to choose ? | Ismael Hommani & Clement Loiselet | Conf42 DevOps 2023","Feb 28, 2023",1835,219.6704,29,17687,6.59
zZdlXYGQNew,Delving Deep into the Intersection of AI and IoT | Susie Su | Conf42 Internet of Things 2023,"Dec 14, 2023",1769,14.2502,0,3173,1.04
BBQPeLYpdLY,Polars: A highly optimized dataframe library | Matt Harrison | Conf42 Machine Learning 2023,"Jun 29, 2023",1733,120.5453,32,19681,5.8
KJV6vspieSM,DDD and FSM: tackling complexity with state machines | Ilya Kaznacheev | Conf42 Golang 2021,"Aug 3, 2021",1721,95.1657,10,8518,5.76
MF7UItjxDWA,Getting Reactive with Relational Databases & R2DBC | Rob Hedgpeth | Conf42 Enterprise Software 2021,"May 5, 2021",1702,188.4424,13,11478,7.21
Z9mRyM6eihI,Creating Immersive Generative Art With Go | Preslav Rachev | Conf42 Golang 2021,"Aug 3, 2021",1673,97.2988,14,10282,4.77
tYNaXn2wJJo,MongoDB Schema Design - best practices | Joe Karlsson | Conf42 JavaScript 2020,"Oct 21, 2020",1626,176.9479,22,18284,4.16
V6v6nnD1qZE,Embracing Hexagonal Architecture with Serverless | Luca Mezzalira | Conf42 JavaScript 2021,"Nov 26, 2021",1466,108.7694,14,4184,7.36
t6r3SgK-bDQ,Deploying a simple Python app to Kubernetes/OpenShift | JJ Asghar | Conf42 Python 2022,"Mar 1, 2022",1300,108.8342,8,8611,6
 -Xgv4ZVWORg,Build a prod-ready distributed task queue system with celery | Vishrut Kohli | Conf42 Python 2021,"Jun 26, 2021",1297,86.6882,18,9365,5.96
I_UaaqJrxT8,Enhancing a Distributed SQL Database Engine | Alexey Ozeritskiy | Conf42 DevOps 2024,"Jan 25, 2024",1256,19.419,8,2475,2.02
ycKBGzOHBgQ,Successful Go for microservices architecture | Herve Ah-Leung | Conf42 Golang 2022,"May 3, 2022",1212,78.635,14,9862,6.63
JNUSiwW-cSo,Premiere - Conf42 Golang 2022,"Mar 31, 2022",1198,36.7224,23,5397,3.11
mdPIvdgFxMU,Build your own Dependency Injection framework! | Mark Hendriks | Conf42 Enterprise Software 2021,"May 5, 2021",1164,90.9472,11,5205,9.13
NEp8QZKi19s,Premiere - Conf42 Golang 2023,"Apr 20, 2023",1152,28.2241,43,19436,1.07
IpggeW9dO3A,Financial Network Analysis using Python | Kalyan Prasad | Conf42 Python 2022,"Mar 1, 2022",1136,59.9505,10,3529,6.32
hl98ShsDQ4k,Go Big with Apache Kafka | Lorna Mitchell | Conf42 Golang 2021,"Aug 3, 2021",1130,104.2574,13,18066,3.78
rqd7OPIa_Zg,Premiere - Conf42 Rustlang 2022,"Sep 1, 2022",1043,24.1706,27,7647,2.8
6rv-utOAnto,Image Super-Resolution in JS | Kevin Scott | Conf42 JavaScript 2020,"Oct 21, 2020",1033,49.9726,8,5590,5.67
H99jI1nwe0g,Chaos Monkey for Spring Boot | John Fletcher & Manuel Wessner | Conf42 Chaos Engineering 2020,"Apr 6, 2020",1019,103.7157,8,11674,3.82
VHCvISpjaGw,Premiere - Conf42 Chaos Engineering 2021,"Feb 25, 2021",1011,37.3341,19,5016,2.53
OILWd9inkf0,AWS CDK - Best Practices From The Trenches | Ran Isenberg | Conf42 Cloud Native 2023,"Apr 30, 2023",916,94.7323,22,5070,5.82
F7wT1QYbhS4,Conf42 speaker intro example - Julie Gunderson,,895,6.153,2,4,25
K_m19O-dUJA,Conf42: Explained,"Mar 6, 2021",825,5.8289,5,3083,3.15
ADvD-DfSTSU,The Definitive Deep Dive into the .git Folder | Rob Richardson | Conf42 Python 2021,"Jun 26, 2021",824,85.0792,4,2700,2.63
kN1uhKzGsyY,gRPC in Python. Build fast scalable APIs for your services | Aditya Mattos | Conf42 Python 2023,"Apr 11, 2023",773,47.6749,5,5892,6.69
1Jbmtdjxhjs,"KinD, nGinx Ingress Controller & Secured gRPC server | Mahendra Bagul | Conf42 Golang 2021","Aug 3, 2021",751,55.5548,9,6508,4.79
JtLrlDNdJzg,Post Mortem Culture: Learning from Failure | Yury Niño Roa | Conf42 Chaos Engineering 2020,"Mar 27, 2020",742,23.1048,6,12089,1.3
RRwxStQpox0,Build your first Cyber Forensic Application | Gajendra Deshpande | Conf42 Python 2021,"Jun 26, 2021",741,27.3189,11,5878,7.13
PAiK53ucusk,Go development on local k8s with Skaffold | Matan Cohen | Conf42 Golang 2021,"Aug 3, 2021",719,43.2091,8,4865,5.76
wGkaYfcHDfs,Reinventing Speech-to-Text Transcriptions with Go and Whisper | Pratim Bhosale | Conf42 Golang 2023,"May 21, 2023",699,21.388,4,5033,6.18
A90IyuRkrPs,Terminal Emulator Basics in Golang | Ishuah Kariuki | Conf42 Golang 2021,"Aug 3, 2021",698,51.7862,6,5957,4.48
dTP4J0GcXxg,Automate your ML workflows with pipelines | Antje Barth | Conf42 Machine Learning 2021,"Jul 29, 2021",688,30.6122,7,3891,5.99
96AIQuiffbI,Using our Graphics Library to show them analytics! | Renaldi Gondosubroto | Conf42 JavaScript 2020,"Oct 21, 2020",683,84.2636,2,4466,3.16
JHc2An3a0Ws,DevSecOps for AI: Introducing MLSecOps for Software 2.0 | Eugene Neelou | Conf42 DevSecOps 2022,"Jan 6, 2023",681,47.0476,11,9561,1.33
Ag0Yn7CzYSY,Fault isolation using shuffle sharding | Andrew Robinson | Conf42 SRE 2021,"Oct 30, 2021",659,54.4147,8,2400,8.58
xDrvwMK9BmQ,"Memory Management in Go: The good, the bad and the ugly | Liam Conroy Hampton | Conf42 Golang 2023","May 21, 2023",658,56.8919,3,3623,7.56
kwAwfkh4vOA,Peernet - an open p2p network standard / implementation | Akilan Selvacoumar | Conf42 Golang 2022,"May 3, 2022",647,28.8227,2,5343,4.81
6m6FUsi4kGc,My Blog is Hilariously Overengineered | Xe Iaso | Conf42 Rustlang 2022,"Sep 30, 2022",639,46.133,3,2499,6.4
51tTd1vl5CM,Design System For Micro-Frontends | Azizi Yazit | Conf42 JavaScript 2021,"Nov 26, 2021",636,29.9329,4,2665,7.35
8AiylKjLVmY,Premiere - Conf42 Golang 2021,"Jun 24, 2021",635,20.361,24,3972,2.82
I2tVnH_JuHI,Ultimate Guide to Golang Development for Beginners | Huseyin Babal | Conf42 Golang 2021,"Aug 3, 2021",626,26.8606,18,4816,5.56
xfDDpCNt3LQ,Kubernetes won't save you | Lian Li | Conf42 Cloud Native 2021,"Jun 2, 2021",623,54.5612,8,2006,5.48
SJGfZ3RU_3Y,Swiss Army Knife for SaaS Products Build with Go | Huseyin Babal | Conf42 Golang 2023,"May 21, 2023",611,28.1472,15,5807,3.36
KcEDAMHvpis,Benchmarking JVM Warm-Up Performance | Frank Kriegl | Conf42 Enterprise Software 2021,"May 5, 2021",609,43.7936,3,5070,5.35
yKJ_h0K6liM,Load testing with F1 | Adelina Simion & Andy Kuszyk | Conf42 Golang 2022,"Mar 31, 2022",599,55.5402,8,7137,3.28
ovLKssNavS4,Deploying ML solutions with low latency in Python | Aditya Lohia | Conf42 Machine Learning 2021,"Aug 31, 2021",595,10.9835,3,3380,13.31
vTzV1OdbUCk,Premiere - Conf42 DevOps 2023,"Jan 26, 2023",591,28.1605,24,9401,1.1
vrojmYRHxwY,Reproducible Builds with Bazel | Gaspare Vitta | Conf42 Python 2021,"Jun 26, 2021",586,29.5257,6,4092,4.55
jQOxsvdyx04,Every CISO’s First 90 Days on the Job | Gordon Rudd | Conf42 Golang 2021,"Aug 3, 2021",582,132.229,12,4772,7.17
inPkJkPBfas,Go with Workflows | Walter Demian Schroeder | Conf42 Golang 2022,"Mar 31, 2022",578,24.2797,5,6123,4.39
TEZOZQUcplM,Scalable event-driven applications with NestJS | Dmitry Khorev | Conf42 JavaScript 2022,"Dec 19, 2022",576,26.1263,6,4022,3.7
LCXyBzHEqFM,Event-driven applications: Apache Kafka and Python | Francesco Tisiot | Conf42 Python 2021,"Jun 26, 2021",573,46.3764,8,4145,4.49
peSUrYj8bhs,What I learned creating a CLI with Go | Lais Lima | Conf42 Golang 2023,"May 21, 2023",557,21.7657,6,4462,6.72
7k6gYZa6BVg,How to be WRONG | Russ Miles | Conf42 Chaos Engineering 2020,"Apr 1, 2020",525,45.4083,5,2723,2.64
1s-hXnjHEHI,Object Detection using Transformers and CNNs | Eduardo Dixo | Conf42 Machine Learning 2021,"Aug 31, 2021",521,20.0615,4,5840,4.67
KblJ1XbXtDs,Premiere - Conf42 Cloud Native 2021,"Apr 29, 2021",516,22.3456,13,3109,2.22
MgaXliEYVCU,Learn Rust By Building CLI Tools | Jim Lynch | Conf42 Rustlang 2023,"Sep 24, 2023",514,26.539,9,7199,4.47
booybxZW_Yk,Premiere - Conf42 Site Reliability Engineering 2021,"Sep 30, 2021",510,38.1206,18,3919,2.53
_V_Nd85Ihsg,Build your own search application with Weaviate | Laura Ham | Conf42 Machine Learning 2022,"Jun 21, 2022",498,37.6504,6,4001,4.8
xNhWZkBslUQ,Chaos engineering for serverless | Gunnar Grosch | Conf42 Chaos Engineering 2022,"Mar 10, 2022",487,47.3877,2,2548,2.51
h4yC0MGWrHQ,A gentle introduction to Vector Databases | Zain Hasan | Conf42 Machine Learning 2023,"Jun 20, 2023",478,53.7846,7,3717,2.34
KqVoKeOPATQ,Architecting for Resilience: Strats for Fault-Tolerant Systems | Maria Rogova | Conf42 DevOps 2024,"Jan 25, 2024",476,4.4026,1,1568,1.15
WLz5QLb1Od8,Premiere - Conf42 Site Reliability Engineering (SRE) 2023,"May 4, 2023",476,16.6211,14,4927,2.37
2Spu3SQSMjQ,Premiere - Conf42 JavaScript 2022,"Nov 17, 2022",475,14.3553,9,3311,2.3
5Q5_vuHdOkI,Chaos Experiments under the lens of AIOps | Michele Dodic | Conf42 Chaos Engineering 2022,"Apr 11, 2022",468,21.8279,1,1157,3.46
1NPgN91FrPU,Premiere - Conf42 Python 2023,"Mar 9, 2023",462,12.1799,8,2941,1.63
l3gvFLi-4FA,Multi Region Terraform Deployments | Lerna Ekmekcioglu & Jack Iu | Conf42 Chaos Engineering 2022,"Apr 11, 2022",455,26.1787,2,2484,5.72
HpdBZhmVuqQ,Moving from the Openstack Magnum to the Cluster API | Andrei Novoselov | Conf42 Cloud Native 2023,"Mar 30, 2023",454,36.5448,10,3172,3.78
JXA6XC9WB6w,Premiere - Conf42 Quantum Computing 2023,"Jun 29, 2023",454,10.4624,10,5252,2.08
fab-dLCsNOQ,Enterprise SRE adoption framework | Vishnu Vardhan Chikoti | Conf42 SRE 2021,"Oct 30, 2021",444,26.0063,4,1670,5.45
vBDkhEA-Lfs,Building CLI apps using Go | Abhisek Pattnaik | Conf42 Golang 2023,"May 21, 2023",443,23.2219,3,4973,4.36
mL9ocOBg2y4,Form Validations with VEST | Alush Evyatar | Conf42 JavaScript 2020,"Oct 21, 2020",437,30.1012,2,2601,5.04
Ve1KaLVhwIM,Premiere - Conf42 Python 2022,"Jan 27, 2022",436,17.8071,11,5301,1.23
9TN138O3PbQ,Premiere - Conf42 Chaos Engineering 2023,"Feb 16, 2023",434,12.3028,13,3232,1.95
Lxtr9h0Xkqc,Shifting left chaos testing | Pablo Chacin | Conf42 Chaos Engineering 2023,"Feb 16, 2023",427,21.4446,4,8742,1.1
0C12lOefMH8,Premiere - Conf42 JavaScript 2021,"Oct 28, 2021",418,14.2328,11,2836,1.94
VKl51fi2gm0,Let's talk about Kubernetes Cluster Monitoring | Twinkll Sisodia | Conf42 Kube Native 2022,"Nov 20, 2022",418,6.7007,2,18327,0.71
HARyWxc6TZg,Building Blockchains on the Go | Luis Cardoza Bird | Conf42 Golang 2021,"Aug 3, 2021",416,23.6276,9,5352,4.82
dO6hM1PsyZk,Go Serverless! | Savas Ziplies | Conf42 Golang 2022,"May 3, 2022",414,31.1135,1,4705,4.97
9dPQ0DDGVO4,Maps with Django | Paolo Melchiorre | Conf42 Python 2021,"Jun 26, 2021",413,15.7553,5,4013,5.53
pvwvRi6iMds,Shopyo: Your Mega Flask Machine | Abdur Rahmaan Janhangeer | Conf42 Python 2021,"Jun 26, 2021",412,12.2506,1,2048,1.9
FclEiSDfX14,Premiere - Conf42 Site Reliability Engineering 2022,"Jun 9, 2022",405,24.1424,12,3262,2.36
slyuCb4HgH4,A Developer’s Introduction to Service Mesh | Rosemary Wang | Conf42 Cloud Native 2022,"May 31, 2022",404,32.8867,2,4522,2.68
JsiwcZkH75c,Beginning your own data engineering projects | Hui Xiang Chua | Conf42 Python 2021,"Jun 26, 2021",403,15.293,7,4019,4.53
nApPLgPfPYM,Shipping Quality Software in Hostile Environments | Luka Kladaric | Conf42 Chaos Engineering 2020,"Mar 28, 2020",393,38.0213,3,2807,3.71
ch6Nqy9N7dA,Premiere - Conf42 JavaScript 2023,"Nov 16, 2023",389,10.406,8,39591,0.32
FazRUwBWPUI,Debugging a container with a sidecar using Gefyra | Michael Schilonka | Conf42 Cloud Native 2022,"May 31, 2022",388,35.3037,2,2152,5.02
AyRhi92v9O0,Doing GitOps for multi-cloud using Crossplane & Flux2 | Leonardo Murillo | Conf42 Cloud Native 2021,"Jun 2, 2021",387,45.3183,4,2778,3.28
g_gHnBcdov8,Platform Engineering: Why and How to start | Serg Hospodarets | Conf42 DevOps 2023,"Feb 28, 2023",387,26.8323,5,2429,3.42
eOe3sxE_AkI,LanceDB: A OSS serverless Vector Database in Rust | Lei Xu | Conf42 Rustlang 2023,"Sep 24, 2023",385,19.8194,3,5808,3.84
4mNHGg2yNyI,Delivering successful API integrations | Jose Haro Peralta | Conf42 Python 2021,"Jun 26, 2021",380,13.0875,0,2170,4.84
mdwAMxxKKRA,Reliability in the Face of Uncertainty | Benjamin Wilms | Conf42 Chaos Engineering 2023,"Feb 16, 2023",377,12.5053,2,54546,0.18
SBifB5-9naA,Concurrency for beginners | Jayaganesh Kalyanasundaram | Conf42 Golang 2021,"Aug 3, 2021",376,10.6625,3,3819,3.8
DWBIDrAi4zo,Debugging JVM performance issues |  Ranjan Mohan & Silvia Siu Luo | Conf42 Enterprise Software 2021,"May 5, 2021",375,26.0988,4,3242,5.86
TMgpgW2_Ht0,Just-in-time Nodes for Any AWS EKS Cluster: Karpenter | Samuel Baruffi | Conf42 Cloud Native 2023,"Apr 30, 2023",375,63.8331,10,6631,3.2
UBqouRXnslA,Self Healing Systems | Nick Hodges | Conf42 Chaos Engineering 2022,"Mar 10, 2022",372,32.2296,6,3511,4.59
PBbgCGep6NU,Premiere - Conf42 Python 2021,"May 27, 2021",370,15.3277,11,3915,1.63
Ja41H7RWY7I,Premiere - Conf42 Rustlang 2023,"Aug 24, 2023",368,10.2327,19,3846,2.26
UlmCJl8ZsT4,Machine Learning in Production - MLOps | Ryan Dawson | Conf42 SRE 2020,"Aug 9, 2020",366,17.3309,7,16728,0.75
UvnBJr4-xX4,Quantum-Resistant Native Go Programs: Taking the Leap | Mathilde Raynal | Conf42 Golang 2021,"Aug 3, 2021",365,15.9962,3,2795,3.51
F72qEyetHWE,Premiere - Conf42 DevOps 2024,"Jan 25, 2024",364,24.6569,11,3478,2.04
GRX3OAWtLfo,Pushing Rust to the limit in a Blockchain Environment | Andrei Marinica | Conf42 Rustlang 2022,"Sep 30, 2022",363,31.6877,3,15424,0.67
Ta5Lq2kbiQQ,Natural language modelling- BlazingText algorithm | Dinesh Subramani | Conf42 Machine Learning 2021,"Aug 31, 2021",362,35.2892,1,3747,4.99
qSd7hhao3vk,Build Cloud Infrastructure using Python | Sohan Maheshwar | Conf42 Python 2021,"Jun 26, 2021",357,22.7867,4,2877,5.35
WLu6NKYqFQs,Learn BabylonJS to Create 3D Metaverse Environments | Griffin Solot-Kehl | Conf42 JavaScript 2022,"Dec 19, 2022",356,20.9049,7,3212,4.89
2Py4tQWBrkg,Get maximum benefit from zero-cost abstractions | Tim McNamara | Conf42 Rustlang 2022,"Sep 30, 2022",355,29.5964,2,3540,2.34
LMa3gQR1jFU,Truth about running Cloud Security Assessments in 2021 | Ashish Rajan | Conf42 Cloud Native 2021,"Jun 2, 2021",355,23.4618,18,2286,3.54
c8Tjbmq66UU,Techniques for SLOs and Error Budgets at Scale | Fred Moyer | Conf42 Observability 2023,"Jul 9, 2023",355,24.0321,3,3753,0.85
Xi6bZ4tl-Qk,AI-driven DevOps CI/CD pipelines | Michele Dodic & Francesco Sbaraglia | Conf42 DevOps 2023,"Feb 28, 2023",353,23.1134,2,1412,5.38
GK91Q5vLHjc,Andela: Bringing the future of work to life | Agnes Muthoni | Conf42 Golang 2022,"Mar 31, 2022",352,11.5968,5,5249,3.18
ATqDrIkA8fA,Building Super Powered HTML Forms with JavaScript | Austin Gil | Conf42 JavaScript 2021,"Nov 26, 2021",350,24.8162,6,1779,1.91
MRm1lJOShhg,Unikernels and NanoVMs | Ian Eyberg & Miko Pawlikowski | Conf42Cast,"Nov 1, 2022",347,52.27,5,4554,1.49
xGYPbrbHBls,"Terraform Practices - The Good, the Bad and the Ugly | Hila Fish | Conf42 Cloud Native 2022","May 31, 2022",347,24.0116,2,1524,4.99
N3NAlHlLv5I,Cryptpad - the Encrypted Collaboration Suite | Ludovic Dubost | Conf42 Open Source Showcase 2020,"Jul 6, 2020",341,24.427,1,4277,3.3
J4_DGkKGWIo,Unix shell - We can do better now | Ilya Sher | Conf42 Chaos Engineering 2024,"Feb 15, 2024",340,18.4692,2,3905,1.05
OZ-958Ig3kw,Multilingual Natural Language Processing | Gajendra Deshpande | Conf42 Machine Learning 2021,"Aug 31, 2021",340,11.9747,2,4008,5.04
UvOdp38QVMs,Building our own custom Code Insight tool | Adelina Simion & Ross McFarlane | Conf42 DevSecOps 2021,"Dec 2, 2021",340,20.526,1,2519,2.74
bmZGbXNftGg,"I've finished, it's working... only tests left..!? | Tal Doron | Conf42 JavaScript 2021","Nov 26, 2021",338,11.7337,1,1649,6.12
Y-URSLmIPIg,"Struct Embedding, Instrumentation and Code Generation | Jesus Espino | Conf42 Golang 2021","Aug 3, 2021",336,23.4201,9,2979,5.67
3IT4UzN9Jds,Level Up Your CI/CD With Smart AWS Feature Flags | Ran Isenberg | Conf42 DevSecOps 2022,"Jan 6, 2023",334,21.6694,7,1390,1.51
g01ObyU3aEU,Chaos Engineering in 2021 | Mikolaj Pawlikowski | Conf42: Chaos Engineering,"Mar 28, 2021",334,34.2364,2,2379,4.92
PjHH2JiND0o,Premiere - Conf42 Observability 2023,"Jun 8, 2023",329,8.2806,10,4114,2.48
dSug-XCD8S4,How Static Code Analysis Prevents You From Waking Up at 3AM | Xe Iaso | Conf42 SRE 2022,"Jul 12, 2022",329,14.9738,0,20667,0.56
1F5sGy3ONW4,Deep-dive into Open Policy Agent + Conftest + GateKeeper | Noaa Barki | Conf42 Cloud Native 2022,"May 31, 2022",327,35.3945,0,2147,6.43
UoS8Ek1nzlQ,Premiere - Conf42 Cloud Native 2022,"Apr 28, 2022",324,18.8469,9,2670,2.7
kCMk7mViP58,Macrocosm of Microapis | Jose Haro Peralta & Miko Pawlikowski | Conf42Cast,"Jun 8, 2021",324,7.6553,1,1547,4.27
qZO6m7stVSg,How to deal with technical debt | Alexandre Omeyer | Conf42 JavaScript 2021,"Nov 26, 2021",321,21.8164,3,1174,4.26
gjU-X6YnV1A,Premiere - Conf42 Cloud Native 2023,"Mar 30, 2023",318,14.2428,5,3031,1.45
DGajwPBwyC4,Serverless Architecture for Product Defect Detection | Mohsin Khan | Conf42 Machine Learning 2022,"Jun 21, 2022",317,8.0006,8,1384,4.19
NTLdCNeBtI4,Premiere - Conf42 Chaos Engineering 2022,"Mar 10, 2022",316,13.4618,9,2609,2.68
4VosMeJlvWA,Journey to Resilience | Vilas Veeraraghavan | Conf42 Chaos Engineering 2020,"Apr 2, 2020",313,24.5316,1,2647,2.38
cZCbfHBqzlQ,Microservices from a DevOps perspective | Gaston Cacheffo | Conf42 DevOps 2023,"Jan 26, 2023",313,20.4401,3,6128,1.55
mvImyJ1ttN8,Building interactive reports in Streamlit with ipyvizzu | Peter Vidos | Conf42 Python 2023,"Apr 11, 2023",313,15.1155,1,2985,3.18
h6kzwaBwrCY,Premiere - Conf42 Machine Learning 2021,"Jul 29, 2021",312,9.7173,10,1932,1.86
AiavxedXWJA,Complex AI Forecasting Methods for Investments | Pawel Skrzypek & Anna Warno | Conf42 Python 2021,"Jun 26, 2021",310,13.2685,1,2283,4.2
iIr5xgwJWAI,Shift Left your Performance Testing | Hari Krishnan | Conf42 SRE 2021,"Oct 30, 2021",310,28.2156,4,1981,6.71
jllPMWL5rK8,A Gentle Introduction to Building Data-Intensive Applications | Joe Karlsson | Conf42 Golang 2022,"May 3, 2022",310,24.9254,5,3344,4.1
_nG0p3Dl4No,Premiere - Conf42 Machine Learning 2023,"May 18, 2023",309,6.6761,7,2688,2.34
DXSWUkXUFPw,Leveraging the power of State Machines in Swift | Frank Courville | Conf42 Mobile 2022,"Mar 18, 2022",306,23.572,0,1544,4.53
4cRqm8sSUjs,Learning Go when you don't know how to code | Miriah Peterson | Conf42 Golang 2021,"Aug 3, 2021",305,22.5148,3,2404,5.49
lSguqR93rjs,Premiere - Conf42 Enterprise Software 2021,"Mar 25, 2021",304,8.5252,6,1631,2.08
xM8myEOM2yQ,Go to the Edge | Liam Hampton | Conf42 Golang 2022,"Apr 4, 2022",304,17.9757,3,4809,2.72
agNoLB67PxI,GPT: Revolutionizing Monitoring and Logging Systems | Clay Langston | Conf42 SRE 2023,"Jun 4, 2023",302,16.2711,5,5419,2.95
9TMor_Yqypw,Secure coding in iOS | Julio Cesar Fernandez Munoz | Conf42 Mobile 2022,"Mar 18, 2022",301,29.6992,9,2220,5.36
TD9q_7j1ok0,Building Scalable Data Pipelines With Argo Workflows | David Joyce | Conf42 Kube Native 2022,"Nov 20, 2022",300,21.76,2,2515,3.46
mDf0Zf2iBJY,Microsoft SQL Server HA/DR on AWS | Asif Mujawar | Conf42 SRE 2021,"Oct 30, 2021",299,38.0695,4,4016,3.86
VlI7Ke9JYV4,Testing in Go: 101 | Francisco Daines | Conf42 Golang 2022,"May 3, 2022",298,37.6774,4,3673,4.11
XKMpl2b4jOk,What is Data Reliability Engineering? Why it is Crucial? | Miriah Peterson | Conf42 SRE 2022,"Jul 12, 2022",298,23.2115,5,2683,6.19
Z3dZ-LzS8Gc,PyO3: Rust 💚 Python | Moshe Zadka | Conf42 Python 2023,"Apr 11, 2023",298,11.5837,3,3212,6.29
O6-SzNhBXZk,Premiere - Conf42 DevSecOps 2023,"Nov 30, 2023",295,16.6966,14,3831,1.64
IucrT-g1OxI,Modern Development of Distributed Apps: Service Weaver | Robert Grandl | Conf42 Cloud Native 2023,"Apr 30, 2023",293,22.7265,2,2251,6.35
jMPbo7rkKbA,Webiny | Sven Al Hamad | Conf42 Open Source Showcase 2020,"Jul 6, 2020",293,15.545,1,3597,4.92
tAvLKsnNJVg,Extending Redis with Rust | Brian Sam-Bodden | Conf42 Rustlang 2022,"Sep 30, 2022",293,27.432,4,4023,2.83
g6l7gbrmObo,goyek - using Go for automation | Robert Pajak | Conf42 Golang 2023,"May 21, 2023",292,16.2241,3,4508,3.53
hnoahDG03P0,Security Chaos Engineering | Yury Niño Roa | Conf42 SRE 2020,"Aug 9, 2020",291,15.573,5,8865,1.11
1m9bZ8ztl6s,The art of programmatic videos with rust | Dmitriy Kovalenko | Conf42 Rustlang 2022,"Sep 30, 2022",290,24.7319,6,2156,4.59
s7tHhyxuXg4,Dynamic data masking & encryption for MySQL/PostgreSQL | Trista Pan | Conf42 Quantum Computing 2023,"Jul 31, 2023",289,14.1188,1,2927,3.59
NWjh8MY51o8,Monitoring AI Pipelines Output As Product | Hila Fox | Conf42 Machine Learning 2021,"Aug 31, 2021",288,8.0594,1,1747,3.38
kq07tygRWAk,Graviton2: How Honeycomb Reduced Infra Spend by 40% | Shelby Spees | Conf42 Cloud Native 2021,"Jun 2, 2021",286,15.8972,1,1078,3.43
pEPhcoyV474,Building Slack Applications with Bolt.js | Alba Rivas | Conf42 JavaScript 2022,"Dec 19, 2022",286,10.7854,2,2627,6.2
9pBMn3DwHNY,SREs ❤️ Chaos Enegineering | Mikolaj Pawlikowski | Conf42 SRE 2020,"Aug 16, 2020",284,24.8804,4,2420,2.44
Zl0q_JJzCUQ,The Path to self-healing systems | Leonid Belkind | Conf42 Chaos Engineering 2021,"Mar 28, 2021",284,34.2604,3,2499,5.32
HS-BSZcyZIA,Blazing fast serverless with Rust | Luca Bianchi | Conf42 Rustlang 2022,"Sep 30, 2022",282,17.1766,3,3431,3.64
ET7aLG_Rfkw,Python and the New MySQL Shell | Dave Stokes | Conf42 Python 2021,"Jun 26, 2021",281,12.1519,6,1555,7.72
kQEYUtpDWjQ,"Stop being a YAML engineer, be a software engr. with CDK8s | Robert Hoffman | Conf42 JavaScript 2022","Dec 19, 2022",281,24.2701,2,4454,3.05
yoNoEKZXgMY,🚀 Supercharge your Node.JS with Rust | Dmitry Kudryavtsev | Conf42 Rustlang 2022,"Sep 30, 2022",280,18.2506,2,2751,3.71
xawcd75C3M4,Breaking Into Blockchain Development with JavaScript | Jay McCarthy | Conf42 JavaScript 2021,"Oct 28, 2021",278,36.2787,4,3007,3.29
4EzFGpfwfb0,Premiere - Conf42 Incident Management 2022,"Sep 29, 2022",277,9.4016,0,1856,2.91
B0zf4a9T8jo,Application-Level Chaos Engineering in JVM | Long Zhang | Conf42 Chaos Engineering 2020,"Apr 5, 2020",277,19.323,1,3169,3.57
umQmXykeqL4,Premiere - Conf42 DevSecOps 2021,"Dec 2, 2021",277,10.9837,6,2040,2.16
6bAqj6B4m-Q,Blameless Postmortem Culture | Pranjal Deo | Conf42 Chaos Engineering 2021,"Mar 28, 2021",275,22.4022,2,3950,2.73
8DBTffP4KK8,Premiere - Conf42 Platform Engineering 2023,"Sep 7, 2023",275,5.515,9,6524,0.66
B9_WBz4VJO8,Risk-Driven Fault Injection for Fast & Furious | Kennedy Torkura | Conf42 Chaos Engineering 2021,"Mar 28, 2021",275,21.7035,2,2438,3.65
w31oh7ulXwI,Building Scalable Applications with GQLGen & AWS Lambda | Durgaprasad Budhwani | Conf42 Golang 2023,"May 21, 2023",275,14.9175,1,4346,2.58
IfL6J_6el7E,"Go and Redis, better together! | Abhishek Gupta | Conf42 Golang 2023","May 21, 2023",273,32.3642,5,3899,2.64
M0OZgqtI51c,Building Awesome UI Apps with VUE | Ahmed Bankole | Conf42 JavaScript 2020,"Oct 21, 2020",272,7.8174,5,3438,2.53
bjumLUNzwUk,Simpler and more flexible Kubernetes Ingress: Apache APISIX | Wei Jin | Conf42 Cloud Native 2022,"May 31, 2022",268,11.9137,3,1679,5.72
62rNT-bo1G0,The Perfect Code Review | Victor Rentea | Conf42 Enterprise Software 2021,"May 5, 2021",266,13.5849,1,1634,6.55
gTjPWm_N2UE,How to Raise Your Profile as a Developer | Lauren Schaefer | Conf42 JavaScript 2021,"Oct 28, 2021",265,16.8796,6,2559,3.13
qgHWzQ2zcqQ,Postmortem Culture at Google | Ramon Medrano Llamas | Conf42 SRE 2022,"Jul 12, 2022",263,18.5624,1,3116,3.4
