Content,Video title,Video publish time,Views,Watch time (hours),Subscribers,Impressions,Impressions click-through rate (%)
r3VUCq0gwkM,Go learning by project: Souin (rex) | Sylvain Combraque | Conf42 Golang 2021,"Aug 3, 2021",131,4.4126,1,2536,3.04
soHRQVeZTDI,Build 0-cost invite-only website with Next.js & Airtable! | Luciano Mammino | Conf42 JavaScript 2022,"Dec 19, 2022",130,5.9756,1,1347,3.71
szdOtPWFuY4,Using WebAssembly for in-database Machine Learning | Akmal Chaudhri | Conf42 Machine Learning 2023,"Jun 20, 2023",130,3.7609,3,4383,1.39
wdp1PSunTiw,Zero Trust Security with IoT | Syed Rehan | Conf42 Web 3.0 2022,"Jan 7, 2023",130,5.2116,2,2060,1.7
8QDxFmm0y50,Scaling WordPress with Next.js | Colby Fayock | Conf42 JavaScript 2021,"Nov 26, 2021",129,10.8695,6,2374,3.12
bsn3f52huUw,Machine learning won't put you out of a job | Jesus Saldana Gonzalez | Conf42 Machine Learning 2022,"May 19, 2022",129,5.5851,1,2198,1.96
dZrberU3FEQ,CI/CD with Github Actions | Chris Ayers | Conf42 DevSecOps 2022,"Jan 6, 2023",129,11.0491,1,2300,2.39
34LgjCjWoy4,Web Accessibility testing with playwright.js & axe-core | Taslan A. Graham | Conf42 JavaScript 2023,"Dec 10, 2023",128,6.6365,1,898,3.34
AtqFi-f9r54,Think like a HACKER | Josh Stella | Conf42 Open Source Showcase 2020,"Jul 6, 2020",128,12.399,5,1899,2.21
H17k5GEBD8U,"Beyond Kubernetes | John Dietz, Jared Edwards & Miko Pawlikowski | Conf42Cast","Aug 17, 2023",128,6.1694,3,2382,1.55
NbAUmoifzdQ,Maximizing Error Injection Realism with System Calls | Long Zhang | Conf42 Chaos Engineering 2021,"Mar 28, 2021",128,11.9733,0,2470,2.06
fMAINcpXlIQ,Azure cloud for the web frontend developers | Maxim Salnikov | Conf42 JavaScript 2021,"Nov 26, 2021",128,7.5209,3,1421,4.64
HaDkQRQSdvE,How to avoid Black Holes when aiming for Resilience? | Alex Williams & Leonid Belkind | Conf42Cast,"Mar 4, 2021",127,5.766,1,965,1.97
wApKJJVnSIk,Open Source Observability with OpenTelemetry | Nocnica Mellifera | Conf42 DevOps 2023,"Feb 28, 2023",127,7.5668,1,1647,2.98
 -HbNuEAT6BA,Making Logs Work for you with Fluentd | Phil Wilkins | Conf42 Cloud Native 2021,"Jun 2, 2021",126,9.8946,2,2270,2.69
YofLXDGn2KI,Cloud-Native Observability at Scale | Shahar Azulay | Conf42 Kube Native 2022,"Nov 20, 2022",126,4.8497,1,2427,1.85
aidldOBxnJY,The (too) Many Faces Of Architecture | Mihaela-Roxana Ghidersa | Conf42 JavaScript 2021,"Nov 26, 2021",126,8.7911,0,1493,4.02
lbT9aA0aLBo,Observability: one of the strongest muscles for SRE | Jhonnatan Gil Chaves | Conf42 SRE 2023,"Jun 4, 2023",126,12.299,0,3002,2.23
s0Cs1PkJ-UA,Don't Panic! Effective Incident Response | Quintessence Anx | Conf42 SRE 2021,"Oct 30, 2021",126,6.6833,2,914,1.97
A5raon-jtTU,Lyra: Disrupting the full-text search industry with JS | Michele Riva | Conf42 JavaScript 2022,"Dec 19, 2022",125,7.3672,1,1670,3.65
EsMS7gOBrY4,Secrets-management: challenges from code to cloud | Jeroen Willemsen | Conf42 DevSecOps 2021,"Dec 29, 2021",125,10.2877,0,1907,2.1
lqLu5VhF-_0,Debug NodeJS Applications in Production with Lightrun | Shai Almog | Conf42 JavaScript 2021,"Nov 26, 2021",125,8.1129,3,1711,2.92
sEsapRQRx0A,"Stop configuring infrastructure, start coding it! | Robert Hoffmann | Conf42 Cloud Native 2022","May 31, 2022",125,10.6112,0,1355,3.03
XU6FAULTibA,Don't Waste Data | Aditi Ramaswamy & Anisha Biswaray | Conf42 Machine Learning 2022,"Jun 21, 2022",124,2.4392,0,1558,3.02
huKvsVp9xIs,Rust for Java Programmers - a Personal Perspective | Ovidiu Ionescu | Conf42 Rustlang 2023,"Sep 24, 2023",124,11.144,3,3331,1.86
_WDaKgFrj8A,Deep Dive into Kubernetes Operators | Rohit Mishra | Conf42 DevOps 2024,"Jan 25, 2024",123,9.4446,1,5564,1.6
N_q8JZgVIIs,Fighting the Imposter Syndrome | Mihailo Joksimovic | Conf42 Python 2022,"Mar 1, 2022",122,8.5455,0,1313,4.19
QtNAl56HXdI,Building a Serverless FinTech Startup on Azure | Daniel Bass | Conf42 Cloud Native 2021,"Jun 2, 2021",122,9.0677,4,1165,4.64
WeD_9LnsMyg,Multi-Thread demystified | Atila Fassina | Conf42 JavaScript 2021,"Nov 26, 2021",122,7.5539,3,2295,3.01
aKgOt3rG8lo,Hacking OpenTelemetry | Alberto Gastaldello & Andrea Caretta | Conf42 Observability 2023,"Jul 9, 2023",122,7.8393,0,2850,2.39
cQs6JZbSClA,The Role of IoT and 5G Devices in DDoS Attacks | Andrey Slastenov | Conf42 DevSecOps 2023,"Nov 30, 2023",122,6.2418,1,3917,1.53
cYx5gVYj97Q,Defining Steady States and Developing Hypotheses | Sakshyam Shah | Conf42 Chaos Engineering 2022,"Mar 10, 2022",122,10.0272,1,2377,2.4
CvqMzg5md1s,Conf42 talk recording: example,,120,2.5818,2,0,
jJjdKJHqKkI,"Your Lambdas, In Rust! | Luciano Mammino | Conf42 Cloud Native 2023","Apr 30, 2023",120,13.936,1,2782,1.76
sNOP42Jb6XY,Building the Stonehenge using Gall’s law | Fabricio Buzeto | Conf42 Cloud Native 2021,"Jun 2, 2021",120,5.971,3,1239,3.23
tSnQoN6J9R0,Dia de los Muertos - Postmortems that save lives | Fabricio Buzeto | Conf42 Chaos Engineering 2021,"Mar 28, 2021",120,3.6867,0,996,2.71
u3Hwu8mw_E8,Sustainable Incident Management for happy SRE teams | Ajuna Kyaruzi | Conf42 SRE 2021,"Oct 30, 2021",120,6.9122,0,1187,4.47
ueeS2C9d93k,Create distributed database on K8s leveraging a monolithic one | Trista Pan | Conf42 Golang 2023,"May 21, 2023",120,6.3322,0,3609,1.72
0Ts7Sa_z69Y,Algorithmically Generated Visual Designs | Michael Wehar | Conf42 JavaScript 2022,"Dec 19, 2022",119,3.0941,0,1331,2.78
A-GwPQJ2wyQ,The Remix Philosophy is not Just for Remix | Ken Snyder | Conf42 JavaScript 2023,"Dec 10, 2023",119,10.8514,1,1099,2.27
FsUQor3PbKI,Building Platform using ChatOps & Github Bots | Spiros Economakis | Conf42 Platform Engineering 2023,"Oct 12, 2023",119,3.4017,-1,1794,2.79
PPoQSa_6Dko,How to avoid breaking other people's things | Lisa Karlin Curtis | Conf42 Chaos Engineering 2021,"Mar 28, 2021",119,13.7272,0,2038,2.31
cBcmk1sn0vw,Building Automated Quality Gates into your CI pipelines | Craig Risi | Conf42 SRE 2023,"Jun 4, 2023",119,18.8066,1,2079,2.5
IgVj74_bNKQ,Measuring Reliability in Production | Ramon Medrano Llamas | Conf42 SRE 2023,"Jun 4, 2023",118,8.1314,0,3262,1.99
csFAVyw14V4,Inside the Cortex | Ganesh Datta & Miko Pawlikowski | Conf42Cast,"Oct 7, 2021",118,8.8065,1,2464,1.5
svo8rcU-Q5Q,Whose Method Is It Anyway? | Jason C. McDonald | Conf42 Python 2021,"Jun 26, 2021",118,7.8565,2,1489,2.75
RyxqYe8TGJU,Using OpenTelemetry in a polyglot environment | Michael Sickles | Conf42 Cloud Native 2021,"Jun 2, 2021",117,8.7163,1,1499,3.14
QJb4s6GjvZs,React is Killing your Performance and it's Your Fault | Assaf Krintza | Conf42 JavaScript 2021,"Nov 26, 2021",116,7.9819,0,856,2.8
QbcrJKjWQGE,Psychology of Chaos Engineering | Matty Stratton | Conf42 Chaos Engineering 2020,"Mar 30, 2020",116,8.0316,2,944,2.97
lpkjrdSqgSQ,Kubernetes audit log best practices | Kenneth DuMez | Conf42 Cloud Native 2023,"Mar 30, 2023",116,7.4726,1,2693,2.15
AnX7sC01ut4,Introduction to Ansible for Network Engineers | Jason Belk | Conf42 Cloud Native 2022,"May 31, 2022",115,4.4833,3,1029,3.21
IhV04iRGbks,The Art of Event Driven Observability with OpenTelemetry | Henrik Rexed | Conf42 Observability 2023,"Jul 9, 2023",115,8.1404,3,2062,2.91
PVCsOPzpJgY,Observability in Serverless Application | Ozioma Uzoegwu | Conf42 SRE 2021,"Oct 30, 2021",115,9.038,1,1157,2.77
RFdafFaLvBw,Cloud Native Apache Pulsar Development 101 with Python | Tim Spann | Conf42 Cloud Native 2022,"May 31, 2022",115,7.8802,2,1872,2.94
Sp2FZ5s6Qhc,In Ignotis: Quantum Computing & Astrophysics | Archit Srivastava | Conf42 Quantum Computing 2023,"Jul 31, 2023",115,5.185,3,1943,1.29
nXyqxE2UJ1g,Sharing secret keys in Docker containers and K8s | Jose Manuel Ortega | Conf42 Kube Native 2022,"Nov 20, 2022",115,2.9333,0,2248,1.16
ydG6j83DTnU,Micro Frontends - foundations | Tomasz Krajewski | Conf42 JavaScript 2021,"Nov 26, 2021",115,5.0032,0,2460,2.72
jXR47dubRW8,One Platform Product for All: A Revolution | Hila Israeli | Conf42 Python 2023,"Apr 11, 2023",114,5.6205,1,1375,2.55
n9Q-LONGcec,Observability of Microservices using Open Source Solutions | Shubham Srivastava | Conf42 DevOps 2023,"Feb 28, 2023",114,3.414,1,1940,2.63
nELuSb_MsYY,Migrating to Multi Cluster Managed Kafka - 0 Downtime | Natan Silnitsky | Conf42 Cloud Native 2022,"May 31, 2022",114,5.9742,0,979,4.29
1ujATkvkdSA,"What on Earth is padaiyal? | Ranjan Mohan, Silvia Siu Luo & Miko Pawlikowski | Conf42Cast","Jul 24, 2021",113,3.9366,1,1196,2.26
5WuA0C4UxkI,Top new CNCF projects to look out for | Annie Talvasto | Conf42 SRE 2021,"Oct 30, 2021",113,7.9112,1,1865,2.79
htiICUhTmH8,Why you’re getting understandability wrong | Liran Haimovitch | Conf42 Enterprise Software 2021,"May 5, 2021",113,4.433,0,1476,1.83
4PBB6X_f3X8,"Maximizing Speed, Costs, UX - AWS ElastiCache Serverless | Indika Wimalasuriya | Conf42 DevOps 2024","Jan 25, 2024",112,2.5166,1,1059,1.89
NBA8hDkoBfM,5-Technology Trends and Opportunities | Derris Boomer | Conf42 Chaos Engineering 2021,"Mar 28, 2021",112,7.5715,0,1882,2.28
lgUv1CYVT6M,Communication challenges in scaling quantum computers | Sam Samuel | Conf42 Quantum Computing 2022,"Jun 30, 2022",112,12.0628,2,2666,2.18
2Wr3n7lnre8,SBB - Secure Building Blocks | Yashwanth Singh M | Conf42 Rustlang 2023,"Sep 24, 2023",111,5.7175,1,2694,1.41
3aoLMVVcE38,The Charm of Incidents | Emily Ruppe & Miko Pawlikowski | Conf42Cast,"Oct 6, 2022",111,10.2052,1,2358,1.31
DWg5iKLywZA,How Devs can save the future generations | Manuel Carrasco Molina | Conf42 Mobile 2022,"Feb 17, 2022",111,7.3712,1,1893,1.58
MJFy3gucdIs,Uranium - a visual quantum computing platform | Radu Marginean | Conf42 Quantum Computing 2022,"Jun 30, 2022",111,4.4719,1,2094,2.58
WU2RencI2vI,Event Streaming and Processing with Apache Pulsar | Mary Grygleski | Conf42 Cloud Native 2022,"May 31, 2022",111,5.4179,1,1256,2.31
ah0DJT5DYJM,Reading 100+ Kubernetes Post-Mortems - lessons learned | Noaa Barki & Shimon Tolts | Conf42 SRE 2021,"Oct 30, 2021",111,5.5223,0,1134,4.32
f4qxdG79QrI,Scaling Multi-cluster Kubernetes at Teleport Cloud | Stephen Levine | Conf42 Kube Native 2023,"Sep 28, 2023",111,5.837,1,2430,1.52
p4PyzDzppiY,Make Your Electron App Feel at Home Everywhere | Kilian Valkhof | Conf42 JavaScript 2021,"Nov 26, 2021",111,8.054,1,1940,3.09
q4sLggLcytc,Protecting Sensitive Data and Machine Learning Models | Justin Patriquin | Conf42 Python 2023,"Mar 9, 2023",111,6.0991,3,2975,1.68
86xI0DzmZWk,Building Universal CI/CD Pipelines | Lionel Lonkap Tsamba | Conf42 DevSecOps 2022,"Jan 6, 2023",110,6.4668,0,2354,1.78
OXIgCFaCD2c,Build ML environment for regulatory customers | Suraj Muraleedharan | Conf42 Machine Learning 2021,"Aug 31, 2021",110,5.3942,0,1203,2.33
QTETuso5wxA,One Woman Show of Migrating an Entire R&D SCM From Bitbucket to GitLab | Hila Fish | Conf42 SRE 2022,"Jul 12, 2022",110,4.0463,0,1993,2.06
WnCKQeODTIg,Microsoft DevOps Solutions AZ-400 | Swapneelkumar Deshpande & Miko Pawlikowski | Conf42Cast,"Dec 13, 2022",110,3.9195,0,2016,0.79
xGcQK0VCngI,Enjoy Typesafe Web Development with Eta | Mappuji Abdurrachman | Conf42 Enterprise Software 2021,"May 5, 2021",110,4.6509,0,2022,2.87
9UX7oPPqc8E,Serverless Security Top 10 | Tal Melamed | Conf42 Cloud Native 2022,"May 31, 2022",109,9.6729,1,864,3.13
IsvPRHoMpt4,K8s Gateway API 101 | Gregorio Palama | Conf42 DevOps 2024,"Jan 25, 2024",109,5.624,0,1963,1.68
NmpjMg62wuw,At the age of AI and ML | Soumen Chatterjee &  Nathalie Rauschmayr | Conf42 Chaos Engineering 2022,"Apr 11, 2022",109,6.3102,0,1917,1.56
TDI_TiqBgRc,System State Clustering using eBPF data | Sujith Samuel | Conf42 SRE 2021,"Oct 30, 2021",109,4.3269,0,1480,1.96
YX6xFsRLfo8,Why Put Sec in DevOps – and How | Greta Jocyte | Conf42 DevOps 2023,"Feb 28, 2023",109,6.1699,0,2368,2.24
3FE1wMMfw2w,Architectural Caching Patterns for Kubernetes | Rafal Leszko | Conf42 Cloud Native 2021,"Jun 2, 2021",108,7.7167,0,1448,4.01
EyHejt7WUTI,Optimize connectivity for multi-region archs | Christian Elsen & Lerna Ekmekcioglu | Conf42 SRE 2022,"Jul 12, 2022",108,3.1017,0,1228,2.28
GrBGFzq_pMM,Scalable Multi-Tenant Frontend for an E-Commerce Platform | Guilherme Dalla Rosa | Conf42 JS 2023,"Dec 10, 2023",108,6.1088,5,1720,2.5
9BqNSWGQlmk,The 2024 Kubernetes Benchmark Report | Joe Pelletier | Conf42 DevOps 2024,"Jan 25, 2024",107,8.9285,1,1988,1.81
EGxcQB92Zo0,Exploring ChatGPT for Improved Observability | Gareth Emslie | Conf42 Observability 2023,"Jul 9, 2023",107,8.2371,1,3104,1.58
Ytvb-vili9I,Building Kubernetes apps? Remove YAML & write Go instead! | Abhishek Gupta | Conf42 Kube Native 2022,"Nov 20, 2022",107,4.5906,0,2949,1.53
enIPf6_MFn4,Effective Java with Groovy & Kotlin | Naresha K | Conf42 Enterprise Software 2021,"May 5, 2021",107,5.3735,0,2347,2.47
nn-4BzMd0Eg,Put down JS - how building fundamentals will help you LvlUp! | Colby Fayock | Conf42 JavaScript 2020,"Oct 21, 2020",107,6.6963,3,2373,1.47
6-MOtJPpves,Embracing the Fear of Failure | Humaira Ahmed | Conf42 Chaos Engineering 2021,"Mar 28, 2021",106,4.7218,0,1827,3.28
K_YGDX5VhUo,Python Memory Understanding | Nisarg Shah | Conf42 Python 2021,"Jun 26, 2021",106,3.3321,2,1548,3.49
a32OpMspmf8,Easy mode for full-stack development with Figma & AWS Amplify | Arundeep Nagaraj | Conf42 JS 2023,"Dec 10, 2023",106,6.1318,0,2844,2.53
dICC8Vv5YoM,Building and Leading Remote Teams | Amber Vanderburg | Conf42 SRE 2020,"Aug 9, 2020",106,8.2909,0,1372,2.55
jzAOVoBPPBA,Go from Kubernetes YAML to software engineer with CDK8s | Robert Hoffmann | Conf42 Kube Native 2023,"Oct 30, 2023",106,7.7027,1,2533,2.57
k0zWsIYQUAA,Implementing a performant URL parser from scratch | Yagiz Nizipli | Conf42 JavaScript 2022,"Dec 19, 2022",106,2.3814,0,1159,3.28
yAIb6GM3b5k,Demystifying Garbage Collection in Java | Igor Braga  | Conf42 Enterprise Software 2021,"May 5, 2021",106,5.7495,1,2303,2.04
FDHQJrtShM4,We can’t all be Shaq: it’s time for SRE hero to pass the ball | Malcolm Preston | Conf42 SRE 2022,"Jun 9, 2022",105,7.6921,0,1933,1.71
MUOrumcZvKo,Convolutional Neural Networks in Action | Milecia McGregor | Conf42 Machine Learning 2021,"Aug 31, 2021",105,3.8916,3,1575,2.22
UfGy6jgjaTI,Building a K8s Operator for a Distributed Database | Natalie Pistunovich | Conf42 Cloud Native 2021,"Jun 2, 2021",105,3.1151,1,1227,3.34
Showing top 500 results
