Content,Video title,Video publish time,Views,Watch time (hours),Subscribers,Impressions,Impressions click-through rate (%)
xi6q2FLL2S8,Demystifying Event-Driven Architectures | Bogdan Sucaciu | Conf42 Enterprise Software 2021,"May 5, 2021",240,11.9729,1,1496,7.82
8XEzepW_Jtk,"Using Infra-as-code, not Jira tickets to pass audits | Travis Gary  | Conf42 DevSecOps 2021","Dec 2, 2021",239,15.2082,1,1992,2.06
s7tHhyxuXg4,Dynamic data masking & encryption for MySQL/PostgreSQL | Trista Pan | Conf42 Quantum Computing 2023,"Jul 31, 2023",239,12.1351,1,2758,3.34
z9JB98wHQJY,Programming your way up a Skyscraper | Tadeh Hakopian | Conf42 Python 2021,"Jun 26, 2021",239,5.2365,2,2111,4.07
FXHredN-q5A,The Only Thing That Matters In DevOps Is... | Viktor Farcic | Conf42 Cloud Native 2022,"May 31, 2022",236,15.3436,1,1337,4.11
R8Y-dvN9enw,You should never use static shared secrets in GitHub Actions | Kenneth DuMez | Conf42 DevOps 2023,"Jan 26, 2023",236,13.664,6,7104,0.91
ALFcjl1xcyo,Build the next evolution of composable architecture using GraphQL | Priya Singh | Conf42 SRE 2022,"Jun 9, 2022",235,16.6872,2,2951,1.9
gNHVXN3DP6o,Making VR more interesting with JS and Brain.js | Milecia McGregor | Conf42 JavaScript 2020,"Oct 21, 2020",235,9.5075,4,3011,2.29
VfAff-aBpNg,"Dissecting Slices, Maps and Channels in Go | Jesus Espino | Conf42 Golang 2022","May 3, 2022",231,13.0718,3,2551,5.33
q2MuScM0Ru4,Premiere - Conf42 Incident Management 2023,"Oct 19, 2023",230,6.258,4,3976,1.06
E5JMyl8r3zc,Build your own Svelte | Li Hau Tan | Conf42 JavaScript 2022,"Dec 19, 2022",229,11.7489,1,3501,2.23
O6-SzNhBXZk,Premiere - Conf42 DevSecOps 2023,"Nov 30, 2023",229,15.4262,11,3399,1.74
geVnpogxgD8,Premiere - Conf42 Kube Native 2022,"Oct 20, 2022",228,6.2006,3,3520,1.56
S-JZL1j-X2c,Evangelizing the SRE mindset | Cristina Buenahora Bustamante | Conf42 SRE 2021,"Sep 30, 2021",225,20.7334,2,2287,3.98
eK1krh81z_A,XWiki | Clement Aubin | Conf42 Open Source Showcase 2020,"Jul 6, 2020",225,12.7761,2,4247,2.78
BPPiWpRN1g0,Idiomatic Python: Tools and Tips | Ammara Laeeq | Conf42 Python 2021,"Jun 26, 2021",223,15.4036,1,2368,5.62
yRpmKmeaweU,Chaos Engineering alongside Litmus and Jenkins | Akram Riahi | Conf42 Chaos Engineering 2022,"Apr 11, 2022",222,9.8718,1,1236,6.63
88X5_tDnku0,Future is Cloud-native & Your Organization Should Be Too | Ciara Carey | Conf42 Cloud Native 2022,"Apr 28, 2022",221,16.5321,2,2872,3.06
8bUiFaPqRj8,Continuous Resilience with Chaos Engineering | Uma Mukkara | Conf42 Chaos Engineering 2023,"Feb 16, 2023",221,12.1885,4,6645,0.72
nm62d2gYqNk,Graceful Degradation: When All Goes Wrong | Tanveer Gill | Conf42 Chaos Engineering 2023,"Mar 23, 2023",219,7.6035,2,2133,2.86
r66vRCWpWoM,Working with dates and times in Pandas | Reuven M Lerner | Conf42 Python 2021,"Jun 26, 2021",217,24.8486,2,3276,3.48
BeFLnQF78ik,Concurrency primitives of Golang - how to use and how not to | Piyush Verma | Conf42 Golang 2021,"Aug 3, 2021",216,12.0604,3,1624,5.6
e2jeukR8ZaA,Search through your data with Weaviate | Laura Ham | Conf42 Machine Learning 2021,"Aug 31, 2021",216,9.0552,2,2458,4.72
qfUbp7uJqWw,Manage secrets across cloud on Kubernetes | Jhonnatan Gil Chaves | Conf42 DevSecOps 2021,"Dec 29, 2021",216,5.2583,1,1440,1.6
H3hLVALwkqc,Compliance As Code with Cloud Custodian | Ismael Hommani & Tanguy Combe | Conf42 DevSecOps 2021,"Dec 29, 2021",215,14.048,1,1995,4.86
vBwzEpnQ7To,Contract Driven Development | Hari Krishnan | Conf42 Incident Management 2022,"Oct 24, 2022",215,14.2851,0,2712,3.36
8T_oB4KgsA4,"Ducks, Re-ducks, Redux-tools | Sergii Zhuravel | Conf42 JavaScript 2021","Nov 26, 2021",214,16.4665,1,2022,4.75
LAWdzqBtxL8,Using Arch-Go to test the quality of our architecture | Francisco Daines | Conf42 Golang 2021,"Aug 3, 2021",214,8.2734,3,2573,3.19
R23q51wkvY4,Cloud Chaos - AWS Fault Injection Simulator (FIS) | Samuel Baruffi | Conf42 Chaos Engineering 2023,"Mar 23, 2023",214,23.2851,4,1860,3.92
vqNviNKQWE8,Software Composition Analysis 101: what’s inside your apps | Magno Logan | Conf42 DevSecOps 2021,"Dec 29, 2021",214,21.2496,3,3929,3.44
IEAiODaTPok,Consulting for Introverted Developers | Matt Harrison | Conf42 Python 2023,"Apr 11, 2023",213,12.4645,5,3731,3.43
W_wazXG70-Y,Securing the Cloud | Yury Nino & Jhon Gil Chaves | Conf42 Chaos Engineering 2021,"Mar 28, 2021",211,13.5867,1,2401,2.08
ZTbrf47mCEU,Who is responsible for Chaos? | Joyce Lin | Conf42 Chaos Engineering 2020,"Mar 31, 2020",211,6.4266,1,3681,2.61
qDqNyfCaiIU,Ensembling techniques for time series forecasting | Pawel Skrzypek & Anna Warno | Conf42 Python 2022,"Mar 1, 2022",211,12.3462,1,2341,4.57
azmyU4_7VYI,Driving Service Ownership with Distributed Tracing | Daniel 'spoons' Spoonhower | Conf42 SRE 2020,"Aug 9, 2020",209,17.9468,2,1277,3.52
bYSo78dwgH8,HTTP Server on random available port in Go | Kazuki Higashiguchi | Conf42 Golang 2022,"May 3, 2022",209,8.2969,-1,3186,3.23
 -ngNReCPRLE,Build a complex app with TDD | Ivan Pesenti | Conf42 Golang 2023,"May 21, 2023",208,17.2609,1,2808,3.49
Dxt1SjUtCDk,Onboarding Chaos Engineering | Karolina Rachwał | Conf42 Chaos Engineering 2021,"Mar 28, 2021",208,8.7546,0,1659,3.68
frregZU6ck0,Destructuring frontend monoliths with Microfrontends | Trishul Goel | Conf42 JavaScript 2021,"Nov 26, 2021",205,13.8686,3,1880,3.51
JwnJt9XZl8s,Build your next app with web components! | Andrew Desmarais | Conf42 JavaScript 2021,"Nov 26, 2021",202,13.5609,1,2252,3.77
3ySS8c5Ja0E,Replacing Privileged Users With Just-in-Time Access Requests | Travis Rodgers | Conf42 SRE 2023,"May 4, 2023",199,18.356,1,4508,1.73
IeVS8Y6wpKg,Streamlit: The Fastest Way to build Data Apps | Steven Kolawole | Conf42 Python 2021,"Jun 26, 2021",198,5.8116,1,4266,2.2
dm8cyB2k32g,Deserializing Python objects in Go with GoPickle | Marco Nicola | Conf42 Golang 2021,"Aug 3, 2021",198,11.1729,1,2056,3.65
xriZuPVyTZg,Live hacking: Breaking into your Java web app | Brian Vermeer | Conf42 Enterprise Software 2021,"May 5, 2021",197,14.7386,0,3270,2.87
rZzGr5Zj1KM,Four Golden Signals: Monitoring the health of your service | Michael McAllister | Conf42 SRE 2022,"Jun 9, 2022",196,14.2426,2,3013,2.89
HCy3sjMRvlI,Chaos Engineering for SQL Server | Andrew Pruski | Conf42 Chaos Engineering 2020,"Mar 29, 2020",195,15.4957,4,1659,3.13
EgSt47s8tFo,Migrating from Imperative to Reactive | Nicolas Frankel | Conf42 Enterprise Software 2021,"May 5, 2021",193,21.9284,0,1885,5.15
6JtctR2C0Ww,Secure your Go APIs with Decentralised Identity Tokens | Mohammad Shahbaz Alam | Conf42 Golang 2021,"Aug 3, 2021",192,8.9325,1,2767,3.94
WvQMG0oQYQk,Regress to Progress: A Child’s Mindset for Growth | Rain Leander | Conf42 Python 2022,"Jan 27, 2022",192,5.9393,2,3977,2.01
HSsyT7kI3EM,Keys or Certs for SSH Access? Why should I care? | Allen Vailliencourt | Conf42 SRE 2021,"Sep 30, 2021",191,16.8553,5,2375,1.68
gLOLcVQasYQ,Journey from monolith to microservices on AWS | Lerna Ekmekcioglu | Conf42 Cloud Native 2022,"May 31, 2022",191,6.8657,0,1239,3.79
vi8EJ1vflf0,Did We Make Developers Happy by Shifting to Microservices? | Arsh Sharma | Conf42 Kube Native 2022,"Oct 20, 2022",191,9.5991,2,2563,2.69
cpTZ3ywTdHQ,Premiere - Conf42 Mobile 2022,"Feb 17, 2022",189,8.299,6,1289,1.94
58JCFkE8BqQ,golings - a tool for beginners learning golang | Mauricio Antunes | Conf42 Golang 2023,"May 21, 2023",188,6.7483,1,3057,3.37
mAs-l0L90k0,String Comparison in Real Life | Naomi Kriger | Conf42 Python 2021,"Jun 26, 2021",188,12.31,3,1994,5.17
r-tVKhb1W98,Horizontal Autoscaling with Kubernetes | Rob Richardson | Conf42 Kube Native 2022,"Nov 20, 2022",188,12.5391,0,46010,0.14
QrdhysXUiJQ,Taming uncertainty in Observability | Mahesh Venkataraman | Conf42 Chaos Engineering 2021,"Mar 28, 2021",187,7.1603,1,1716,2.62
ir0qo9mdiuw,"True DevSecOps with People, Processes, and Technologies | Stefania Chaplin | Conf42 DevSecOps 2022","Dec 1, 2022",187,10.5347,2,2176,3.31
W8abhX_9AmE,Security testing for Terraform templates | Pawel Piwosz | Conf42 DevSecOps 2021,"Dec 29, 2021",184,14.3838,1,1649,4.37
5NJk7wc5WII,Continuous Reliability. How? | Ana Margarita Medina | Conf42 Chaos Engineering 2022,"Mar 10, 2022",181,9.643,4,2531,2.53
EF317oTdrnM,"From XML to Compose, transforming a large app to Jetpack Compose | Ahmed Tikiwa | Conf42 Mobile 2022","Mar 18, 2022",181,11.0104,1,2064,2.86
q1p4K5se3jc,Heap Optimizations for Go Systems | Nishant Roy | Conf42 Golang 2023,"May 21, 2023",180,17.6545,1,4495,2.18
sbR0zEDZYGY,Improving resilience through SLO validation using chaos engineering | Uma Mukkara | Conf42 SRE 2021,"Sep 30, 2021",180,14.2995,2,2632,2.74
CpcJhMyCw3M,Regain faith- Internet’s zero trust architecture | Thibault Koechlin | Conf42 Chaos Engineering 2021,"Mar 28, 2021",178,9.2554,2,2701,2.67
30s_Jsa29M0,Alerting on SLOs and Error Budget Policies | Ricardo Castro | Conf42 SRE 2022,"Jul 12, 2022",177,12.3016,2,2018,4.26
ODQPERg82yQ,Adding OpenTelemetry to Production Apps: Lessons Learned | Dave McAllister | Conf42 SRE 2022,"Jul 12, 2022",177,16.9065,0,1709,1.7
ioFwOt3_aWg,Python - best practices | Ranjan Mohan | Conf42 Python 2021,"Jun 26, 2021",177,8.7168,1,1572,5.66
mZfIHxkonxg,From Application to Product Ownership: an SRE Team's Journey | Nikolaus Rath | Conf42 SRE 2020,"Aug 9, 2020",177,12.9754,0,1485,2.69
6uQ_TzC1Vbk,Exploring Stateful Microservices built with Open Liberty | Mary Grygleski | Conf42 Cloud Native 2021,"Jun 2, 2021",176,13.8993,0,1724,4.47
isRejeQY3fI,Practical introduction to OpenTelemetry tracing | Nicolas Frankel | Conf42 DevOps 2023,"Feb 28, 2023",175,10.9225,0,2930,2.7
u2qRKFbSKYE,What Successful AI Teams Have in Common | Scott M. Graffius | Conf42 Quantum Computing 2023,"Jul 31, 2023",174,2.8674,0,2040,1.67
p_QBnEC-5o0,Engineering Reliable Mobile Applications | Pranjal Deo | Conf42 SRE 2021,"Oct 30, 2021",173,20.1637,2,1305,5.29
wzA310fy0u8,Orchestrating data and ML workflows with Apache Airflow | Tamara Janina Fingerlin | Conf42 ML 2023,"Jun 20, 2023",173,15.0521,5,2843,2.92
Sb7T997maRw,Applied Security | Aaron Rinehart & Jamie Dicken | Conf42 SRE 2020,"Aug 9, 2020",171,17.1776,1,1960,2.65
57qGmSsLAgs,SRE Anti-patterns | Niladri Choudhuri | Conf42 SRE 2022,"Jun 9, 2022",170,19.4329,4,2325,3.18
PHZuGN-sEAo,SLI Negotiation Tactics for Engineers | Alayshia Knighten | Conf42 SRE 2021,"Sep 30, 2021",170,8.5467,0,2139,2.29
tMow4OAWkwY,Tinkerbell  - an automated Provisionning Engine | Aman Parauliya | Conf42 SRE 2020,"Aug 9, 2020",170,18.9579,3,3283,2.28
azofjyUDgJw,Shift up: Continous Security and feedback loop | Swapnil Deshmukh | Conf42 Chaos Engineering 2021,"Mar 28, 2021",169,5.9298,1,2498,4.04
5uJdBnY-zcE,Unveiling the secrets of ancient coins | Nicolas Metallo | Conf42 Machine Learning 2021,"Aug 31, 2021",168,5.0275,2,1818,3.85
WHc_9QRIpL4,Software won't make noise when it breaks | Piyush Verma | Conf42 Chaos Engineering 2021,"Mar 28, 2021",168,13.5339,1,2706,2.7
cEbEYSN8o1U,Intro to Solid.js for React Developers (or anyone else) | Travis Waith-Mair | Conf42 JavaScript 2022,"Dec 19, 2022",168,11.8288,-1,1547,2
jxWWMr18Gwc,Malware Hunting - Using python as attack weapon | Filipi Pires | Conf42 Python 2022,"Mar 1, 2022",168,6.5936,2,1903,2.89
04uoYLtFI78,Investigating Performance Issues In Microservices Arch. | Dotan Horovits | Conf42 SRE 2021,"Oct 30, 2021",167,16.4552,2,1620,4.69
hCVLZ8-7_Yg,Confidential computing with Go | Moritz Eckert | Conf42 Golang 2021,"Aug 3, 2021",167,10.6822,3,2190,3.11
BiJWFHL7u_Y,Machine Learning 2.0 with Hugging Face | Julien Simon | Conf42 Machine Learning 2022,"Jun 21, 2022",166,11.8189,2,4403,1.84
MhPQxelA2v4,How to become a digital nomad without losing your job! | Arafat Khan | Conf42 DevSecOps 2022,"Jan 6, 2023",166,6.4616,0,4460,0.34
uev8MdVZj_o,The Art & Science of AB Test Development | Bill Coloe | Conf42 JavaScript 2021,"Nov 26, 2021",166,12.9631,2,2049,4.25
T3I4g1igWOM,Pragmatic Incident Response: 5 lessons learned from failures | Robert Ross | Conf42 SRE 2021,"Sep 30, 2021",165,23.6888,3,3222,2.82
KM00eyKDVs4,Machine Learning Engineering Done Right | Joshua Arvin Lat | Conf42 Python 2021,"Jun 26, 2021",164,7.5099,3,1892,3.65
KnOjmPHvwe4,Building an IoT Monitoring App with InfluxDB | Anais Dotis-Georgiou | Conf42 Python 2023,"Apr 11, 2023",164,6.9919,1,4042,1.16
o0HEbXdCyKg,TypeScript's Strict Compiler Options | Daniel Danielecki | Conf42 JavaScript 2021,"Nov 26, 2021",162,5.9238,1,1778,4.44
jCH-aLbcYUA,Improving the process of debugging JavaScript errors | Finbar Fleming | Conf42 JavaScript 2022,"Nov 17, 2022",161,6.3993,1,2682,2.01
jz6ZXseTZzU,Implementing a Learning Team: A real-world case-study | Kurt Andersen | Conf42 SRE 2022,"Jun 9, 2022",161,16.9767,3,4670,1.28
RHMQ3e3mC_s,How Decorators Function | Andrew Knight | Conf42 Python 2022,"Mar 1, 2022",160,11.6605,0,1279,4.38
xtkgZxNbnPI,What is observability-driven development? | Adnan Rahic | Conf42 Observability 2023,"Jul 9, 2023",160,12.1603,2,3446,2.41
hQXBC2F8Lig,Exposing Log-Metrics To Prometheus With Best Practice |Samuel Arogbonlo | Conf42 SRE 2022,"Jul 12, 2022",159,7.4794,1,1730,2.31
kxWvP-y49sw,How to TDD in legacy code | Gil Zilberfeld | Conf42 Python 2022,"Mar 1, 2022",159,15.8805,1,1854,3.56
45MJYw_iDMg,Anomaly Detection with Apache Pinot & ThirdEye | Yoav Nordmann | Conf42 Cloud Native 2023,"Apr 30, 2023",158,11.2779,3,1645,2.25
DCQD-sqTyrQ,Premiere - Conf42 Machine Learning 2022,"May 19, 2022",158,4.3118,1,1985,1.21
M2pQ95M3nII,Premiere -  Conf42 Web 3.0 2022,"Dec 15, 2022",158,2.5015,2,1895,1.69
R3eqwG8wfeE,Squeezing a go function | Jesus Espino | Conf42 Golang 2023,"May 21, 2023",158,15.0015,0,3099,2.26
eY6NguDGuo0,Increasing Kubernetes Resilience for an SRE | Umasankar Mukkara | Conf42 SRE 2020,"Aug 9, 2020",158,11.7839,2,2190,3.93
n7EHNRfYj0U,Let the Main Thread Breathe! | Majid Hajian | Conf42 JavaScript 2020,"Oct 21, 2020",158,10.54,2,1932,2.8
ADbzspZrZu4,Data analytics in browser with AlaSQL.JS | Gaurab Patra & Bhagyajit Jagdev | Conf42 JavaScript 2022,"Dec 19, 2022",157,4.5688,0,1504,5.85
Gdm96CtmrL0,"Postmortems, Learning & Blameless Culture | Julie Gunderson | Conf42 Chaos Engineering 2021","Mar 28, 2021",156,22.3318,0,2339,2.82
LrPYtefkHJ4,Proactive optimization for Cloud | Paweł Skrzypek & Alicja Reniewicz | Conf42 Chaos Engineering 2021,"Mar 28, 2021",156,12.1424,1,2590,2.43
XatQZUjI9LI,Monitoring Microservices The Right Way | Dotan Horovits | Conf42 Cloud Native 2021,"Jun 2, 2021",155,9.7678,2,1412,5.45
YvDKNpvom90,Kubernetes monitoring - how to improve it | Aliaksandr Valialkin | Conf42 SRE 2022,"Jul 12, 2022",155,9.029,3,2253,2.71
Yx4eM9Sh-fY,The State of Infrastructure-From-Code 2023 | Ala Shiban | Conf42 Cloud Native 2023,"Apr 30, 2023",155,8.2879,2,754,1.86
_8eFg8dDcjk,Self-service PR-based automated Terraform | Andrew Kirkpatrick | Conf42 SRE 2021,"Oct 30, 2021",155,14.9345,1,1788,4.08
Qzq52ADcBD8,Let's Go Build Cloud Native Pulsar Apps with Go | David Kjerrumgaard | Conf42 Golang 2023,"May 21, 2023",154,9.3478,0,2780,3.38
9mkNEazCtfY,Feature flags in terraform | Prabesh Thapa | Conf42 DevOps 2023,"Feb 28, 2023",152,7.5981,2,1550,5.03
Q3raBvmtBy4,Relia...bility? | Ricardo Castro | Conf42 Incident Management 2022,"Oct 24, 2022",152,6.3752,0,1148,2.18
dhzREpvTdpw,"It's My Homelab, Why Would I Want SSO? | Matt Williams | Conf42 Kube Native 2022","Nov 20, 2022",152,7.4728,0,2306,1.39
H4ZqAkOfTcw,Learnings from Chaos experiments | Vishnu Vardhan Chikoti | Conf42 Chaos Engineering 2022,"Apr 11, 2022",151,7.176,3,1364,2.86
KUyIjjgYhl0,Cloud Native Chaos Engineering | Umasankar Mukkara | Conf42 Chaos Engineering 2020,"Apr 3, 2020",151,6.1467,2,2067,3.24
PZbznVnPKqY,Set Up a “Production-Ready” Kubernetes Cluster in 10 Minutes | Abhimanyu Selvan | Conf42 DevOps 2023,"Feb 28, 2023",151,9.0219,4,1422,5.27
XvulxlK7EYE,"Apparently, you can ""debug"" your SQL queries | Eyal Trabelsi | Conf42 Observability 2023","Jul 9, 2023",151,5.4365,2,1228,1.55
y_Ve7jiHDFA,Defeating Ransomware Attacks | Kennedy Torkura | Conf42 Chaos Engineering 2022,"Apr 11, 2022",151,8.2924,1,1188,3.45
oaPyPrO6d80,Manage the blocks of your app with BLoC - Flutter | Abhishek Doshi | Conf42 Mobile 2022,"Mar 18, 2022",150,4.935,2,2286,3.59
AzUe2PsDXCQ,4 key metrics for measuring your team's performance | Cristina Buenahora | Conf42 SRE 2022,"Jun 9, 2022",149,16.6701,2,3620,1.63
BdD8RcNayps,A journey of Journey Programming Language written by Tester | Atmaram Naik | Conf42 Rustlang 2023,"Sep 24, 2023",149,6.0413,3,1707,1.35
4WdMWhGrIeQ,Attack & Defend Mobile Apps | Romansh Yadav | Conf42 Chaos Engineering 2021,"Mar 28, 2021",148,13.7993,2,2559,2.62
T3_UMV6_tKw,Containing an Elephant | Dhiraj Hegde | Conf42 Cloud Native 2021,"Jun 2, 2021",148,10.0179,1,1074,0.93
avuPa3ldmCc,Build on Ethereum Quickly and Easily with Scaffold-ETH | Kevin Jones | Conf42 Web 3.0 2022,"Jan 7, 2023",148,6.811,2,3937,0.86
lGba-z0yxqw,Offline Web Apps don't exist anymore! | Francesco Leardini | Conf42 JavaScript 2020,"Oct 21, 2020",148,7.5049,4,2720,2.54
MbZ4mHyKJFw,Teleportation for beginners | Ev Kontsevoy & Miko Pawlikowski | Conf42Cast,"May 20, 2021",147,15.0214,1,1136,3.7
T2aoaFLbUqQ,Serverless Backend for Frontend on AWS | Roman Boiko | Conf42 JavaScript 2022,"Dec 19, 2022",147,10.8251,1,1083,2.12
T4yw0Unc-wQ,Preparing for disaster: going Multi-Region | Ana Van Straaten | Conf42 Cloud Native 2022,"Apr 28, 2022",147,6.6445,1,1999,2.05
a9R9FRnkLu4,Mutation Testing with PIT | Rafal Leszko | Conf42 Enterprise Software 2021,"May 5, 2021",147,9.9357,1,2325,2.8
zz2Z6P60hK0,Analyzing the Programmer's Brain | Felienne Hermans & Miko Pawlikowski | Conf42Cast,"Dec 9, 2021",147,12.5506,3,2580,2.67
L6rQtGDxCXk,Canvas Pixel Transformation: Beauty comes slowly | Victor Lebrun | Conf42 JavaScript 2020,"Oct 21, 2020",146,4.0019,0,2613,2.49
iWpCDH9l8G4,Responsible AI in Health | Tempest van Schaik | Conf42 Machine Learning 2021,"Jul 29, 2021",146,7.1444,2,2236,1.92
4MiJG3IPyWI,One more step in Learning from Incidents | Vanessa Huerta Granda | Conf42 Incident Management 2022,"Sep 29, 2022",145,12.9674,1,2084,2.64
9j-oDghxc30,Time series database: Should I use one? | Anais Dotis-Georgiou | Conf42 Python 2023,"Mar 9, 2023",145,11.0928,2,2880,2.43
GJmPF-Tk4kk,Premiere - Conf42 Quantum Computing 2022,"Jun 30, 2022",145,2.8815,2,1928,1.35
LVSHkqXtETU,Making Software Bill of Materials (SBOMs) Actionable | Ciara Carey | Conf42 DevSecOps 2022,"Dec 1, 2022",145,10.9598,3,2099,2.43
O-k-chlFdO8,Premiere - Conf42 Kube Native 2023,"Sep 28, 2023",145,3.398,5,1973,1.12
7Sg3etadb4w,Creating a Learning Culture | Amir Shaked | Conf42 Chaos Engineering 2021,"Mar 28, 2021",144,8.1944,1,1623,3.27
hHDpuSEOfBM,There's somebody in my package manager! | Thomas Chauchefoin & Paul Gerste | Conf42 DevSecOps 2022,"Dec 1, 2022",144,12.2045,0,3041,0.95
923XbIE0e1c,Let the machines optimize the machines | Stefano Doni | Conf42: SRE 2021,"Oct 30, 2021",142,7.1212,2,938,2.88
NMG_JWYN_28,Reliability 101 | Kolton Andrus | Conf42 SRE 2022,"Jun 9, 2022",142,10.7783,0,2746,2.26
dy_y89Zflmk,Using Qiskit to create Quantum Games | Myron Giannakis | Conf42 Quantum Computing 2023,"Jul 31, 2023",142,5.572,4,2602,1.73
rkfcYDwK_bs,Building Near Real-time Analytics Solution on AWS | Shubhankar Sumar | Conf42 SRE 2021,"Oct 30, 2021",142,9.8878,0,1959,3.62
bRyDk5IFB2Q,Terraform apply secured by Open Policy Agent | Peter ONeill | Conf42 SRE 2022,"Jul 12, 2022",141,10.3845,3,1884,3.4
7Q8P8FABF_k,Improve Resilience with automated chaos engineering | Gunnar Grosch | Conf42 SRE 2021,"Sep 30, 2021",140,12.8147,1,2696,2.26
WwneEVRVeOE,How to be Pythonic? Design a Query Language in Python | Cheuk Ting Ho | Conf42 Python 2021,"Jun 26, 2021",140,7.6765,1,1689,4.2
7s-mx-IEEkc,Hodor: Detecting and addressing overload | Bryan Barkley & Vivek Deshpande | Conf42 SRE 2022,"Jul 12, 2022",139,6.2028,0,4771,0.78
kmaaeJSuhHQ,Art of building secure and scalable Webhooks | Marvin Collins Hosea | Conf42 Golang 2023,"May 21, 2023",139,6.9979,0,3080,2.31
A-39YWIXyag,Addressing Cloud Security with OPA | Josh Stella | Conf42 Open Source Showcase 2020,"Jul 6, 2020",138,7.8428,0,1872,1.66
4ppcsdq_PCM,Exploring Micro-Frontends | Luca Mezzalira & Miko Pawlikowski | Conf42Cast,"Aug 10, 2021",137,10.8533,3,2408,1.45
Qki3nMIzcR4,Threat Modelling in CI/CD environments | Darren Richardson | Conf42 DevSecOps 2022,"Jan 6, 2023",137,10.2544,1,1843,2.33
vslg-W-ox-k,Chaos Engineering: When the Network Breaks | Tammy Bryant Butow | Conf42 Chaos Engineering 2021,"Mar 28, 2021",137,14.0336,1,1964,3.62
yQiISxndExA,Cloud Native Chaos Engineering at scale | Uma Mukkara | Conf42 Chaos Engineering 2021,"Mar 28, 2021",137,12.397,1,2005,3.54
urCJ53iqGSM,Role of Quality Engineers in SRE | Reuben Rajan George | Chaos Engineering 2021,"Mar 28, 2021",136,7.1508,0,1917,3.18
97ugw8qXkis,Role of SRE in DevSecOps | Kalyan Dhokte | Conf42 DevSecOps 2022,"Jan 6, 2023",135,2.4741,0,1831,0.93
dlIYKB8GUuA,Static stability using availability zones | Eduardo Janicas | Conf42 Cloud Native 2021,"Jun 2, 2021",135,13.9243,0,1103,4.44
lhk4cSHtduU,Rust Code Prototyping using XML | John Rexes Murro | Conf42 Rustlang 2023,"Sep 24, 2023",135,2.6935,0,2771,3.36
yexDfQAgLDQ,Future of observability in an experience-driven economy | Rajalakshmi Srinivasan | Conf42 SRE 2022,"Jun 9, 2022",135,13.7959,2,2494,1.72
T8UjctrFPAk,Taking Your DevOps Tooling To The Dark Side | Mike Guthrie | Conf42 DevSecOps 2022,"Jan 6, 2023",134,7.7893,0,2406,1
c-w-WbRrQ9s,Beyond Kubernetes Ingress (with Gateway API) | Shane Utt | Conf42 Cloud Native 2023,"Mar 30, 2023",134,11.4022,4,3427,1.9
pD1Wl0LfB_g,The Observant Developer - OpenTelemetry from code to prod | Roni Dover | Conf42 DevSecOps 2022,"Jan 6, 2023",134,3.3389,0,5299,0.62
437uNCsnG5c,Web applications of the future with TypeScript and GraphQL | Roy Derks | Conf42 JavaScript 2022,"Dec 19, 2022",133,3.4242,1,1232,2.35
u24KSshT2js,Maintaining reliable systems | Ayelet Sachto | Conf42 Chaos Engineering 2022,"Apr 11, 2022",133,5.6332,0,1104,5.07
v6rKfdqlwec,Vector Ops: run vector embedding-powered apps in prod| Daniel Svonava | Conf42 Machine Learning 2023,"Jun 20, 2023",133,11.6325,0,2880,1.6
z_rNQnU1xnU,Top 13 best security practices for Azure | Radu Vunvulea | Conf42 DevSecOps 2022,"Jan 6, 2023",133,2.8603,0,8333,0.37
NPC_gR_gkCc,Observability and SLIC Watch | Diren Akkoc | Conf42 Observability 2023,"Jul 9, 2023",132,3.0952,1,1485,2.96
ViJi1MYViP8,"Application Networking on Kubernetes, where are we now? | Federica Ciuffo | Conf42 Cloud Native 2023","Apr 30, 2023",132,3.2299,2,1489,4.03
mLuqyFSyBaU,Test Driven Development & Golang | Mohammad Quanit | Conf42 Golang 2023,"May 21, 2023",131,4.4624,1,3048,2.1
r3VUCq0gwkM,Go learning by project: Souin (rex) | Sylvain Combraque | Conf42 Golang 2021,"Aug 3, 2021",131,4.4126,1,2497,3.08
UnWnSYiGtTE,Writing queryable APIs with MicroProfile GraphQL | Phillip Kruger | Conf42 Enterprise Software 2021,"May 5, 2021",130,10.5551,4,1533,4.83
wdp1PSunTiw,Zero Trust Security with IoT | Syed Rehan | Conf42 Web 3.0 2022,"Jan 7, 2023",130,5.2116,2,2041,1.71
1K6M7o7FTy4,Unlocking reasoning in Large language models | Logesh Kumar Umapathi | Conf42 ML 2023,"Jun 20, 2023",129,8.7867,2,2684,2.98
8QDxFmm0y50,Scaling WordPress with Next.js | Colby Fayock | Conf42 JavaScript 2021,"Nov 26, 2021",129,10.8695,6,2361,3.13
bsn3f52huUw,Machine learning won't put you out of a job | Jesus Saldana Gonzalez | Conf42 Machine Learning 2022,"May 19, 2022",129,5.5851,1,2187,1.97
7mNesSk7p6A,Interactive command-line tutorials with WebAssembly | Robert Aboukhalil | Conf42 JavaScript 2022,"Dec 19, 2022",128,8.1616,0,1345,2.08
LekPIu5h3QM,Nuclear Rust | John Darrington | Conf42 Rustlang 2023,"Sep 24, 2023",128,8.8642,3,3125,2.21
iUYdO2ZNgms,Organizational Chaos & recipes for Service Ownership | Joey Parsons | Conf42 Chaos Engineering 2021,"Mar 28, 2021",128,7.4633,0,2182,2.93
AtqFi-f9r54,Think like a HACKER | Josh Stella | Conf42 Open Source Showcase 2020,"Jul 6, 2020",127,12.3985,5,1875,2.19
ek-xNIdhbn0,Sustainable API Management | Akshata Sawant | Conf42 DevSecOps 2022,"Dec 1, 2022",127,6.2755,3,2137,3.14
l-3tBjuPv_I,Embracing change: Policy-as-code with OPA and Gatekeeper | Ara Pulido | Conf42 Cloud Native 2021,"Jun 2, 2021",127,13.0844,0,1568,3.38
HaDkQRQSdvE,How to avoid Black Holes when aiming for Resilience? | Alex Williams & Leonid Belkind | Conf42Cast,"Mar 4, 2021",126,5.7628,1,960,1.98
Hn9snYYzeBI,An Introduction to Service Mesh in Action | Jason Dudash | Conf42 Cloud Native 2022,"May 31, 2022",126,9.7792,1,867,2.54
NbAUmoifzdQ,Maximizing Error Injection Realism with System Calls | Long Zhang | Conf42 Chaos Engineering 2021,"Mar 28, 2021",126,11.9155,0,2441,2.05
2UAqgSEtfyc,Internationalisation(i18n) & Localisation(l10n) | Mayank Kumar | Conf42 JavaScript 2022,"Dec 19, 2022",125,5.7812,0,1413,4.25
EsMS7gOBrY4,Secrets-management: challenges from code to cloud | Jeroen Willemsen | Conf42 DevSecOps 2021,"Dec 29, 2021",125,10.2877,0,1898,2.11
lqLu5VhF-_0,Debug NodeJS Applications in Production with Lightrun | Shai Almog | Conf42 JavaScript 2021,"Nov 26, 2021",125,8.1129,3,1690,2.96
rDtTWuSqZrs,APIOps: Harnessing AI for Rapid API Delivery | Rick Spurgeon | Conf42 Platform Engineering 2023,"Sep 7, 2023",125,8.2348,2,4028,1.39
sEsapRQRx0A,"Stop configuring infrastructure, start coding it! | Robert Hoffmann | Conf42 Cloud Native 2022","May 31, 2022",125,10.6112,0,1339,3.06
szdOtPWFuY4,Using WebAssembly for in-database Machine Learning | Akmal Chaudhri | Conf42 Machine Learning 2023,"Jun 20, 2023",125,3.6345,3,4290,1.38
HqDYZ-66p7I,Quantum Machine Learning - the next big thing | Karthiganesh Durai | Conf42 Quantum Computing 2023,"Jul 31, 2023",123,3.2192,2,3049,2.3
WeD_9LnsMyg,Multi-Thread demystified | Atila Fassina | Conf42 JavaScript 2021,"Nov 26, 2021",122,7.5539,3,2268,3.04
XU6FAULTibA,Don't Waste Data | Aditi Ramaswamy & Anisha Biswaray | Conf42 Machine Learning 2022,"Jun 21, 2022",122,2.4,0,1533,3
aidldOBxnJY,The (too) Many Faces Of Architecture | Mihaela-Roxana Ghidersa | Conf42 JavaScript 2021,"Nov 26, 2021",122,8.7491,0,1330,4.36
