Content,Video title,Video publish time,Views,Watch time (hours),Subscribers,Impressions,Impressions click-through rate (%)
Total,,,235902,14853.468,3665,2890095,3.06
syf6ZSiRSbw,Intro to FastAPI | Sebastian Ramirez | Conf42 Open Source Showcase 2020,"Jul 6, 2020",15878,1310.3014,209,199293,4.66
tlQsviAbBxk,Building Python Flask API in google colab | Shweta Mishra | Conf42 Python 2022,"Mar 1, 2022",5851,224.5342,27,20048,6.77
4kdU9_a-gII,WebRTC: The secret power you didn't know Go has | Sean DuBois | Conf42 Golang 2021,"Aug 3, 2021",5584,425.8049,60,40660,4.94
JrCMCdvoMAw,chezmoi - Dotfiles Manager across multiple machines | Tom Payne | Conf42 Open Source Showcase 2020,"Jul 6, 2020",4347,284.4441,18,20255,6.79
PHhOTEYDvHQ,Idiomatic Pandas | Matt Harrison | Conf42 Python 2021,"Jun 26, 2021",4203,312.7255,82,20861,4.62
55TzYYKhEjM,Vue.js form validation with vee-validate v4 | Abdelrahman Awad | Conf42 JavaScript 2021,"Nov 26, 2021",4005,164.5517,18,16544,6.11
KaIbgrYIPQk,DevOps automation with Go | Oliver Fuerst | Conf42 Golang 2021,"Aug 3, 2021",3963,134.2308,31,25218,8.97
yqHxcm0soTU,Distributed tracing for Node.js using OpenTelemetry | Michael Haberman | Conf42 JavaScript 2021,"Nov 26, 2021",3367,264.1227,13,26938,6.58
Vz9rkr_p3Ts,Data-Oriented programming | Yehonathan Sharvit  | Conf42 Enterprise Software 2021,"May 5, 2021",3332,236.6219,14,20786,7.66
Lx2hd_lbhxY,Deploy N applications to N clusters using Argo CD ApplicationSet | Dewan Ahmed | Conf42 SRE 2021,"Oct 30, 2021",2700,204.0401,14,7748,4.75
eXg9m2TM0dE,"Real-time analytics dashboard with Streamlit, Pinot & Kafka | Mark Needham | Conf42 Python 2022","Mar 1, 2022",2477,131.9218,19,17171,5.23
dOE_UEwzgMw,Ent: Making Data Easy in Go | Dmitry Vinnyk | Conf42 Golang 2021,"Aug 3, 2021",2400,112.8526,10,14145,10.6
XBkBpFYAHiw,Gopher in an Event-Driven playground | Tamimi | Conf42 Golang 2022,"Mar 31, 2022",2300,162.9094,35,14767,4.79
jKKJ_yXhXVg,Go - Best practices | Ranjan Mohan | Conf42 Golang 2022,"May 3, 2022",2296,165.9207,16,12516,11.75
Y8EbPFNdwxU,Building applications in the Cloud using Go and the AWS CDK | Vincent Lesierse | Conf42 Golang 2021,"Aug 3, 2021",2144,163.5856,16,14403,7.06
ng8i5KPf6d0,ML time series forecasting methods | Pawel Skrzypek & Anna Warno | Conf42 Machine Learning 2021,"Aug 31, 2021",2142,128.7588,19,20062,6.01
6KXGJKx4WcM,BDD with JUnit 5 and Cucumber | Catalin Tudose  | Conf42 Enterprise Software 2021,"May 23, 2021",2109,132.1498,10,9063,9.83
1aKjHVjQEfc,The Transformation of DevOps and InfoSec in AIoT | Susie Su | Conf42 DevSecOps 2023,"Dec 31, 2023",1909,15.7874,0,1781,1.46
5EJNx1ON1tI,Conf42 OBS Recording Tutorial,,1900,152.5343,7,25,0
zZdlXYGQNew,Delving Deep into the Intersection of AI and IoT | Susie Su | Conf42 Internet of Things 2023,"Dec 14, 2023",1752,14.1392,0,2955,0.98
aRsea6FFAyA,Transaction Management and Repository Pattern | Ilia Sergunin | Conf42 Golang 2023,"May 21, 2023",1739,122.2186,9,7594,5.79
MF7UItjxDWA,Getting Reactive with Relational Databases & R2DBC | Rob Hedgpeth | Conf42 Enterprise Software 2021,"May 5, 2021",1641,182.11,13,11310,7.21
KJV6vspieSM,DDD and FSM: tackling complexity with state machines | Ilya Kaznacheev | Conf42 Golang 2021,"Aug 3, 2021",1629,90.7479,10,8271,5.65
Z9mRyM6eihI,Creating Immersive Generative Art With Go | Preslav Rachev | Conf42 Golang 2021,"Aug 3, 2021",1629,95.0466,14,10109,4.77
tYNaXn2wJJo,MongoDB Schema Design - best practices | Joe Karlsson | Conf42 JavaScript 2020,"Oct 21, 2020",1613,176.4166,22,18134,4.16
BBQPeLYpdLY,Polars: A highly optimized dataframe library | Matt Harrison | Conf42 Machine Learning 2023,"Jun 29, 2023",1458,99.7575,24,15680,6.09
V6v6nnD1qZE,Embracing Hexagonal Architecture with Serverless | Luca Mezzalira | Conf42 JavaScript 2021,"Nov 26, 2021",1414,100.9096,13,3882,7.52
IDIzO55Mz5g,"Flux or ArgoCD, which one to choose ? | Ismael Hommani & Clement Loiselet | Conf42 DevOps 2023","Feb 28, 2023",1337,161.8359,23,12675,6.48
 -Xgv4ZVWORg,Build a prod-ready distributed task queue system with celery | Vishrut Kohli | Conf42 Python 2021,"Jun 26, 2021",1264,84.9345,17,9190,6.03
ycKBGzOHBgQ,Successful Go for microservices architecture | Herve Ah-Leung | Conf42 Golang 2022,"May 3, 2022",1204,78.547,14,9804,6.66
JNUSiwW-cSo,Premiere - Conf42 Golang 2022,"Mar 31, 2022",1158,35.8553,21,5329,3.13
t6r3SgK-bDQ,Deploying a simple Python app to Kubernetes/OpenShift | JJ Asghar | Conf42 Python 2022,"Mar 1, 2022",1157,101.3747,7,8041,5.85
hl98ShsDQ4k,Go Big with Apache Kafka | Lorna Mitchell | Conf42 Golang 2021,"Aug 3, 2021",1109,103.146,13,17798,3.77
NEp8QZKi19s,Premiere - Conf42 Golang 2023,"Apr 20, 2023",1108,27.2658,43,19200,1.05
IpggeW9dO3A,Financial Network Analysis using Python | Kalyan Prasad | Conf42 Python 2022,"Mar 1, 2022",1084,57.4201,10,3352,6.15
mdPIvdgFxMU,Build your own Dependency Injection framework! | Mark Hendriks | Conf42 Enterprise Software 2021,"May 5, 2021",1067,81.942,11,4940,8.66
rqd7OPIa_Zg,Premiere - Conf42 Rustlang 2022,"Sep 1, 2022",1042,24.1686,27,7593,2.82
VHCvISpjaGw,Premiere - Conf42 Chaos Engineering 2021,"Feb 25, 2021",1009,37.3182,19,4973,2.51
6rv-utOAnto,Image Super-Resolution in JS | Kevin Scott | Conf42 JavaScript 2020,"Oct 21, 2020",995,48.2734,8,5489,5.56
H99jI1nwe0g,Chaos Monkey for Spring Boot | John Fletcher & Manuel Wessner | Conf42 Chaos Engineering 2020,"Apr 6, 2020",940,96.8312,8,11174,3.62
OILWd9inkf0,AWS CDK - Best Practices From The Trenches | Ran Isenberg | Conf42 Cloud Native 2023,"Apr 30, 2023",836,83.677,21,4347,5.87
K_m19O-dUJA,Conf42: Explained,"Mar 6, 2021",825,5.8289,5,3083,3.15
ADvD-DfSTSU,The Definitive Deep Dive into the .git Folder | Rob Richardson | Conf42 Python 2021,"Jun 26, 2021",759,79.1152,4,2597,2.54
JtLrlDNdJzg,Post Mortem Culture: Learning from Failure | Yury Niño Roa | Conf42 Chaos Engineering 2020,"Mar 27, 2020",737,23.0584,6,12046,1.3
1Jbmtdjxhjs,"KinD, nGinx Ingress Controller & Secured gRPC server | Mahendra Bagul | Conf42 Golang 2021","Aug 3, 2021",731,54.3923,8,6427,4.64
RRwxStQpox0,Build your first Cyber Forensic Application | Gajendra Deshpande | Conf42 Python 2021,"Jun 26, 2021",725,27.1293,11,5799,7.17
F7wT1QYbhS4,Conf42 speaker intro example - Julie Gunderson,,695,4.6757,2,2,50
PAiK53ucusk,Go development on local k8s with Skaffold | Matan Cohen | Conf42 Golang 2021,"Aug 3, 2021",688,42.1431,8,4757,5.65
96AIQuiffbI,Using our Graphics Library to show them analytics! | Renaldi Gondosubroto | Conf42 JavaScript 2020,"Oct 21, 2020",676,84.1804,2,4392,3.16
dTP4J0GcXxg,Automate your ML workflows with pipelines | Antje Barth | Conf42 Machine Learning 2021,"Jul 29, 2021",662,29.5706,7,3851,5.97
A90IyuRkrPs,Terminal Emulator Basics in Golang | Ishuah Kariuki | Conf42 Golang 2021,"Aug 3, 2021",655,48.6796,6,5733,4.38
Ag0Yn7CzYSY,Fault isolation using shuffle sharding | Andrew Robinson | Conf42 SRE 2021,"Oct 30, 2021",644,53.5084,8,2332,8.58
8AiylKjLVmY,Premiere - Conf42 Golang 2021,"Jun 24, 2021",633,20.3317,24,3930,2.85
xfDDpCNt3LQ,Kubernetes won't save you | Lian Li | Conf42 Cloud Native 2021,"Jun 2, 2021",623,54.5612,8,1992,5.52
I2tVnH_JuHI,Ultimate Guide to Golang Development for Beginners | Huseyin Babal | Conf42 Golang 2021,"Aug 3, 2021",618,26.7805,18,4727,5.54
JHc2An3a0Ws,DevSecOps for AI: Introducing MLSecOps for Software 2.0 | Eugene Neelou | Conf42 DevSecOps 2022,"Jan 6, 2023",613,42.2717,10,9369,1.18
kwAwfkh4vOA,Peernet - an open p2p network standard / implementation | Akilan Selvacoumar | Conf42 Golang 2022,"May 3, 2022",609,27.1835,2,5088,4.72
6m6FUsi4kGc,My Blog is Hilariously Overengineered | Xe Iaso | Conf42 Rustlang 2022,"Sep 30, 2022",601,44.659,3,2379,6.18
ovLKssNavS4,Deploying ML solutions with low latency in Python | Aditya Lohia | Conf42 Machine Learning 2021,"Aug 31, 2021",590,10.5827,2,3345,13.33
yKJ_h0K6liM,Load testing with F1 | Adelina Simion & Andy Kuszyk | Conf42 Golang 2022,"Mar 31, 2022",589,54.3487,8,6994,3.32
51tTd1vl5CM,Design System For Micro-Frontends | Azizi Yazit | Conf42 JavaScript 2021,"Nov 26, 2021",588,28.5416,4,2605,7.26
SJGfZ3RU_3Y,Swiss Army Knife for SaaS Products Build with Go | Huseyin Babal | Conf42 Golang 2023,"May 21, 2023",588,26.1757,15,5556,3.37
xDrvwMK9BmQ,"Memory Management in Go: The good, the bad and the ugly | Liam Conroy Hampton | Conf42 Golang 2023","May 21, 2023",584,51.1324,1,3053,7.86
kN1uhKzGsyY,gRPC in Python. Build fast scalable APIs for your services | Aditya Mattos | Conf42 Python 2023,"Apr 11, 2023",582,35.839,4,4822,6.78
KcEDAMHvpis,Benchmarking JVM Warm-Up Performance | Frank Kriegl | Conf42 Enterprise Software 2021,"May 5, 2021",581,42.1894,2,4844,5.45
inPkJkPBfas,Go with Workflows | Walter Demian Schroeder | Conf42 Golang 2022,"Mar 31, 2022",570,24.2466,5,6048,4.37
vTzV1OdbUCk,Premiere - Conf42 DevOps 2023,"Jan 26, 2023",570,27.3143,22,9274,1.06
vrojmYRHxwY,Reproducible Builds with Bazel | Gaspare Vitta | Conf42 Python 2021,"Jun 26, 2021",567,29.3502,6,4017,4.58
LCXyBzHEqFM,Event-driven applications: Apache Kafka and Python | Francesco Tisiot | Conf42 Python 2021,"Jun 26, 2021",564,46.0851,8,4083,4.51
wGkaYfcHDfs,Reinventing Speech-to-Text Transcriptions with Go and Whisper | Pratim Bhosale | Conf42 Golang 2023,"May 21, 2023",547,16.6541,4,4406,6.51
TEZOZQUcplM,Scalable event-driven applications with NestJS | Dmitry Khorev | Conf42 JavaScript 2022,"Dec 19, 2022",535,24.5241,6,3930,3.61
7k6gYZa6BVg,How to be WRONG | Russ Miles | Conf42 Chaos Engineering 2020,"Apr 1, 2020",521,45.2693,5,2682,2.61
jQOxsvdyx04,Every CISO’s First 90 Days on the Job | Gordon Rudd | Conf42 Golang 2021,"Aug 3, 2021",520,106.9028,10,4389,6.88
KblJ1XbXtDs,Premiere - Conf42 Cloud Native 2021,"Apr 29, 2021",515,22.3453,13,3093,2.23
peSUrYj8bhs,What I learned creating a CLI with Go | Lais Lima | Conf42 Golang 2023,"May 21, 2023",510,20.4262,6,4152,6.5
booybxZW_Yk,Premiere - Conf42 Site Reliability Engineering 2021,"Sep 30, 2021",507,38.0464,18,3868,2.51
1s-hXnjHEHI,Object Detection using Transformers and CNNs | Eduardo Dixo | Conf42 Machine Learning 2021,"Aug 31, 2021",502,19.6551,4,5761,4.69
2Spu3SQSMjQ,Premiere - Conf42 JavaScript 2022,"Nov 17, 2022",472,14.0675,9,3274,2.32
WLz5QLb1Od8,Premiere - Conf42 Site Reliability Engineering (SRE) 2023,"May 4, 2023",466,16.0398,14,4796,2.4
miMm7qGMqLw,Generate pages on demand: ISG With Layer0 and Nuxt.js | Rishi Raj Jain | Conf42 JavaScript 2021,"Nov 26, 2021",461,11.5444,2,1312,5.64
_V_Nd85Ihsg,Build your own search application with Weaviate | Laura Ham | Conf42 Machine Learning 2022,"Jun 21, 2022",453,34.3992,4,3853,4.88
JXA6XC9WB6w,Premiere - Conf42 Quantum Computing 2023,"Jun 29, 2023",450,10.4439,10,5183,2.1
xNhWZkBslUQ,Chaos engineering for serverless | Gunnar Grosch | Conf42 Chaos Engineering 2022,"Mar 10, 2022",444,42.6605,2,2505,2.48
l3gvFLi-4FA,Multi Region Terraform Deployments | Lerna Ekmekcioglu & Jack Iu | Conf42 Chaos Engineering 2022,"Apr 11, 2022",440,25.0489,2,2415,5.88
fab-dLCsNOQ,Enterprise SRE adoption framework | Vishnu Vardhan Chikoti | Conf42 SRE 2021,"Oct 30, 2021",439,25.9023,4,1651,5.39
1NPgN91FrPU,Premiere - Conf42 Python 2023,"Mar 9, 2023",436,11.8664,8,2832,1.48
h4yC0MGWrHQ,A gentle introduction to Vector Databases | Zain Hasan | Conf42 Machine Learning 2023,"Jun 20, 2023",433,48.7325,7,3590,2.34
Ve1KaLVhwIM,Premiere - Conf42 Python 2022,"Jan 27, 2022",432,17.6599,11,5270,1.2
mL9ocOBg2y4,Form Validations with VEST | Alush Evyatar | Conf42 JavaScript 2020,"Oct 21, 2020",431,29.7961,2,2551,5.06
5Q5_vuHdOkI,Chaos Experiments under the lens of AIOps | Michele Dodic | Conf42 Chaos Engineering 2022,"Apr 11, 2022",423,21.1433,1,1143,3.24
9TN138O3PbQ,Premiere - Conf42 Chaos Engineering 2023,"Feb 16, 2023",418,11.683,13,3150,1.94
VKl51fi2gm0,Let's talk about Kubernetes Cluster Monitoring | Twinkll Sisodia | Conf42 Kube Native 2022,"Nov 20, 2022",418,6.7007,2,18305,0.71
HARyWxc6TZg,Building Blockchains on the Go | Luis Cardoza Bird | Conf42 Golang 2021,"Aug 3, 2021",412,23.5799,9,5278,4.87
dO6hM1PsyZk,Go Serverless! | Savas Ziplies | Conf42 Golang 2022,"May 3, 2022",412,30.9263,1,4598,5.09
9dPQ0DDGVO4,Maps with Django | Paolo Melchiorre | Conf42 Python 2021,"Jun 26, 2021",406,15.7134,5,3967,5.6
Lxtr9h0Xkqc,Shifting left chaos testing | Pablo Chacin | Conf42 Chaos Engineering 2023,"Feb 16, 2023",405,20.7473,4,8635,0.98
MgaXliEYVCU,Learn Rust By Building CLI Tools | Jim Lynch | Conf42 Rustlang 2023,"Sep 24, 2023",405,21.2836,7,6199,4.1
pvwvRi6iMds,Shopyo: Your Mega Flask Machine | Abdur Rahmaan Janhangeer | Conf42 Python 2021,"Jun 26, 2021",403,11.9483,1,2023,1.88
JsiwcZkH75c,Beginning your own data engineering projects | Hui Xiang Chua | Conf42 Python 2021,"Jun 26, 2021",401,15.2593,7,3975,4.55
FclEiSDfX14,Premiere - Conf42 Site Reliability Engineering 2022,"Jun 9, 2022",400,24.1239,12,3222,2.39
slyuCb4HgH4,A Developer’s Introduction to Service Mesh | Rosemary Wang | Conf42 Cloud Native 2022,"May 31, 2022",399,32.8753,2,4469,2.62
nApPLgPfPYM,Shipping Quality Software in Hostile Environments | Luka Kladaric | Conf42 Chaos Engineering 2020,"Mar 28, 2020",388,37.3681,3,2693,3.68
AyRhi92v9O0,Doing GitOps for multi-cloud using Crossplane & Flux2 | Leonardo Murillo | Conf42 Cloud Native 2021,"Jun 2, 2021",384,45.0799,4,2754,3.3
HpdBZhmVuqQ,Moving from the Openstack Magnum to the Cluster API | Andrei Novoselov | Conf42 Cloud Native 2023,"Mar 30, 2023",381,31.0813,8,2853,3.65
4mNHGg2yNyI,Delivering successful API integrations | Jose Haro Peralta | Conf42 Python 2021,"Jun 26, 2021",377,12.9158,0,2130,4.79
FazRUwBWPUI,Debugging a container with a sidecar using Gefyra | Michael Schilonka | Conf42 Cloud Native 2022,"May 31, 2022",376,34.1825,2,2089,5.07
SBifB5-9naA,Concurrency for beginners | Jayaganesh Kalyanasundaram | Conf42 Golang 2021,"Aug 3, 2021",374,10.6571,3,3776,3.84
vBDkhEA-Lfs,Building CLI apps using Go | Abhisek Pattnaik | Conf42 Golang 2023,"May 21, 2023",372,20.5306,3,4596,4.18
PBbgCGep6NU,Premiere - Conf42 Python 2021,"May 27, 2021",368,15.3252,11,3874,1.65
mdwAMxxKKRA,Reliability in the Face of Uncertainty | Benjamin Wilms | Conf42 Chaos Engineering 2023,"Feb 16, 2023",368,11.4165,2,54480,0.18
DWBIDrAi4zo,Debugging JVM performance issues |  Ranjan Mohan & Silvia Siu Luo | Conf42 Enterprise Software 2021,"May 5, 2021",366,26.0358,4,3170,5.93
UlmCJl8ZsT4,Machine Learning in Production - MLOps | Ryan Dawson | Conf42 SRE 2020,"Aug 9, 2020",365,17.3008,7,16420,0.77
g_gHnBcdov8,Platform Engineering: Why and How to start | Serg Hospodarets | Conf42 DevOps 2023,"Feb 28, 2023",365,25.3376,5,2357,3.22
ch6Nqy9N7dA,Premiere - Conf42 JavaScript 2023,"Nov 16, 2023",362,10.1272,8,39339,0.31
GRX3OAWtLfo,Pushing Rust to the limit in a Blockchain Environment | Andrei Marinica | Conf42 Rustlang 2022,"Sep 30, 2022",361,31.1839,3,15393,0.67
UBqouRXnslA,Self Healing Systems | Nick Hodges | Conf42 Chaos Engineering 2022,"Mar 10, 2022",357,30.9647,5,3321,4.52
UvnBJr4-xX4,Quantum-Resistant Native Go Programs: Taking the Leap | Mathilde Raynal | Conf42 Golang 2021,"Aug 3, 2021",357,15.1777,3,2718,3.5
2Py4tQWBrkg,Get maximum benefit from zero-cost abstractions | Tim McNamara | Conf42 Rustlang 2022,"Sep 30, 2022",354,29.5918,2,3268,2.51
qSd7hhao3vk,Build Cloud Infrastructure using Python | Sohan Maheshwar | Conf42 Python 2021,"Jun 26, 2021",354,22.6321,4,2834,5.33
LMa3gQR1jFU,Truth about running Cloud Security Assessments in 2021 | Ashish Rajan | Conf42 Cloud Native 2021,"Jun 2, 2021",353,22.971,18,2217,3.56
GK91Q5vLHjc,Andela: Bringing the future of work to life | Agnes Muthoni | Conf42 Golang 2022,"Mar 31, 2022",349,11.4746,5,5169,3.17
xGYPbrbHBls,"Terraform Practices - The Good, the Bad and the Ugly | Hila Fish | Conf42 Cloud Native 2022","May 31, 2022",347,24.0116,2,1484,5.12
ATqDrIkA8fA,Building Super Powered HTML Forms with JavaScript | Austin Gil | Conf42 JavaScript 2021,"Nov 26, 2021",346,24.67,6,1767,1.92
Ja41H7RWY7I,Premiere - Conf42 Rustlang 2023,"Aug 24, 2023",345,9.953,17,3756,2.26
c8Tjbmq66UU,Techniques for SLOs and Error Budgets at Scale | Fred Moyer | Conf42 Observability 2023,"Jul 9, 2023",341,23.2508,3,3667,0.82
UvOdp38QVMs,Building our own custom Code Insight tool | Adelina Simion & Ross McFarlane | Conf42 DevSecOps 2021,"Dec 2, 2021",340,20.526,1,2499,2.76
Ta5Lq2kbiQQ,Natural language modelling- BlazingText algorithm | Dinesh Subramani | Conf42 Machine Learning 2021,"Aug 31, 2021",338,31.5642,1,3640,4.84
bmZGbXNftGg,"I've finished, it's working... only tests left..!? | Tal Doron | Conf42 JavaScript 2021","Nov 26, 2021",337,11.7022,1,1580,6.33
MRm1lJOShhg,Unikernels and NanoVMs | Ian Eyberg & Miko Pawlikowski | Conf42Cast,"Nov 1, 2022",334,50.1008,5,4428,1.38
WLu6NKYqFQs,Learn BabylonJS to Create 3D Metaverse Environments | Griffin Solot-Kehl | Conf42 JavaScript 2022,"Dec 19, 2022",334,19.9078,7,3047,4.92
g01ObyU3aEU,Chaos Engineering in 2021 | Mikolaj Pawlikowski | Conf42: Chaos Engineering,"Mar 28, 2021",333,34.235,2,2368,4.9
N3NAlHlLv5I,Cryptpad - the Encrypted Collaboration Suite | Ludovic Dubost | Conf42 Open Source Showcase 2020,"Jul 6, 2020",332,23.5335,1,4161,3.27
OZ-958Ig3kw,Multilingual Natural Language Processing | Gajendra Deshpande | Conf42 Machine Learning 2021,"Aug 31, 2021",331,11.8997,2,3951,4.96
Y-URSLmIPIg,"Struct Embedding, Instrumentation and Code Generation | Jesus Espino | Conf42 Golang 2021","Aug 3, 2021",329,22.6286,9,2879,5.7
dSug-XCD8S4,How Static Code Analysis Prevents You From Waking Up at 3AM | Xe Iaso | Conf42 SRE 2022,"Jul 12, 2022",326,14.955,0,20617,0.55
UoS8Ek1nzlQ,Premiere - Conf42 Cloud Native 2022,"Apr 28, 2022",324,18.8469,9,2646,2.72
kCMk7mViP58,Macrocosm of Microapis | Jose Haro Peralta & Miko Pawlikowski | Conf42Cast,"Jun 8, 2021",324,7.6553,1,1513,4.36
PjHH2JiND0o,Premiere - Conf42 Observability 2023,"Jun 8, 2023",322,8.1932,10,3867,2.61
qZO6m7stVSg,How to deal with technical debt | Alexandre Omeyer | Conf42 JavaScript 2021,"Nov 26, 2021",319,21.7398,3,1146,4.28
3IT4UzN9Jds,Level Up Your CI/CD With Smart AWS Feature Flags | Ran Isenberg | Conf42 DevSecOps 2022,"Jan 6, 2023",318,20.3106,7,1331,1.2
DGajwPBwyC4,Serverless Architecture for Product Defect Detection | Mohsin Khan | Conf42 Machine Learning 2022,"Jun 21, 2022",314,7.5521,8,1345,4.24
NTLdCNeBtI4,Premiere - Conf42 Chaos Engineering 2022,"Mar 10, 2022",313,13.4457,9,2584,2.63
h6kzwaBwrCY,Premiere - Conf42 Machine Learning 2021,"Jul 29, 2021",311,9.7155,10,1919,1.88
0C12lOefMH8,Premiere - Conf42 JavaScript 2021,"Oct 28, 2021",310,13.5857,11,2636,2.05
4VosMeJlvWA,Journey to Resilience | Vilas Veeraraghavan | Conf42 Chaos Engineering 2020,"Apr 2, 2020",310,24.4106,1,2619,2.33
AiavxedXWJA,Complex AI Forecasting Methods for Investments | Pawel Skrzypek & Anna Warno | Conf42 Python 2021,"Jun 26, 2021",307,13.2581,1,2261,4.25
1F5sGy3ONW4,Deep-dive into Open Policy Agent + Conftest + GateKeeper | Noaa Barki | Conf42 Cloud Native 2022,"May 31, 2022",304,33.0884,0,2063,6.06
lSguqR93rjs,Premiere - Conf42 Enterprise Software 2021,"Mar 25, 2021",304,8.5252,6,1612,2.11
iIr5xgwJWAI,Shift Left your Performance Testing | Hari Krishnan | Conf42 SRE 2021,"Oct 30, 2021",303,27.2579,3,1939,6.55
_nG0p3Dl4No,Premiere - Conf42 Machine Learning 2023,"May 18, 2023",302,6.4913,6,2615,2.33
cZCbfHBqzlQ,Microservices from a DevOps perspective | Gaston Cacheffo | Conf42 DevOps 2023,"Jan 26, 2023",301,20.107,2,6035,1.52
xM8myEOM2yQ,Go to the Edge | Liam Hampton | Conf42 Golang 2022,"Apr 4, 2022",301,17.9291,3,4718,2.73
Xi6bZ4tl-Qk,AI-driven DevOps CI/CD pipelines | Michele Dodic & Francesco Sbaraglia | Conf42 DevOps 2023,"Feb 28, 2023",300,20.4622,2,1315,4.49
gjU-X6YnV1A,Premiere - Conf42 Cloud Native 2023,"Mar 30, 2023",300,14.0559,5,2914,1.51
agNoLB67PxI,GPT: Revolutionizing Monitoring and Logging Systems | Clay Langston | Conf42 SRE 2023,"Jun 4, 2023",296,16.095,5,5331,2.96
9TMor_Yqypw,Secure coding in iOS | Julio Cesar Fernandez Munoz | Conf42 Mobile 2022,"Mar 18, 2022",292,28.8622,7,2131,5.44
jllPMWL5rK8,A Gentle Introduction to Building Data-Intensive Applications | Joe Karlsson | Conf42 Golang 2022,"May 3, 2022",292,23.886,5,3283,4.02
hnoahDG03P0,Security Chaos Engineering | Yury Niño Roa | Conf42 SRE 2020,"Aug 9, 2020",291,15.573,5,8822,1.11
4cRqm8sSUjs,Learning Go when you don't know how to code | Miriah Peterson | Conf42 Golang 2021,"Aug 3, 2021",290,21.479,3,2310,5.5
jMPbo7rkKbA,Webiny | Sven Al Hamad | Conf42 Open Source Showcase 2020,"Jul 6, 2020",289,15.5222,1,3551,4.87
VlI7Ke9JYV4,Testing in Go: 101 | Francisco Daines | Conf42 Golang 2022,"May 3, 2022",288,37.443,4,3556,4.11
DXSWUkXUFPw,Leveraging the power of State Machines in Swift | Frank Courville | Conf42 Mobile 2022,"Mar 18, 2022",286,21.9936,0,1497,4.48
kq07tygRWAk,Graviton2: How Honeycomb Reduced Infra Spend by 40% | Shelby Spees | Conf42 Cloud Native 2021,"Jun 2, 2021",284,15.8944,1,1063,3.39
1m9bZ8ztl6s,The art of programmatic videos with rust | Dmitriy Kovalenko | Conf42 Rustlang 2022,"Sep 30, 2022",282,24.036,5,2117,4.58
Zl0q_JJzCUQ,The Path to self-healing systems | Leonid Belkind | Conf42 Chaos Engineering 2021,"Mar 28, 2021",282,34.2423,3,2486,5.27
9pBMn3DwHNY,SREs ❤️ Chaos Enegineering | Mikolaj Pawlikowski | Conf42 SRE 2020,"Aug 16, 2020",281,24.8772,4,2404,2.41
mDf0Zf2iBJY,Microsoft SQL Server HA/DR on AWS | Asif Mujawar | Conf42 SRE 2021,"Oct 30, 2021",280,35.1618,3,3859,3.94
NWjh8MY51o8,Monitoring AI Pipelines Output As Product | Hila Fox | Conf42 Machine Learning 2021,"Aug 31, 2021",279,7.8076,1,1708,3.22
TD9q_7j1ok0,Building Scalable Data Pipelines With Argo Workflows | David Joyce | Conf42 Kube Native 2022,"Nov 20, 2022",279,19.8559,2,2463,3.45
umQmXykeqL4,Premiere - Conf42 DevSecOps 2021,"Dec 2, 2021",277,10.9837,6,2026,2.17
4EzFGpfwfb0,Premiere - Conf42 Incident Management 2022,"Sep 29, 2022",276,9.289,0,1834,2.94
HS-BSZcyZIA,Blazing fast serverless with Rust | Luca Bianchi | Conf42 Rustlang 2022,"Sep 30, 2022",276,17.0666,3,3376,3.58
XKMpl2b4jOk,What is Data Reliability Engineering? Why it is Crucial? | Miriah Peterson | Conf42 SRE 2022,"Jul 12, 2022",276,21.976,5,2454,6.28
xawcd75C3M4,Breaking Into Blockchain Development with JavaScript | Jay McCarthy | Conf42 JavaScript 2021,"Oct 28, 2021",276,35.9011,4,2826,3.43
tAvLKsnNJVg,Extending Redis with Rust | Brian Sam-Bodden | Conf42 Rustlang 2022,"Sep 30, 2022",274,23.979,4,3957,2.81
B9_WBz4VJO8,Risk-Driven Fault Injection for Fast & Furious | Kennedy Torkura | Conf42 Chaos Engineering 2021,"Mar 28, 2021",272,21.6967,2,2408,3.7
M0OZgqtI51c,Building Awesome UI Apps with VUE | Ahmed Bankole | Conf42 JavaScript 2020,"Oct 21, 2020",272,7.8174,5,3410,2.55
IucrT-g1OxI,Modern Development of Distributed Apps: Service Weaver | Robert Grandl | Conf42 Cloud Native 2023,"Apr 30, 2023",271,20.9592,2,1974,6.53
eOe3sxE_AkI,LanceDB: A OSS serverless Vector Database in Rust | Lei Xu | Conf42 Rustlang 2023,"Sep 24, 2023",268,14.0302,2,5028,3.14
mvImyJ1ttN8,Building interactive reports in Streamlit with ipyvizzu | Peter Vidos | Conf42 Python 2023,"Apr 11, 2023",268,12.9946,1,2800,3.11
yoNoEKZXgMY,🚀 Supercharge your Node.JS with Rust | Dmitry Kudryavtsev | Conf42 Rustlang 2022,"Sep 30, 2022",267,17.9712,1,2696,3.75
kQEYUtpDWjQ,"Stop being a YAML engineer, be a software engr. with CDK8s | Robert Hoffman | Conf42 JavaScript 2022","Dec 19, 2022",265,23.9604,2,4359,3.07
62rNT-bo1G0,The Perfect Code Review | Victor Rentea | Conf42 Enterprise Software 2021,"May 5, 2021",262,13.5399,1,1594,6.52
B0zf4a9T8jo,Application-Level Chaos Engineering in JVM | Long Zhang | Conf42 Chaos Engineering 2020,"Apr 5, 2020",262,18.0976,1,3101,3.42
gTjPWm_N2UE,How to Raise Your Profile as a Developer | Lauren Schaefer | Conf42 JavaScript 2021,"Oct 28, 2021",261,16.8254,6,2338,3.29
pdupvWTjBCw,Premiere - Conf42 DevSecOps 2022,"Dec 1, 2022",261,11.4597,3,2418,1.99
6bAqj6B4m-Q,Blameless Postmortem Culture | Pranjal Deo | Conf42 Chaos Engineering 2021,"Mar 28, 2021",260,21.323,2,3862,2.59
5-nlCxeQUF4,Cyber Chaos Engineering | Aaron Rinehart & David Lavezzo | Conf42 Chaos Engineering 2021,"Mar 28, 2021",257,33.2339,0,3320,2.95
c63JZRgRxIQ,Chaos Engr at Microsoft with Azure Chaos Studio | John Engel-Kemnetz | Conf42 Chaos Engineering 2022,"Mar 10, 2022",257,29.9492,1,3623,3.28
4R7qCQLjz2Y,Low Overhead Python Application Profiling using eBPF | Yonatan Goldschmidt | Conf42 Python 2022,"Mar 1, 2022",256,12.1108,2,1912,5.49
uAsYYSGyx8c,Elephant in the Blameless War Room - Accountability | Emily Arnott & Christina Tan | Conf42 SRE 2021,"Sep 30, 2021",256,28.4789,1,2918,2.4
Z3dZ-LzS8Gc,PyO3: Rust 💚 Python | Moshe Zadka | Conf42 Python 2023,"Apr 11, 2023",255,9.8641,2,2807,6.2
pEPhcoyV474,Building Slack Applications with Bolt.js | Alba Rivas | Conf42 JavaScript 2022,"Dec 19, 2022",255,9.8737,2,2462,5.93
ET7aLG_Rfkw,Python and the New MySQL Shell | Dave Stokes | Conf42 Python 2021,"Jun 26, 2021",253,11.5292,6,1514,7.4
TMgpgW2_Ht0,Just-in-time Nodes for Any AWS EKS Cluster: Karpenter | Samuel Baruffi | Conf42 Cloud Native 2023,"Apr 30, 2023",250,37.3205,10,4571,3.04
w31oh7ulXwI,Building Scalable Applications with GQLGen & AWS Lambda | Durgaprasad Budhwani | Conf42 Golang 2023,"May 21, 2023",249,13.1811,1,4018,2.44
u-odNsW5qvI,How Did I Become Devops Engineer! | Megha Kadur | Conf42 Kube Native 2022,"Nov 20, 2022",248,9.5937,2,3957,3.23
8DBTffP4KK8,Premiere - Conf42 Platform Engineering 2023,"Sep 7, 2023",247,4.9628,9,6386,0.63
IfL6J_6el7E,"Go and Redis, better together! | Abhishek Gupta | Conf42 Golang 2023","May 21, 2023",247,29.899,4,3648,2.55
ZV7fLrC137Y,"Panel Discussion | Nora Jones, Erin McKeown & Charity Majors | Conf42 Incident Management 2022","Sep 29, 2022",246,39.0329,1,2695,3.04
g6l7gbrmObo,goyek - using Go for automation | Robert Pajak | Conf42 Golang 2023,"May 21, 2023",246,12.5573,2,4241,3.42
qgHWzQ2zcqQ,Postmortem Culture at Google | Ramon Medrano Llamas | Conf42 SRE 2022,"Jul 12, 2022",245,16.9302,1,2997,3.27
bjumLUNzwUk,Simpler and more flexible Kubernetes Ingress: Apache APISIX | Wei Jin | Conf42 Cloud Native 2022,"May 31, 2022",243,11.0742,3,1583,5.5
